"어촌안심여행지] 전북 군산시 선유도마을, 강원 강릉시... "
"가을철 몸보신 음식은 미꾸라지 문어, 추천 여행지는 강릉시... "
강원도 강릉시 여행지/관광지/명소 추천
[강원 강릉] 미식과 낭만이 공존하는 경포호 당일치기 여행지
[강원 강릉] 바다보러 당일치기 강릉 여행 + 강릉 여행지... 
강릉 겨울바다 여행지 강문해변 풍경
강원도의 겨울이야기! 강원네이처로드 ㅣ 겨울철 추천 여행지
[강원 강릉시 사천면] 아이들과 체험하기 좋은 강릉가볼만한곳... 
"[강원/강릉] 아르떼뮤지엄 + 티바 _ 여름 실내여행지, 강릉... "
강원 9월여행지 강릉 솔향수목원 다도체험
"캠페인 방역 우수 관광지 중 강원, 경기, 충북, 충남 소재 여행지"
비경으로 가득한 강원ㆍ가족과 함께 떠나기 좋은 강원 여행지 7곳!
"[강원/강릉] 국내 최초 화폐... 국내 여행지 추천, 강릉여행지... "
"강원 강릉 가볼 만한 곳, 과객... 좋은 강릉 겨울 여행지 추천"
강릉 가볼만한곳 겨울 아이와 강원도 겨울여행 강릉 여행지
겨울 바다 여행 추천 강릉 여행지 가볼만한곳 주문진 해변 BTS... 
강원도 강릉 여행지 추천 먹거리 볼거리 가득한 강릉핫플... 
"12월 국내여행지 추천, 겨울여행은 여기로 떠나요!"
강원도 강릉 여행 코스 볼거리 먹거리 10월 여행지
"강원 평창 가볼 만한 곳, 양떼목장, 월정사, 국내 겨울 여행지 추천"
"강원도 강릉 갈만한곳 솔향수목원, 선교장 강릉 여행지 추천"
강원도 강릉 가볼만한곳 먹거리 여행지 추천
경포호 강릉서부시장 경포등축제 야경 및 강원도 여행지 추천
국내 가을 여행지 추천 강릉 갈만한곳 메타세콰이어길... 
[강원/강릉시] 더블티다이닝 :: 특별한 메뉴가 있는 강릉 레스토랑
주말 여행지 추천 10월 강원도 축제 2023 강릉커피축제 강릉... 
"[강원 강릉시] 어부촌 생선구이,주문진 회센터 팔팔횟집,"
[강원] 정동진 모래시계공원... 정동진여행지 다녀오다
아이와 함께 방문하기 좋은 겨울 여행지 강릉 뒷뜨루관광농원
겨울 여행지 푸른 바다가 보이는 강원도 정동진역 도착
♬ 로컬100에 선정된 강원문화매력 20가지 공개 ♪
[강원] 여행지&amp;먹거리 :: curation by zrungee
당일치기 계획하는 뚜벅이에게 추천하는 강릉 여행지
강원도 가을 여행 국내 10월 11월 여행지 추천 베스트 4
강원도 강릉 가볼만한곳 여름... 명소 먹거리 바다 강릉 여행지
강원도 여행지 안목 해변 강문 솟대다리 아르떼뮤지엄... 
봄나들이 강원도 여행지 추천 강릉 여행 코스 볼거리 먹거리
국내여행지추천 - 강릉여행 1박 2일
국내 여행지 추천 강원도 강릉 여행 추천 코스
강원도 강릉가볼만한곳 여행지 BEST 5
강원도 강릉 드라이브 코스 관광지 월화거리 강원도 여행지 추천
강원도 여행지 추천 강릉 갈만한곳 10월 강릉 커피축제 경포호수
국내 여행지 추천 강원도 강릉 중앙 시장 먹거리 주차장
강릉시 교동 / 신성원식당 - 하이브리드 곰치국
강릉 당일치기 여행코스 주문진대게 맛집 오죽헌 국내 여행지
강원도 가볼만한곳 강릉 속초 여행 코스 국내 1박2일 여행지
강릉 놀거리 강릉 명소 당일치기 강원도 여행지 추천
[여행지 추천]2월 여행지-강원도 강릉
강릉 1박2일 여행지 코스 갈만한곳 BTS버스정류장 등
강원도 여행지 추천 산책하기 좋은 허균 허난설월기념공원
국내 겨울 여행지 추천 눈 덮인 경포호 포함 3곳
강릉 오션뷰 펜션 힐링 끝판왕 감성 추천 여행지... 
뚜벅이를 위한 1박2일 강릉여행지 모음. zip ♥
강릉 강문해변 강원도 솟대다리 여행지 추천
아들바위공원 BTS버스정류장 1박2일 강원도 여행지 펜션 숙소
[강원 강릉] 강릉중앙시장맛집 강릉중앙시장회포장 추천... 
(강원여행) 정동진 썬크루즈호텔 월정사 계곡 강원도여행지추천
국내 여행지 추천 강릉 중앙시장 시간 먹거리
봄에 가볼만한곳 당일치기 강릉 여행지 선교장 등 5곳
"강릉 펜션, 감성 넘치는 오후세시 펜션, 국내 여행지 추천"
가볼만한곳 강릉여행코스 하슬라아트월드 강원도 여행지 추천
강릉 가볼만한곳 여름 국내 여행지 추천
국내 강원도 여행지 추천 강릉 양양 강문 안목 해변
"9월, 10월 국내여행지 베스트10 추천 : 서울근교 포함... "
[공간대여포커스] 강원도 강릉시 당일캠핑장 : 강릉여행... 
"강원도 강릉 가볼 만한 곳... 대관령양떼목장, 9월 국내여행지"
[강원 강릉시] 2019.11.15 가족여행
가볼만한곳 강릉여행코스 하슬라아트월드 강원도 여행지 추천
방방곡곡 여행지 속 우체통 (동해편) (새해 일출 장소 추천)
강릉임해자연휴양림과 초당순두부마을로 떠나는 강릉 여행지 추천
크리스마스 선물 여행지 추천 / 강릉 여행 놀거리 소품샵... 
강릉 당일치기 여행 갈만한곳 강원도 여행지 추천 BEST 코스... 
강원 드라마 촬영지 (TV 속으로)
가을 최고 힐링여행지 : 강릉 경포호에서 먹고 걷고 즐겨요!
"반려견 동반 보리울마을 캠핑장, 강원도 가을 여행지 추천"
&lt;강원 강릉시 강릉교육문화관&gt; 아이와 함께 강릉교육문화관에서... 
가을 풍경이 아름다운 강릉 추천여행지 경포생태저류지
"[EV Trip] 전기차로 강릉 여행, 강릉 전기차 여행지 추천!"
강원도 강릉 가볼만한곳 8월 여름 국내 여행지 추천
[강원] 소돌막국수 | 막국수 달인이 운영하는 주문진 막국수... 
[강원/강릉] 사천해변 오션뷰 카페 곳
강원도 겨울 바다 여행지 추천 강릉 경포해변 경포해수욕장... 
9월 국내여행지 놀러갈만한곳 BEST 5
강릉 명소 뚜벅이 여행 강릉 자유이용권 국내 여행지 추천
강원도 가을 여행지 갈만한곳 알찼던 장소 BEST5
강릉 주문진 오션뷰 스파펜션 겨울 힐링 여행지로... 
겨울철 강릉 실내여행지_미디어 아트 아르떼뮤지엄 강릉
[강원/강릉] 직접 가본 강릉 여행지 추천! 강릉 커플 여행지... 
강원도 강릉 가을여행지 핑크뮬리명소 호린파크 볼거리 입장료... 
&lt;테라로사&gt; / 강원 강릉시 구정면 어단리 / 201305
강릉 여행지 추천... 강릉시 볼거리 먹거리 관광코스... 강원도... 
&lt;강원 강릉시/경포호&gt;경포호에서 찍은 반영....그리고... 
강원 강릉시 정동진시간박물관 부제:세상에 이런 일이...! 이런... 
강릉 가볼만한곳 국내 5월 여행지 동물농장 정동진 경포대 외~
[강원 강릉] 안반데기와 안목해변에서 아침과 저녁 보내기
국내 겨울 여행지 추천 대관령 양떼목장 &amp; 영금정
강릉여행지  강릉시 향토 민속관
[랜선 강릉] 강릉 이색 실내 여행지 경포 아쿠아리움
강릉여행지추천 강릉핫플레이스 강릉시내 임당동 초이스컵
[강원 강릉시 초당동] 순두부 맛집 동화가든 여행지에서 맛 본... 
강릉 1박2일 여행 재밌는 여행지 주문진수산시장 외
강원도 강릉 가볼만한곳 하슬라아트월드 외 여행지
강릉 가볼만한 곳 강릉 여행지 대도호부관아
"강릉 가성비 오션뷰 펜션, 언제나소돌, 하프오션뷰"
강원도 강릉 가 볼만한 곳 오죽헌  &amp; 강릉화폐전시관
"강릉시, 지역관광거점도시에 선정! 강릉의 매력"
강원도 여행지 강릉 여행 코스 강릉 관광지와 먹거리 추천
"강원 강릉 가볼 만한 곳... 곳, 강릉 실내 가볼만한 곳... "
겨울여행지 눈부시게 아름다운 경치를 품은 예쁜바다  TOP3
가을 강원도 여행지 추천 BEST 강릉 오죽헌 외 솔향투어
강릉 장칼국수 맛집 세인트존스호텔 앞 최씨장칼국수 강릉 먹거리
강릉중앙시장 먹거리추천 /강릉여행/강릉가볼만한곳/강릉여행지
하슬라아트월드 리얼후기! (강릉여행지주천 I 강릉가볼만한곳)
강릉 한식 맛집 모두가 만족했던 초당옥
강원도 강릉 꼭 가야할여행지추천 [정동심곡 바다부채길]
[포이톡톡] 6월 국내 여행지 추천! 걷기 좋은 산책길 코스
6월 7월 국내 여행지 추천 눈부시게 푸른 녹음 위주 BEST 5
[여행] 강원 강릉 중앙시장 맛집 &amp; 먹거리 및 주차장정보
강원도 여행지 추천 강릉 안반데기 별 은하수 시간 날씨... 
[떠나요! 강릉으로]강릉 여행지와 맛집 소개!
2023 벚꽃 개화시기 전국 벚꽃명소 봄 데이트 전국 여행지 추천
강릉 가볼만한곳 특별했던 여행지 모음
걷기 좋은 강릉 힐링여행지 '순포습지'
6월 7월 여름 휴가지 추천 장소로 유명한 여행지 추천 BEST
강원도 여행지 추천 강릉 여행코스 필수템 자유이용권 후기
강릉 여행 가볼만한 곳 여행지 추천 '정동진역' 인생샷 명소
"가을여행지 추천, 9월 10월 가볼만한 곳 5곳"
"강릉 경포해변 경포대 해수욕장 주차정보, 국내 바다여행지... "
미러리스 카메라 추천 Nikon Z5 with 국내 여름 여행지
국내 여행지 추천 강릉 정동심곡바다부채길
[여행] 강원 강릉 가볼만한곳 인스타핫플 하슬라아트월드... 
강릉 놀거리 추천 여행지
국내 가을여행지 경포생태저류지 메타쉐콰이어길 사진찍기... 
강릉 여행지 가볼만한 곳 추천 '안목해변 안목항 등대' 주차장... 
강릉 가볼만한곳 1박2일 여행지 일정 오죽헌 안목해변... 
강릉 바다의 신선함이 담뿍 담긴 강릉시 맛집 추천!... 
9월에 가기 좋은 어촌 안심 여행지 ① - &lt;강원 강릉... 
강릉 여행지 카페 추천 '강릉 테라로사 커피공장' 고급진... 
가장 인기좋은 여행지 경포해변 /2021 강릉시 해수욕장 개장일정
겨울 여행지 오대산 월정사
강원도 동해 삼척 여행 &amp; 국내여행지 추천 1박2일 코스
추운 겨울 이색 데이트를 즐길 수 있는 실내 여행지 추천
"동해 겨울바다 여행지 코스 안목해변, 주문진해변, 강문해변"
강원도 여행지 강릉 갈만한곳 안반데기 멍에전망대 별보기... 
주말 갈만한곳 다양한 체험이 가득했던 강원도 여행지들 추천
"강릉 가볼만한곳 여행지 '호린파크' | 핑크뮬리축제, 사진찍기... "
강릉 시내 맛집 30미리미터 프리미엄 숙성 고깃집
"국내 1박2일 여행지 추천 :: 실패 없는 여름 휴가지, 강릉... "
경포해수욕장 - 로맨틱 강릉 겨울바다 여행지 추천
강원도 강릉 겨울드라이브 바다여행 안목해변과 강문해변
강릉 가볼만한곳 선교장 고택 볼거리 여행지 데이트코스
강릉숙소추천 진리항(사천면) 오션뷰 +  여행지 몇곳 추천
강릉여행 가볼만한곳 '아르떼뮤지엄 강릉' 실내여행지... 
강릉 해수욕장 여름여행지 추천 : 강문해수욕장 &amp; 경포해수욕장
"강원도 강릉 1박2일 여행지 정동진역, 정동심곡 바다부채길... "
추천] 가정의 달 맞이 가족과 함께 즐길 수 있는 추천 여행지!
색다른 추억을 선사할 강원도 여름 여행지 BEST 4
강릉여행지 알려드림 강릉 중앙시장 강문해변 등
강원도 강릉 사근진 해변 무료... 일출 명소 반려견 동반 여행지
국내 겨울 여행지 추천 강릉 오죽헌~여수 오동도 &amp; 9 곳
강원 강릉 가볼 만한 곳... 명소 안반데기 마을 강릉 여행지 추천
강릉 여행지 추천 : 강릉 여행 필수 코스! “레트로 컨셉 사진... 
풍경 구경 하기 좋은곳 3월 여행지 베스트 5곳
겨울 여행지 best 10 추천
커피 커퍼 박물관. 맛있는 커피가 있는 이색 여행지.
강릉 여행지 추천 당일코스 도깨비촬영지 맛집 外
문화유산 유유자적이 간다! (강원도/고성군/강릉시/정선군/삼척시)
강릉여행지 보헤미안박이추커피 커피공장 및 하우스블렌드... 
"강릉 커피거리 - 안목해변 카페 뤼미에르 (오션뷰, 주차... "
9월에 가기 좋은 어촌 안심 여행지 - ① 강원 강릉 소돌... 
"[여행지 추천, 강릉]대관령 자연휴양림, 정동진 해변, 안반데기... "
2019년 12월 축제일정 전국 79곳모음 국내 12월 여행지 추천
강릉 가족여행 실내 여행지 갤러리초당
강원도 강릉 가을여행 코스 Best 6 여기
강원도 강릉 갈만한곳 국립대관령 치유의숲 뒷뜨루 사찰 가을... 
강릉 옥계해수욕장 야영장 여름 캠핑 차박 여행지 추천
가을 여행지 추천 / 강릉 경포생태저류지 코스모스 낭낭해
강릉 1박2일 여행지와 맛집 8선
국내 1박2일 여행지 / 하슬라아트월드 할인 / 강릉 G7 스파펜션
[여행지추천/강릉카페] 강릉 여행에서 만난 카페 ‘산토리니’
9월 10월 가을 국내 여행지 추천 베스트 10
강릉 실내 데이트코스 또는실내여행지로 완전 추천하는 강릉... 
현지인 추천 강릉 카페&amp;여행지 직접 가봤다! (feat.게하 사장님)
강원도 강릉카페 '애시당초' 레트로 감성 카페
강릉 아르떼 뮤지엄_데이트 코스 /티켓 가격/주차/운영시간
강원도 강릉 여행 강릉 혼자여행 코스
[내돈내산 국내 여행후기] 강릉 양양 겨울바다 여행지 추천... 
완벽한 여름 휴가를 위한 국내 여름 바다 여행지 3곳 추천(부산... 
시원한 바람과 함께하는 주문진 여행지
"8월 강릉 여행지 추천, 무료 공연 &lt;오죽헌 풍류야&gt; (~8/26)"
아름다운 국내 겨울여행지 추천
하슬라아트월드 할인 정보 포토존 가득 정동진 여행지 강릉... 
미러리스 카메라 추천 니콘 Z7II with 국내 겨울 여행지 추천
강릉 여행지 중 너무 추천 해주고 싶은 하슬라아트월드~
"강릉 여행지 솔향수목원, 이런곳이 무료라고?"
"보고, 즐기고, 맛보고! 촌캉스 [1탄] - 경기권, 강원권, 충청권"
커플여행지추천/강릉시장/경포대/2주년기념여행/강원도여행... 
강릉 여행지 어디로 갈까요?
국내 가을 여행 보현사 대관령박물관 안반데기 커피박물관 강릉... 
"[강원도 여행지 모음] 강원도 여행 지도(+동선 체크, 여행... "
[강원 강릉 가볼만한곳 사진찍기 좋은 곳] 노암터널
강릉 현지인 횟집 사천 해변 강릉 물회 추천
범 내려온다! 호랑이 기운 받는 여행지 추천
강원도 강릉여행지 경포해수욕장 새로운 포토존 실시간 후기
국내 봄 여행지 추천 2019 봄꽃축제 70곳 전국 모음
강원도 강릉 가을여행 경포생태저류지 메타세콰이어길... 
1박2일 여행지 - 강릉 커피축제.
강릉 중앙시장 시간 주차 먹거리 볼거리 추천
강원도 영동고속도로 뷰 맛집 대관령 전망대 졸음쉼터 강릉방향
"1월 축제/겨울 여행지 추천 (눈꽃, 해돋이)"
국내 여행지 - 신안 증도... 함덕해수욕장 / 강원도 강릉... 
국내 당일치기 여행지 추천
"[여행 여가] 강원_아름답고 깨끗한 자연이 있는 곳, 강원도로... "
강릉 여행지 가볼만한 곳 아르떼뮤지엄
강원도 여행지 추천 강원도 강릉 가볼만한곳 1박2일 강릉 여행... 
"행사, 바다의날 기념식, 아름다운 바다가 있는 바다여행지 추천 4"
"무장애관광도시 1호 ,  또 오고싶은 강원도 여행지코스 누구나... "
우리나라 최고의 유명 숲길 여행지 5선/월정사 전나무숲길... 
여름 휴가 속초 강릉 가볼만한 곳 여행지 총정리
기념공원 초당동 고택산책하기 좋아 강릉가을여행지로 추천
[강릉맛집] 강원도 강릉시 사천면 진리항구길에 새콤한 물회가... 
"푸른 바다와 감성이 깃든 여행지, 오감을 만족시켜 줄 강릉"
강릉 미술관 하평해변 및 강릉카페 추천 ft... 
강릉 소품샵 추천 BEST 5 소소하지만 확실한 감성 여행 코스
학력 MBTI 프로필 인기이유(강릉 근처 가볼만한 맛집 여행지정보)
[강원 강릉 사진찍기 좋은곳 가볼만한 곳] 경포생태저류지
추석 연휴에 가볼 만한 국내 여행지를 추천합니다!
안전한 여름휴가 보낼 수 있는 안전 농촌여행지 추천
강원도 여행지 강릉 아이와 가볼만한곳 명소 선교장 입장료... 
강릉 주문진 맛집 최대게 내돈내산 킹크랩 가격
강릉여행-구름위에 땅..안반데기/강릉가볼만한여행지[강원강릉... 
안전하게 여행하는 방법! 언택트 강원도 차박 여행지!
[강릉여행] 여름휴가 첫 여행지 대관령소나무숲 &amp; 삼포암폭포
강릉 가볼만한곳 사천 뒷뚜루 가을여행지 추천 만수국 핑크뮬리... 
5월 강릉 여행 중 빼놓으면 섭한 여행지 5곳 (스테이인터뷰... 
강원도 강릉 여행코스 당일치기 갈만한곳 5곳
&lt;강원 강릉시/등명락가사&gt;대한민국의 정동....바로... 
강릉 여행지로 추천하고 싶은 허균 허난설헌 기념공원
"당일치기 여행지 추천, 동해안 여행코스!"
강원도 대관령 가볼만한곳 국립대관령 치유의 숲 안반데기... 
강원도 주문진 아들바위공원
강릉 여행지 감성 소품샵 라라의안목 다녀온 후기
"강원도 차박여행지 추천&gt;, 강원도여행, 강원도 가볼만한곳... "
여행 떠나기 좋은 요즘 강릉 당일치기 여행 플랜을 소개합니다:)
"강릉 경포 아쿠아리움, 비 오는 날 아이랑 갈만한 실내 여행지"
부모님 모시고 떠나는 1박2일 강릉여행지
[강원/강릉/맛집/막국수]옛날삼교리막국수
횡성호수길 5구간&amp;대관령 소나무숲길/강원도 친환경 추천 여행지
"강릉게스트하우스 중앙점 추천여행지, 허난설헌생가"
강릉 가볼만한곳 가을여행지 추천 호린파크 핑크뮬리축제... 
강원 강릉(정동진) - 강원도 여행 아이랑 함께하기 좋은 정동진... 
[강원]선물하기 좋은 &quot;강릉커피콩빵 강릉당 안목해변점&quot;
열화당 마당에 능소화 피면(강원도 여행코스 국내여행지 추천)~
태교여행지 추천(강릉 오죽헌_신사임당의 기운을 얻자)
한우리 독서지도맘이 추천하는 단기방학 추천 여행지!
강원도 강릉역 여행지 먹거리투어 야간핫플 월화거리야시장
강원도 강릉 모래시계 공원... 반려견 동반 여행지 가볼만한 곳
강릉 맛집) 썸머키친 - 강릉여행지에서 만난 프랑스 가정식
가장 높은 곳에 위치한 여행지 BEST 8(전국에서 가장 높은 명소)
"- 강릉여행 : 강릉 아르떼뮤지엄 (강릉 여행지, 국내최대몰입형... "
강릉 여행지 ]  테라로사 본점 (커피공장)
하슬라아트월드 - 강릉 필수 여행지 추천
강릉 안목해변 카페 미르마르 &amp; 카페거리 나들이
「강릉 죽헌동 여행지 오죽헌」 「강릉 가볼 만한 곳」
[국내여행지 추천]강릉 가볼만한 곳/주문진 소돌항 해안도로... 
강릉관광 가볼만한곳 강릉솔향수목원 여름여행지
[커플 여행지] 드라마 도깨비 촬영지 강원도 동해바다 여행지... 
강릉중앙시장회센터 강릉한신회센터 강릉시장물회집으로 추천!
2023 특별한 여행지 :: 속초&amp;강릉 맑고 푸른 바다뷰에 힐링... 
"9월의 수산물, 어촌여행지, 해양생물, 등대, 해양유물... "
강릉 오마카세 분위기 좋은 한우 오마카세 마크나인
강릉 가볼만한곳 강릉 실내 데이트 추천 여행 코스
"가을 만끽 여행지, 국내 vs 해외 어디로 떠날지 고민 중이라면?"
국내 여행지 추천 : 강원도 강릉 가볼만한곳 베스트 3
강원도 갈만한곳 강릉 국내 1박2일 겨울 여행지 추천 4
"7월 여름 휴가 추천, 강릉문화재야행 축제 일정 및 정보... "
정석] 가을이 왔어요 가을이!!            9월 여행지 BEST3
정동진 썬크루즈호텔 해돋이 명소 &amp; 인생샷 후기♥
강릉애견동반숙소 추천 순위 구매가이드 리뷰 가격 비교 장점... 
강원도 평창 강릉 여행 코스 자유이용권 강원도 여행 추천
"강릉 가볼만한 곳 베스트 10 (실내, 여름, 아이, 여행지)"
[강릉여행] 강릉 가볼만한 곳 강릉 여행지 추천 아르떼뮤지엄 강릉
강릉 현지인 찐맛집 텍사스바베큐 그릴웍스 데이트 후기
연말 신년 해돋이 대표여행지 살펴보기!!
강릉 핫플 여행지 | 주문진 도깨비 촬영지 | bts 버스정류장
"강원, 강릉시&gt;1박2일, 주문진여행"
"겨울 강릉 데이트코스 교리단길 교동반점, 두딩, 카페에... "
항구마차 - 강릉 헌화로 맛집 - 강원도 가을 여행지
강릉 바다 안인해변 국내 조용한 여행지
"강원, 강릉시&gt;1박2일, 경포대, 정동진 여행"
[강원/주문진] 드라마 도깨비 찰영지 날 부른게 너야?... 
"2023년 가을에 꼭 가야할 전국 단풍 명산, 명소 추천"
[강릉 여행 코스] 눈길을 사로잡는 강릉 이색 여행지
2020년 1월 축제일정 전국 93곳 모음 국내 1월 여행지 추천... 
강원도 겨울바다 여행지 추천 강릉 바다 가볼만한곳 정동진... 
"강릉에서 꼭 가봐야할 여행지, 드라마 도깨비 촬영지(주문진... "
강릉 당일치기 여행 코스 핫플 월화거리 먹거리 포함 데이트코스
강원도 가볼 만한 곳 여행지 추천 3박4일 강원도 가족여행코스
"[강릉 여행] 바다도 보고, 오션뷰 감성주점에서 수제 맥주... "
[강원 강릉] 베이커리 가루
"나를 찾아 떠나는 힐링 여행, 템플스테이 여행지 추천"
8월 국내여행지 추천 여름에 많은 사람들이 고민없이 찾는 5곳!
[여행] 강원도 '강릉' 갈만한 곳... 초당커피/ 뚜벅 여행지
강릉 오죽헌 국내여행지추천 아이와가볼만한곳
"긴 바다 데크길 오션뷰,  뉴트로 감성 추억 소환 여행지!"
가을 국내 여행지 추천
강릉펜션 가을여행 숙소 강원도 동해바다가 한눈에...메어블릭
2020년 새해에 떠나는 해맞이 명소 여행지 추천!
"[강원도 강릉시] 주문진 50년전통 막국수 맛집, 수육맛집... "
"실내 가볼만한 여행지 (포토존, 입장권 할인, 주차)"
강릉 맛집 세인트존스호텔 고깃집 애견동반식당 룸식당 초당우가
강원도 양양여행 1박2일 코스 숙소 죽도정전망대 외 가볼만한곳
[강릉 여행지] 파스텔 방파제 사근진 해변과 동해 대표 관광지... 
[강릉] 실내여행지/ 가볼만한 곳 추천... 
더 짠내투어 115회 강원 (양양 &amp; 강릉) 여행지 &amp; 음식점
새해 여행을 준비하고 있다면? 국내 겨울 여행지
[블로그씨 답변] 우리 네가족의 첫 여행지 강원도여행코스... 
국내 겨울 여행지 추천 강원도 강릉 당일치기 여행 뚜벅이 코스
강원도 여행 코스 &amp; 가볼만한 곳 BEST 10 모음 - 강릉시/동해시... 
강원도 강릉 솔향수목원 강릉 바우길 힐링데이트
하드론 휴가 여행 시리즈 3. 자동차 여행하기 좋은 국내 여행지
[강원] 정동진해수욕장 | 마음까지 시원해지는 정동진바다의... 
국내 여름 여행지 추천
강원도 동해안 가볼만한곳... 허난설헌 생가(여름 국내여행지추천)~
강릉 아르떼뮤지엄 미디어아트 놀거리 가볼 만한 5월 여행지... 
국내 1박2일 바다 여행지 강릉 강문해변 커플여행 갈만한곳... 
"[다락옥수] 숨겨진 보석 같은 국내 여행지, 강원"
전통과 자연을 한번에! 강릉 대표여행지 오죽헌시립박물관~!
강릉 가을 단풍 여행코스 보현사 대관령박물관 강릉커피박물관... 
강릉커피거리 오션뷰카페 산토리니커피 핸드드립커피
강원도여행지 추천 강릉 핫플 따라 1박2일 코스
정동진 바다부채길 강릉 초당옥수수커피 등 가을여행지 추천
가족 여행지 추천 / 강릉 가볼만 한 곳 / 강릉 아이 데리고... 
강원도 방탄소년단 여행지 : BTS 비대면 투어 쇼!
"[만들이 웹진] 모두가 주목하는 핫한 겨울여행지, 평창과 강릉"
강릉 서핑명소 금진해변 산책
[강릉] 경포호 경포가시연습지 강릉가볼만한곳 가을여행지 강원... 
강원도/강릉 [강릉샌드] : 여행지마다 있는 샌드들 강릉에도... 
강릉시 안반데기 은하수 여행 날씨 주차 숙소 펜션 정보
강릉꽃집 무흠 / 커피값으로 여행지 기분 업시키기!
강릉 맛집 엄지네 포장마차 본점 꼬막비빔밥 주차 정보
속초 강릉 당일치기 여행지 추천 알차게 즐기다온 장소 4곳!
강릉 오죽헌 뜻 입장료 주차 아이와 가볼만한 곳 여행
국내여행지 추천 강원도 가볼만한곳 ~강릉핫플 인생 포토존... 
강원도 여행지 추천 강릉 여행 코스 놀거리 국내여행 추천
강원도 강릉 여행코스 당일치기 강릉 여행 추천
