"어촌안심여행지] 전북 군산시 선유도마을, 강원 강릉시... "
강원도 속초여행 아바이마을 갯배 가을동화 촬영지 은서네집
속초 가볼만한곳 동명항 당일치기 여행코스
강원도 속초 당일치기코스 데이트 서점 청년몰 야경 등
훌쩍 떠난 여행지 88생선구이먹고 속초중앙시장 구경
속초여행) 속초해수욕장 야경명소 / 속초아이 대관람차... 
올여름 힐링은 이곳에서! 국내 여름 휴가지 추천 BEST 5
국내여행 임인년 2022 전국 새해 일출 해돋이 여행지 명소추천
속초 가볼만한곳 설악산 신흥사 척산온천 족욕공원... 
속초 동명항 / 유람선야식 - 소주로 나발 불 때 필요한 곳
"벗새가 알려주는 여름 여행지, 벗(BUD)으로 친구와 여행비도... "
대포항 맛집 감동대게 2호점 속초 대게 맛집 추천
아름다운 강원도 단풍 명소 BEST 06 가볼만한곳
[강원 속초] 동해바다로 가족여행 :: 속초아이 / 속초해수욕장... 
속초 중앙시장 회포장 맛집 여기만 가요♡ 아쿠아딜리버리
속초 가성비 숙소로 이 가격에?!!?!! 리센오션파크 호텔(주차... 
"3월 갈만한 국내여행지 추천 (feat. 버릇처럼, 열두달 여행)"
강원도 속초여행.... 속초아이 대관람차 / 아이가 잘노는 여행지
2022 속초아트페어 설악문화제 특별전 칠성조선소
속초 여행 아이와 함께 둘러보기 좋은 시립박물관 (다양한 전시)
속초 오션뷰 카페 어나더블루 드립커피 수제 케이크
강원도 가볼만한곳 속초 아바이마을 갯배 등 여행코스
속초여행 '동명항 오징어난전' 오징어회+오징어숙회... 
속초 가볼만한 곳 바우지움조각미술관 인생샷 관광지 5곳
"바람 좋은 여행지, 명상하기 좋은 숙소"
속초 물회 봉포머구리집 〰 속초 여행 필수코스
속초시 &quot;3분기까지 시 방문객 역대 최다 기록&quot; 겨울여행 계획... 
속초 볼거리 여행 얼라이브하트 설악산 케이블카 속초... 
[강원도 속초 여행지 추천] 바다구경 말고 뭐하지? :: 상도문... 
강원도 속초호텔 추천 온수풀 수영장이 있는 &quot;체스터톤스 속초&quot;
"속초 올 때마다 들렸던, 속초맛집 대청마루"
"속초여행지 추천 - 속초아이 , 속초 대관람차 야경도 좋지만... "
조용한 속초시 고성 바다 자작도해수욕장 근처 카페고고비치 피자
속초여행/ 강원도가성비호텔  청초호수뷰 월드스테이트 근처... 
속초 중앙시장 먹거리 내 최애 갑질어묵 택배가능
[강원도속초여행] 아침식사로 추천하는 속초 순두부 맛집... 
속초 가볼만한곳 핫플 실내 놀거리 VR체험관 스포츠 넥스트 레벨
"[강원도 가볼만한 곳] 나들이 가기 좋은, 강원도 봄 여행지"
강원도 여행지 추천 :: 어떤 단풍보다도 다채로운 속초 여행
속초중앙시장 먹거리 주차장 속초관광수산시장 전통시장 술빵
"속초 여행, 한화리조트 설악 쏘라노 숙박 후기 (디럭스... "
"[강원/속초] :: 속초의 보물을 찾았다, 비건카페 ‘루루흐’"
속초신상카페 실내 식물정원카페 시드누아 속초점 속초 대형... 
[속초여행] 진미 동치미 메밀 막국수 (주차가능) 내돈내산 후기
"속초 오션뷰 카페 슬로우라운지, 커피도 마시고 여유롭게 책도... "
[등대생선구이]아낌없이 퍼주는 친절한 속초 아바이마을 맛집
"속초중앙시장 맛집 추천️시장닭강정,티각부각 꽃게부각... "
속초 오션뷰 숙소 마레몬스 호텔 바다뷰 객실과 스카이라운지... 
속초 맛집 : 부드럽고 맛있는 설악딸기모찌.
속초 동명항회센터 오션뷰 회먹기 단골집
강원도 여행코스 빵지순례 설악해맞이공원 대관람차 대포항... 
7월 국내 여행지 추천 일출(동해)과 일몰(서해) 명소 여긴... 
한화리조트 설악 쏘라노 디럭스 후기
[속초 조양동] 삼산회관 속초엑스포점 | 계속 생각나는... 
속초아이 대관람차 타고 짬뽕순두부 먹고 설악산자생식물원... 
[강원도 온천수영장 숙소] 겨울에도 즐겨요 강원도 겨울... 
[강원도여행/속초여행] 속초 당일치기 가볼만한 곳 동명항... 
속초여행 코스 속초해수욕장 맛집 푸짐하고 맛좋은 속초물회... 
설악동을 화두로 꺼내며...
속초 맛집 추천 전복뚝배기가 맛있는 바람꽃해녀마을 (속초... 
[강원도 여행지 추천] 강원도 여행 속초  / 속초 케이블카 타고... 
"속초 동명항 대게 맛집 시세 , 가격 착한 대게좋은날 추천!"
속초 가볼만한곳 강원도 걷기 좋은 옛길 속초 등대 전망대
강원도 속초 가볼만한곳 영금정 포함 10곳
속초 여름 휴가 가볼만한곳 베스트 10 추천! (ft. 강원도 여행지)
대포항 대게 맛집 대포횟집에서 대게+회+해산물 파티
강원도 속초 가볼만한 곳1박2일 여행 추천(가오리찜... 
[속초 물회] 산오징어물회 회덮밥 완도회식당 (모닝와이드촬영)
속초 생선구이 맛집 속초관광수산시장 태경생선구이 속초본점... 
속초 더케이설악산가족호텔 조식+상도문돌담마을
속초 가볼만한곳 찾아간 설악산 비룡폭포 단풍 여행
속초 여행 1박2일 속초해수욕장 관람차 포함 놀거리
속초 갯배타고 속초핫플 즐겨보는 속초 관광수산 시장 여행
3월 국내여행지 추천 속초중앙시장 먹거리
강원도 겨울여행 속초 핫플 야경 갯배st 아바이마을 등
속초물회맛집 설악산단풍여행 후 가기 좋은 속초항아리물회
여름휴가 국내여행지 추천
속초 가볼만한곳1박2일 여행코스 찰지게 다녀왔슈^^
[속초여행] 속초 맛집 추천_싱싱한 해산물이 가득한 '문어랑... 
속초호텔 체스터톤스속초 조식뷔페 &amp; 야외 수영장까지 가성비... 
속초 생선구이 맛집 : 동명항 생선 숯불구이 + 돌솥밥
국내 배낭여행지 추천 / 혼자 국내여행하기 좋은 곳 &quot;속초&quot;
[속초카페] 속초휘낭시에맛집 속초디저트카페 그라제
속초 가볼만한곳 숙소 롯데리조트속초와 속초대관람차... 
속초 가볼만한 곳 베스트 10 여행지 총정리
No.4 [강원/속초] 속초 교동 커피 맛집 '세렝게티커피'/빈티지... 
나의 속초방앗간 문우당서림
속초 드라이브 코스 카페 설악산로 아이와 가볼 만한 곳 추천
아는동네 매거진 vol.5 《아는동네 아는강원 1》 출간 안내
속초 대관람차 속초 중앙시장 먹거리 바다 둘레길 등 속초 놀거리
속초 가볼만한곳 바다 속초 여행코스
속초 가볼만한곳 영금정 속초 여행코스 중앙시장까지~
"10월 국내 여행 추천, &lt;the RED 예쁨 여행&gt; 책 속 추천 여행... "
강원도 속초 가볼만한곳 멋진 바다 풍경 구경하자
강원 속초 하운드 속초 블루스테이 생활형숙박시설... 
"202305 강원도 여행(양양,속초)_여행지,맛집 추천"
속초에서 건강하고 따뜻한 아침식사를 먹을 수 있는... 
속초 중앙시장 먹거리 추천 만석닭강정 속초관광수산시장 주차장
[속초 가볼만한 곳] 가을 산책하기 좋은 속초 엑스포타워 근처... 
애견 동반 가능한 동명항 횟집 해산물이 끊임없이 나오는... 
[속초여행] 무료로 족욕할 수 있는 &lt;척산족욕공원&gt;
[속초맛집] 강원도한식밥상 곤드레돌솥밥 설악산근처맛집... 
속초 포차거리맛집 뷰맛집 친절맛집 내돈내산찐후기 [해바라기]
속초 설악산 신흥사의 벚꽃터널 #페이지
위치한 바다가 보이는 추천 리조트/호텔 #강원도 속초
"속초 설악산가는 길목, 설악동C지구 숙박시설 매매 #속초부동산... "
속초아이가 한 눈에 보이는 뷰 맛집 속초항아리물회 | 속초... 
아름다운 강원도 단풍 명소 BEST 06 가볼만한곳
강원도여행 1박2일 가족여행가볼만한곳 필수여행지5곳... 
강원도 가볼만한곳 영랑호~동명항 속초 중앙시장 먹거리
강원 속초여행 가볼만한곳 추천 &lt;속초시립박물관&gt;
"[강원] 속초 여행 마지막날 이야기, 뉴욕 코로나 현황 - 시골이모... "
[강원속초 식당 추천] 솥뚜껑 삼겹살 잘돼지왕뚜껑 (조양점)
한국 맞아? 해외보다 나은 국내 이색 호텔
속초 | 푸짐한 상차림 비치대게 대게 내돈내산 후기(feat.... 
강원도 당일치기 여행 속초 데이트 아바이마을 속초 갯배
"실향민들의 아픔을 간직한 마을, 아바이마을"
국내 6월 여행지 추천 속초 가볼만한 곳 영랑호 범바위 (가는... 
"9월 속초여행 추천 (동명항 오징어난전 5호, 녹원생선찜... "
"[속초] 돈값하는 여행지 맛집, 이미 너무 유명한 '봉포머구리집'"
"속초 중앙시장 맛집/먹거리 공유 (만석 닭강정,속초새우아저씨... "
[강원] 양양 속초 가볼만한곳
"속초 중앙시장 먹거리 만석닭강정, 수산시장 대게 포장 후기"
[속초/택배] 과자의 성: 강원도 센스 있는 속초 기념품 여행선물
[강원] 속초 아바이마을 단천식당 아바이순대모듬 후기
속초 카페: 메이트힐로스터리 루프트탑 대형카페 속초여행지
"속초 겨울 여행지 추천, 따뜻함 가득한 겨울 나이트 스파 설악... "
속초 서점 '문우당 서림' 책을 좋아한다면 꼭 가봐야 할 곳
[속초해수욕장] '청담동꿀꽈배기 속초점' 바삭쫀득한... 
속초 가볼만한곳 영랑호수윗길 등 볼거리 관광지 6
"[속초] 속초중앙시장, 속초관광수산시장 먹부림 대방출 (웨이팅... "
"속초 선물, 맛도 좋아서 선물용으로 딱인 :: 설악산단풍빵"
“국내 유일한 대관람차가 있다?”...1박 2일로 즐기기 좋은... 
‘숲캉스’ 즐기기 좋은 국내 숙소 6곳
"속초카페, 울산바위 뷰 여기가 명당! 카페 긷"
속초 노포 맛집 : 70년 전통 교동 중국집 &quot;미화 반점&quot;
겨울에 떠나기 좋은 국내 온천 여행지는 어디?
속초 가볼만한곳 강원도 고성까지 8곳
한화리조트 설악 쏘라노 디럭스 강원도 속초 숙소
강원도 속초 내돈내산 맛집 리스트 5곳 추천
【속초 여행】 강원도 여행지
[가을여행지 추천]강원도|속초 2박3일 여행 #1
강원도 여행 속초 대관람차 타고 본 속초해수욕장
바다가 보이는 강원도 속초 맛집 리스트
[속초낚시체험]동광호배낚시_ 속초 가자미 배낚시 체험 무조건... 
"영랑하우스 203호, 반오션뷰 속초펜션(분리형)"
[강원도 여행지 추천] 속초와 강릉 여행지 BEST5/ 가볼만한 곳... 
속초 가볼만한곳 강원도 속초양양여행 코스 추천 영랑호에서... 
속초 여행 가볼만한곳 속초중앙시장 아바이마을 코스
10월 국내 여행지 추천 강원도 가볼만한곳 속초 설악산 외 인제... 
속초1박2일) 설악산국립공원 케이블카 위치꿀팁
속초 카페 추천 설악산책 카페소리
강원도 가볼만한곳 속초 외옹치해수욕장 맛집  부부생구탕
속초 가볼만한곳 속초해수욕장 포함 7곳
[속초카페] 스테이 오롯이 STAY OROSY
속초 여행코스 속초아이 대관람차 속초 해변 놀거리 바다 볼거리
"강원도 속초 1박2일 여행지, 오션뷰 펜션 숙소 씨엘178... "
속초 카페 온실 식물원 느낌 가득한 코코넛그루브
"속초 왔을 때, 떠날 때 국수 한 그릇 하기 좋은 집"
속초 중앙 시장 먹거리 놀거리 갯배  볼거리 영금정
1박 2일]나 혼자 또다시 속초 여행 Day1. 첫 번째 이야기
"강원도 속초 숙소 추천, 속초 대관람차 속초아이 전망... "
강원도 속초 가볼만한곳 척산족욕공원 이용료 요금 온천수
삼척의 여행지가 이렇게나 많구나!
2월엔 떠나요~ '국내 특색 있는 스파'
강원 속초 숨겨진 햄버거 명당 [멜팅소울]
속초 목살 돈까스 맛집 유니카츠 간장돈쫄 추천
속초 설악산 부근 속초 아침식사 잘 나오는 애견동반식당... 
속초항아리물회 물회맛집추천 강원도 가을명소
"속초 여행맛집, 유명한 곳엔 이유가 있다 :: 솔밭가든막국수"
"강원도 여행지 추천, 속초 드라이브코스 설악산 신흥사"
[속초 그린몬스터]제주 말차가 시그니처인 집+일기
가을 설악산국립공원 권금성케이블카 탑승 및 신흥사구경
국내 야외 노천 온천탕 추천 BEST 9
강원도 속초 해수욕장 1박2일 여행코스 속초바다 놀거리 총정리
속초가볼만한 곳 대청마루 순두부 속초3대물회 속초맛집
주말 강원도 여행코스 갈만한곳으로 알려진 TOP 5장소
강원도 당일치기 속초 여행 코스 아바이마을 갯배... 
속초 야경 명소 청초호 유원지 엑스포타워 전망대 입장료
속초맛집 물담물회국수 속초해수욕장 물회맛집
속초 마레몬스호텔에서 일출을 보다
"속초자이엘라 더 비치 분양안내, 속초시 자이 생활형숙박시설"
[강원 속초] 여행예보: 산책하기 좋은 청량한 속초호수뷰! 청초호
등대해변 강원나물밥 시골할머니 / 강원도드라이브코스
속초 대게 맛집 대포항 싱싱한 대게세트로 푸짐한 식사... 
살아있는 바다를 만나는 여행 '강원 속초 장사마을'
[속초 카페] 원 파인 데이 :: 속초에서 만난 어느 멋진 날
"속초 소품샵 굿즈샵 2곳 방문기:) 속양고점빵, 신기루상점"
강원도 속초 가볼만한곳 8곳_ 속초여행 당일치기 코스
속초오징어순대 속초항아리물회 속초맛집
속초 아침식사 가능한 푸짐한 밥상 그리운보리밥
"[우리 곁의 통일, 우리의 통일] 경계의 끝자락, 강원도 (2)"
[속초] '무니' _ 바다 보이는 힙한 칵테일/와인펍 _ 간단하게... 
강원도 속초 양양 가볼만한 곳 여행코스 추천 5곳 해수욕장... 
속초 호텔 설악산 감성숙소 켄싱턴호텔 설악 패키지 추천
바다다조개다 앤 팝쿠아 맛집 저녁식사 데이트 하기 좋은 곳
속초 갓성비 간장게장정식맛집 다람쥐가
속초 국내여행 속초해수욕장 주차하기 팁!! 걸어서 갈수있는... 
[강원도 맛집 추천] 주문진 막국수/ 장칼국수/ 반려동물 동반 가능
속초3대물회 가을여행추천 속초항아리물회
속초 가볼만한곳 속초 영금정 외
쀼의 새로운 시작
의외로 너무 좋았던 속초여행지 '문우당서림' 그리고 '문단'
[속초 여행] 속초 생선구이 맛집 '함가네 생선구이'
강릉-속초 가을여행 1박2일코스 40~50대가 가기 좋은 여행지... 
속초 회포장 맛집 횟집은 아쿠아딜리버리(+대게특가중... 
"웨이팅필수 속초맛집 속초항아리물회, 속초오징어순대 추천해요~"
[속초 카페 / 속초 시외버스터미널 카] 짐 보관이 가능한... 
"강원도 여행지 | 마음내키는대로 다니는, 속초/양양 여행"
아이와 가볼만한곳 속초아이 대관람차 주차 예약 가격 소요시간... 
예쁜 게 너무 많은 속초 감성 소품샵
속초시립박물관(아이들과 함께 가기좋은 속초 여행지)... 
속초 대포항 포장 수산시장 회가 가득
속초 등대해수욕장 속초먹방 미란이네 365가영이네 동명항... 
[속초맛집]강원도물회맛집추천해요 :)  속초해수욕장 근처... 
강원도 여행지 추천 속초 시내 핫플 속초 중앙시장 먹거리
"여자 혼자 속초 뚜벅이 여행 코스, 당일치기 스케줄로 추천해요"
"2023년 첫 여행, 내 생에 첫 여행지 '속초'"
속초 대포항 먹거리 대게 맛집 대포대게회직판장에서 먹는 만찬
휴가철 속초 가볼만한곳 외옹치해수욕장 6곳
속초 가볼만한곳 관람차 해수욕장 영랑호 등 당일치기 여행코스
마지막 여름 그리고 시작하는 가을이야기 Best 추천 여행지!
강원특별자치도 속초시 속초해안로 자연생태관광지 - 달콤한여행
[강원도 속초] 속초 가볼만한 여행지 추천!
"속초 가볼만한곳, 강원도 고성 가볼만한곳, 속초여행, 고성여행"
속초 대포항 맛집 '신해불이횟집'
속초 동명항 대게 맛집 - 여행갈 때마다 재방문한 동해안 대게찜
강원도 고성 가볼만한곳 1박 2일 고성 여행 코스 6곳
속초중앙시장 명물 리스트 갑질어묵 택배 가능!
[속초 카페] 어나더블루 오션뷰 강원도 속초 카페 추천
속초 생선구이집에서 인생 청국장 발견 별주부네물곰탕 찐 후기
속초해수욕장 오션뷰 펜션 비치홀릭 속초
2023 강원세계산림엑스포 체험 프로그램 알아봐요^^
겨울 여행지
설악산 인기 여행지 신흥사
속초 설악산케이블카 근처 가볼만한곳 설악산자생식물원... 
속초 맛집 추천 바람꽃해녀마을 전복해물뚝배기 오징어순대
속초시 지역 분석
"툭하면 떠나는 여행지, 아내와 나의 2월 강릉 속초 여행 코스"
"속초 서점 문우당 서림 , 작은 소품샵 문단도 들려보세요"
지금 가면 딱이야! 속초 겨울 여행지 추천
속초 여행 맛집!! 영광정 동치미 막국수는 꼭 먹어보기!!
수험생이 시험 끝내고 가기좋은 여행지
속초 가볼만한곳 설악산신흥사 설악산 자생식물원 설빙정... 
우리 국민들이 직접 추천한 숨은 관광지를 소개합니다
강원도 겨울 여행 12월 속초 설악 워터피아 국내 노천 온천
속초 가볼만한곳 강원도 여행 코스
설악스케치 - 설악산 속초 아이와 함께 함박스테이크 경양식... 
속초 맛집 리스트 점심 저녁 모두 가볼만한 '속초 맛집'
속초 여행 코스 상도문 돌담마을 한 바퀴 속초 데이트 여자혼자... 
"속초 가볼만한곳 속초해변, 설악산, 영랑호 등 6곳"
속초여행 :: 속초 청초수 물회 포장 / 속초물회
속초 가볼만한곳 설악산 &amp;외옹치해수욕장 Best 여행코스 5
수능 끝 가볼만한 국내 여행지는?
강원도 가족여행리뷰 / 간단 점심메뉴 추천 :) 강원도 여행에서... 
속초 물회 맛집/싱싱하고 푸짐한 해산물과 쫄깃한 면발의 만남... 
설악산 물회 맛집 속초 해수욕장 도보 30초 가을 드라이브... 
강원도 속초 가볼만한곳 당일치기 여행코스 해변과 먹방 둘 다... 
어린이 출판사가 추천하는 아이와 속초 가볼만한 곳  힐링 여행... 
국내 겨울 여행지 영금정에서 힐링여행
"강원도 속초 핫플 속초해수욕장 바다, 속초아이 대관람차와... "
강원도애견동반숙소 구매 가이드 - deumeu
[속초 맛집] 속초항아리물회 :: 속초아이 근처 깔끔하고 맛있고... 
강원도 속초 양양 1박 2일 여행코스 추천
나만의 버킷리스트 여행 &lt;강원도에서만 맛볼 수 있는 맥주... 
속초해수욕장 포함 가까운 속초 여행 코스 7
속초동명항 맛집 청초수물회와 대게찜 섭렵했던 후기
속초 포차거리 속초 오션뷰 술집 동명한포차거리 용신포차
"[2월의 추천여행지] 한국관광공사 추천, 국내 온천·스파 여행"
양양 속초여행코스 여행지추천 1박2일 맛집부터... 
강원 속초 맛집::설악본가설렁탕에서 아침식사하고 왔어요~
강원도 속초 노학동 :  긷
속초중앙시장 맛집 리스트 (씨앗호떡 택배 포장 가능)
속초 여행 코스 중앙시장&amp;속초해수욕장 픽했죠~
속초 중앙시장 맛집 예쁜 디저트 도리스파티세리
"[강원도 고성/속초] 하늬 라벤더 팜,에이프레임 카페, 씨크루즈... "
강원도 속초여행 한화 설악 쏘라노 근처 맛집 홍가네 대게 횟집
[인터뷰 공감] 서점이 궁금해속초로 떠난다고요?... 
속초 중앙시장 주차장 먹거리 만석중앙닭강정 붉은대게 식도락... 
[강원도 가볼만한곳]... 가을여행지/일출명소 추천 +안목해변... 
속초여행 롯데리조트속초 트윈룸 조식 워터파크 할인 운영시간
강릉 동화가든 속초직영점 내돈내산 후기
[속초 여행] 속초 첫째 날 코스 정암해수욕장 영금정 문우당서림
[속초 가볼만한 곳] 속초 바다 여행 해돋이 일출 명소 영금정
속초 씨크루즈호텔 디럭스트윈 시티 레이크뷰 속초중앙시장 근처
"2023 강원 세계 산림 엑스포, 10월 축제 강원도 여행 코스"
"강원도 여행 코스 멋진 양양계곡 , 왕곡마을 포함 7곳"
속초 가볼만한곳 속초해변 대포항 속초서점 야경명소까지
강원도드라이브도 즐기고 국내여름여행지로 동명항일출보고... 
"2월 갈만한 국내여행지 추천 (feat. 버릇처럼, 열두달 여행)"
속초 물회 맛집 구구집
강원도 속초아이 대관람차... 가볼만한곳 2박3일 국내 여행지 추천
랜선으로 즐기는 강원도 겨울 여행지
속초 중앙시장 맛집 닭강정골목 이색 먹거리 팔공감자
속초 빵집 크림빵으로 유명한 베이커리 가루
속초 카페 마당 있는 한옥카페 너울집 데이트
동해 속초해수욕장 속초아이 대관람차 낮과 밤의 매력
속초중앙시장 맛집 먹거리 황부자튀김 주차장 꿀팁
속초 여행지 앙젤루스 3층 동양의행운 | 속초 관광지 앙젤루스... 
"속초 갯배, 아바이마을 당일치기 여행코스도 좋다!"
"속초 여행지, 데이트코스 Best 5곳♡"
속초 대포항 대게 맛집 대포대게회직판장과 아바이마을
강원도 속초여행 코스 추천 ( 금강산 신선대 낙산사 속초감자빵... 
"속초 동명항 자연산 생선회 즐긴 66호 ( 주차장, 상차림비... "
겨울 바다의 매력! 당일치기 국내 바다 여행지 추천 리스트 5
"[원주, 양양, 속초 여행] 맛집, 놀거리, 해수욕장, 서핑, 클라이밍... "
속초 중앙시장 먹거리 - 뚱삼겹말이 크림고로케 수제어묵... 
"속초아이대관람차, 해수욕장과 함께 대표명소가 되다"
"속초여행 숙소, 켄싱턴호텔 설악, 테라스BBQ패키지 솔직후기"
속초 가성비 횟집 아쿠아딜리버리
속초 수제버거 맛집 장사항 속초자메이카버거
속초여행 선물 속초 중앙시장 맛집 에그타르트 포장... 
"속초 소품샵ㅣ문단, 창작자의 문구편집샵 (feat. 나의 새해... "
강원도 속초 가볼만한 곳｜속초등대전망대｜속초 영금정 근처... 
국내 여름휴가 추천 워터파크 리조트 직접가본 곳 best3 ft.... 
속초 여행지와 함께 만드는 추억 당일치기 '속초'여행
강원나물밥 먹고 보고 맛있는 기차여행 - 춘천 당일여행코스
"강원도 속초 가볼만한곳 영금정, 동명항과 대포항 수산시장... "
"여름엔 야외포차 최고! 속초 포차거리, 은경이네포차 다녀옴"
금강산옹심이막국수' 속초 옹심이 맛집/강원도 속초 막국수 맛집
속초 설악산 권금성 설악 케이블카 가격 주차 정보
"[강원 by 혜인] 강원도 속초 가볼만한 곳, 설악산 케이블카... "
강원도 속초 아이와 가볼만한곳 얼라이브하트 &amp; 다이나믹메이즈
속초 당일치기 코스 엑스포타워 속초 청초호수공원 강원도 여행
영금정 근처 가성비 좋은 속초 동명항 횟집!
[맛집] 속초 로컬맛집 찾았다 선창활어횟집  영금정
관관공사추천 1월의 여행지
"속초여행_속초등대 스탬프투어, 영금정, 속초중앙시장"
속초맛집_완도회식당/양양 서피비치
"[속초여행] 강원도 속초여행, 죽기전에 꼭 가봐야할 속초명소... "
"속초 여름 휴가 관광지 추천 !! 청초호, 대포항전망대... "
강원 속초맛집 속초생선조림 고궁회관
[강원 속초] 대포항(大浦港)_종합 관광어항 단지
속초 중앙시장 맛집 내돈내산 '속초 홍게 맛집 및 속초시장... 
렌트카 강원도 갈만한곳 강릉 속초 여행 동해바다 여행 강원도... 
[국제커플/한폴커플] 쥬시니 1박2일 강원도 속초여행 vlog... 
대관람차와 함께 하는 동화 속 한 장면 여행지
"속초 여행지, 아바이마을 갯배 체험 (+주차)"
[속초 가볼만한곳] 여름휴가 여행지추천 오션뷰 속초해변... 
[속초] 힐링에 맛있음을 곁들인 1박 2일 속초여행
가성비 갑 럭셔리 호텔 라마다 속초 호텔 -  쏘카 특박 실제 후기
역시 속초맛집 아쿠아딜리버리
타고  권금성 오르기  주차 / 입장료 / 비용 겨울 국내여행지 추천
영랑호 아바이마을 권금성신흥사 / 강원도여행지추천
"강원도 속초 나들이 코스 갯배, 대포항, 먹거리포함... "
강원도 속초 크로프트커피 시골 골목 감성 카페 로스터스... 
겨울이 끝나기 전에 가봐야 할 여행지
강원도 여행지
"신라화랑 영랑과 범바위, 호수위를 걷는 재미가있는... "
[카페코엘]속초 장사항 근처에서 예쁜 카페를 찾고 있다면?
청초호수공원 &amp; 속초 카페 칠성조선소 카페 속초 볼거리 가득
