"어촌안심여행지] 전북 군산시 선유도마을, 강원 강릉시... "
강원도 평창 송어회맛집 식사하러 갈만한곳 강원수산횟집... 
[1박 2일 강원도 평창 여행] 육백마지기 / 두근두근 콩콩... 
용평리조트 드래곤밸리 호텔 :: 슈페리어 패밀리룸 (가성비... 
평창 볼거리 아이들과 가볼만한곳 강원도 여행지 나들이 추천... 
&lt;강원도/강릉&gt; 모든 곳이 포토존 겨울여행지 추천... 
평창여행 :: 광천선굴 어드벤처 테마파크 (여름여행지 석회동굴)
평창 당일치기 가을여행추천 평창사랑 가을엔사과
[평창 맛집] 평창 현지인 맛집 방림추어탕
평창 사랑 원복 송어 플라이낚시 체험 장암산 활공장 평창... 
"5월, 떠나기 좋은 테마별 주말 가족여행지 (1)"
".[본문스크랩] 겨울여행지 추천, 가볼만한 눈꽃여행지!"
강원도 겨울 여행 ㅣ 대관령 양떼목장 &amp; 삼양목장 &amp; 하늘목장... 
뚜벅이를 위한 1박2일 평창 여행지 모음. zip ♥
"여름 최적의 여행지, 평창"
평창 아이와 가볼만한 곳 이효석 문학관
&quot;여름휴가 알짜여행 떠나요&quot;…평창시티투어 테마상품 출시
겨울 여행지 추천 베스트
"서울,경기,강원도 단풍여행지, 단풍시기"
다양한 산양삼이 가득~ 2023 평창 산양삼축제 방문 후기
강원도 평창 가볼만한곳... 입장료 가을 나들이 10월 여행지 추천
국내 여행 지도 안에서도 찾아볼 수 있는 명소 5곳 추천
"8월 갈만한 국내여행지 추천 (feat. 버릇처럼, 열두달 여행)"
강릉추천 여행지 “대관령... 반려견동반가능 여행지)
대한민국 숨겨진 여행지 100을 보면서  -  1
[강원도 평창 여행지] 가족 모두가 즐길 수 있는 이효석문학관과... 
평창 맛집 | 평창 여행 중 마주친 와우대관령한우 정육식당
강원도 가볼만한곳 평창 양떼목장 겨울여행지 추천
단풍캠 찾고 있다면?! 강원도 단풍 캠핑장 추천
"눈 내리는 날 놓치지 말아야 할, 겨울 여행지 BEST 5"
평창 여행코스 육백마지기 무이예술관 강원도 이효석문학관... 
산양유 맛보고 양몰이 공연까지…가볼 만한 목장 여행지
강원 정선여행 꼭 가볼만한 곳 바로 이곳 정선 화암동굴
평창 대관령 양떼목장 체험하기
평창 가족여행 아이랑 가볼만한 곳 이효석 문학관 효석문화마을
강원도 정선 겨울여행지 6곳 모음
"10월 국내 여행, 가을에 더욱 당기는 맛~ 평창에서 가릿!"
겨울 여행지 추천 겨울에 가 볼만한 국내 여행지 베스트 5
"[강원도/강릉] 11월 강릉여행 : 평창 대관령 삼양목장, 강릉... "
강원도 가볼만한곳 용평 발왕산 스카이워크 여름휴가 추천
평창 딥다이브 뮤지엄 할인팁과 관람코스 알고가세요~
강원도 평창가볼만한 여행지:: 겨울방학에 아이와함께 떠나기... 
2박 3일 강릉 여행기 3편
2015년 9월 전국 축제 정보 및 여행지 추천&gt;ㅁ&lt;b
[강원/평창] 육백마지기(평창88송어횟집)
평창 대관령한우 일송정 갈비탕 버섯불고기 추천
'겨울왕국'이 이곳에! 새하얀 국내 눈꽃 여행지 3곳 추천
"강원도 여행지 추천 5곳, 숙소 예약까지 한번에!"
[평창여행] 강원도 평창 겨울여행 가볼만한 대관령 여행지... 
운치있는 우중 산책 여행지
"[강릉] 11월 가족여행, 1박2일 - 2 (인터콘티넨탈OXY DELI... "
[강릉여행] 겨울 여행지는 한국의 알프스 &quot;대관령 양떼목장&quot;
"[꿀단지] 가을, 겨울에 아이와 놀러 가기 좋은 곳 11"
국내 여행지 추천 한국의 알프스 대관령 양떼목장
평창 가볼만한곳 베스트10 여행지 추천 바로 여기
강원도 평창 가볼만한곳 너무나 멋진 대관령 양떼목장
강원도 방탄소년단 여행지 : BTS 비대면 투어 쇼!
평창카페 맛있는데 가격도 착한 아페너
강릉 평창 당일치기 가볼만한곳 삼양목장 포함 5곳 국내여행추천
인생사진 찍을 수 있는 국내 눈꽃 여행지 알아보기
"초겨울에도 운치있는 강원도 오대산 월정사, 전나무숲길 여행 #1"
강원도 평창 여행 가볼만한곳... 적멸보궁 국내 가을 여행지 추천
강원도 평창/강릉 여행 코스 :: 3일_라마다호텔앤스위트 조식... 
"강원도 평창 대관령 여행지 추천, '삼양라운드 힐' 관광 중 힐링... "
(옛 삼양목장) / 가을 여행지 추천 / 힐링트레킹 코스❤️
추운 겨울 설경이 아름다운 관광지 추천 BEST4(인제자작나무숲... 
휘닉스파크 렌탈샵 평창 휘닉스에서 가까워요
"여름에 가기좋은 강원도 여행코스 - 강릉 안반데기, 평창... "
"강원도 평창여행 맛집, 아기랑 가기 좋았던 3곳 소개♡"
강원도 아이와 가볼만한곳 양떼목장 비교후기
"한국 속 알프스 여행, 대관령 양떼목장, 영남알프스, 청옥산... "
평창 방림면 여행지에서 만난 맛난 방림정을담은 식당
평창여행지추천 이효석 문학관 다녀왔어요
강원도 가볼만한곳 평창 발왕산 케이블카 &amp; 스카이워크
[강원도 여행지 추천] 두번째 이야기 대관령 양떼목장... 
[겨울 국내 여행지 추천] 대관령 양떼목장 폭설이 내리던 날
오늘의 국내여행: 강원도 가볼만한곳 데이트장소 대관령... 
강원도 여행지
평창 고랭지 김장축제 기본정보
강원도 겨울여행 계곡 캠핑장 추천 힐링하기 좋은 흥정계곡... 
2023년 전국 봄 여행지 추천 BEST
"[월간웰촌] 로컬의 맛 찾아 떠나는 빵지순례, 힙스러운... "
"강원도 리조트, 아이와 떠나는 평창 여행지 추천"
9월 꽃구경 가을 여행지 평창 백일홍축제와 평창바위공원
강원도 평창 대관령 카페 알펜시아 근처 [나무 이야기]
가족 여행하기 좋은 겨울 여행지 추천 Best 4
"대형프로젝트: 전국 플레이스 모음.zip/국내 여행지, 촬영지"
[평창 가볼만한 곳] 가을꽃이 펼쳐진 평창 백일홍 축제
"이국적인 풍경과 함께하는 여행 3선/선자령 풍차길, 신두리... "
"겨울 여행지 추천, 겨울에만 떠나는 여행지 태기산, 겨울... "
강원도 평창 가볼만한곳 힐링 여행 코스 허브나라... 
강원도여행지추천 필수 여행코스 양떼목장
평창 가볼만한곳 아이뮤지엄 컬러랜드 포함 평창 여행지 리스트
[여행사람] 강원도에 가면 들려야 할 데이트 코스 top 5
"[강원_평창] 알파카 목장 먹이주기 체험 카페, 아기랑 체험할 수... "
강원도 평창 9월 당일치기여행지 백일홍축제와 효석달빛언덕
강원도 대관령 가볼만한곳 양떼목장 여름 여행지
[강원여행/풍차여행]가을에 떠나야 할 단풍 여행지 3곳 / 인제... 
강원도 여행지 정선5일장 정선 아리랑시장 먹거리 추천
평창 가볼만한곳 이효석문학관 외 여행 코스 추천
"강릉, 평창 여행지 추천)대관령 양떼 목장 겨울 후기"
"내가 다녀왔던 국내 여행지 가볼만한곳, 데이트코스 추천"
강원도 여행지 추천 아이뮤지엄 컬러랜드&amp;발왕산케이블카... 
겨울 놀러 갈만한곳 겨울 풍경이 아름다웠던 BEST 5추천
대관령 양떼목장 겨울 여행지는 역시나
라플란드 글램핑 G1 후기/캠핑장 포토 스팟 추천
대관령 양떼목장 강원도 대관령 가볼만한곳 대관령 순수... 
평창 가볼만한곳 평창송어축제 외 겨울 평창여행 코스
휘닉스파크키즈펜션 :: 5월 아이들과 여행지 '숲속의요정'
"2월여행지추천, 얼음축제부터 불빛축제까지~!"
강원도 평창 가볼만한곳 :: 야생의 초원 ‘대관령... 
"[강원도] 대관령 하늘목장 , 강원도 애견동반여행지 추천"
알펜시아근처여행/평창겨울여행/평창강원도민할인/
사진으로 떠나는 여행! 사진 속으로 GOGO! 대리만족 여행!
평창 가을여행 야간관광 황새여울 '은하수다방'
국내 여행지 추천 평창 가볼만한 곳 휘닉스파크 '블루캐니언... 
강원도 평창 가볼만한곳 대관령 맛집 추천 납작식당 오삼불고기
32개월 아이와 평창 봉평 여행 휘닉스파크 곤돌라 탑승 숙소... 
국내 겨울여행지 추천 새하얀 눈 맘껏 보기!
[강원도 평창] 오대산 월정사에 눈이 내리면 겨울여행지
"동서강정원 연당원, 판운섶다리 포함 5월 강원도 여행코스 best6"
겨울 강원도 여행 가볼만한곳 볼거리와 놀거리
대관령 가볼만한곳 대관령양떼목장 눈내린 이국적인 풍경
"강원도 평창 가볼만한곳 대관령 양떼목장,하늘목장,삼양목장... "
kbs이만기동네한바퀴강원평창방송촬영지?... 
[강릉여행1일차] 멍에전망대(쏟아지는 별구경 짱) &gt; 평창 라마다... 
[여행지] 평창 오대산 월정사 전나무숲길 - 무더운 여름에 가기... 
대관령 가볼만한곳 베스트10 추천 강원도 여행지
[강원도 평창군] 국내여행지 추천 강원도 평창군! / 강원도 평창... 
[강원도평창] 부일식당 / 오대산전나무숲길_ 월정사 걷기좋은곳... 
강원도 여행지 평창 광천선굴 어드벤처 테마파크 동굴 탐험
"평창 월정사 오대산 전나무숲길 + 입장료, 카페"
아이와 함께 자연과 역사 공부! 강원도 월정사
"발왕산카페 커피엠스테이블 레몬케이크, 유자차, 핫초코 힐링... "
[강원 평창] 겨울 강원도 여행지 추천- 대관령 삼양 목장
평창 가을 가볼만한 곳 평창사랑 송어와 수다... 
[강원도 평창 숙소] 겨울 전나무숲 여행 '밀브릿지' 독립동 301호
사진으로 떠나는 여행! 사진 속으로 GOGO! 대리만족 여행! 2탄
| 컬쳐 | 아름다운 우리나라 겨울여행지 추천! /겨울여행지추천... 
강원도 평창 휘닉스 여기어때 콘서트팩 후기
평창 가볼만한곳 미디어아트 전시관 뮤지엄 딥다이브
아시아의 알프스로 각광받는 겨울여행지 &quot;대관령 양떼목장&quot;편!
"(일상, 여행.1)2022년 12월 국내 여행지 추천 6곳"
[강원 정선여행] 죽기전에 꼭 가봐야할 여행지 정선 아우라지
2019년 자연과 함께하는 모험 생태관광지역으로 떠나자!
용평리조트 아이뮤지엄 컬러랜드 알록달록 예쁜 공간
강원도 평창가볼만한곳 평창시티투어 좋아요
알펜시아가 소개하는 평창 지역 맛집!
미러리스 카메라 추천 Nikon Z5 with 강원도 여행
평창 가볼만한곳 베스트10 추천 강원도 여행지
만한 여행지_ 목장길 거닐며 피크닉 즐기기 좋은 목장 여행지... 
여름여행지 추천 평창 가볼만한 곳 평창팜 송어 맨손잡기 체험
대관령하늘목장의 아름다운 가을이야기
휘닉스 평창 콘도 | 리조트 스카이 스탠다드 객실 + 몽블랑... 
"강원도 여름휴가지 추천 (장호항, 양양서피비치... "
사진찍기좋은곳 - 아름다운 대관령사파리목장
[평창맛집] 평창 순대곱창전골맛집 옥봉식당
평창 여행코스추천 포토스팟 데이트 효석달빛언덕
"평창 백일홍축제 개막일에 다녀온 후기 _ 주차, 입장료"
"15 수세식 화장실, 음수대, 개수대 모두OK 1박2일 차박여행지"
&lt;230806 시원한 여름 여행지... 열대야 없는 천국 여행지는 어디?
봉평 맛집 타타리메밀로 만든 월이메밀닭강정 내돈내산
[강원도 평창 여행지 추천] 국립한국자생식물원에서 힐링하고... 
[평창 카페] 평창 백일홍 축제장 근처 애견동반 카페 그리심
요즘 가볼만한곳 평창 용평리조트 마운틴코스터 할인 예약 가격
"동계올림픽을 추억하며, 용평리조트"
강원도여행 모나파크용평리조트 애니포레 모노레일 후기
강원도 평창 가볼만한곳 양떼목장 용평 리조트 평창... 
강원도 애견동반 &lt;평창 라마다 호텔&gt; 펫룸 스탠다드 트윈... 
대관령가볼만한곳 드라이브 스루 평창 양떼목장 대관령... 
[강원도 겨울 추천 여행지] 묵호 동해 도째비골 스카이밸리... 
"[이거 알았뜐?] 겨울 여행, 어디로 가는 게 좋을까?"
[평창 부일식당] 50년 전통 산채백반 맛집
평창 가볼만한곳 아이들과 함께 떠나는 겨울여행 코스... 
1박2일 시즌4 평창 육백마지기 차박 여행지
가족끼리 호캉스하기 좋은 곳. 강원도 여행지 추천 5곳
은하수와 일출과 운해 감상하기 좋은 강릉 명소 강원도 안반데기
겨울여행지추천: 핫플레이스 평창송어축제 잊지말고 기억하자!
'겨울'하면 역시 강원도! 평창 막바지 눈꽃여행 :: 오대산월정사... 
대관령 하늘 목장 : 체험 가득 신나는 목장
대관령 양떼목장 여름 방문 가격 및 먹이주기 체험
강원도 가볼만한곳 1박2일 평창 강릉 여행 코스 11곳
곳 국립한국자생식물원 산책로 6월 7월 힐링여행지.(입장료 무료)
온실과 야생화 정원까지 산책하기 좋은 강원도 여행지
겨울 이색 데이트 국내 여행지 추천 양떼목장 가볼만한곳
[국내여행] 우리가 꼭 가볼만한 겨울여행지 추천 모음.Zip
요즘 더 눈에 들어오는 비대면 웰니스 여행지 9
강원도 당일치기 여행 10월 가볼만한곳 대관령 양떼목장
강원도 평창 가볼만한곳 발왕산 케이블카 단풍 구경
[강원] 2013봉평메밀꽃축제 평창효석문화제 - 추석여행지추천... 
평창 가볼만한곳 힐링한 강원도 여행 오대산 월정사 전나무숲... 
평창 마운틴코스터 빠른 스피드와 급경사로 심장 쫄깃한... 
"평창 가족여행지 강릉 대관령 삼양목장-관람,체험,포토샷"
후기 / 풀내음 애견동반 후기 / 내돈내산 / 반려견동반여행지 추천
"내가 뽑은 국내 겨울 여행지 추천 (남이섬, 덕유산, 발왕산... "
국내 겨울 여행지 추천 리스트 best 6
강원도 평창여행 강릉여행... 오죽헌 가족여행 1박2일여행지
[여행 알파고] 작년 설 국내 여행 어디로?
흥정계곡  강원도 평창  여름물놀이 스노쿨링 평창... 
평창허브나라 봉평여행 가을여행지 추천
9월 추천여행지 봉평메밀밭&amp;봉평 맛집 메밀꽃필무렵
[강원도 가볼만한 곳] 먹거리와 볼거리가 가득한 강원도 5일장... 
평창 가족여행:: 어르신들 코스 및 평창맛집 추천 (월정사 및... 
평창 가볼만한 곳  대관령 삼양목장 동해전망대
"가을, 가을이 끝나기 전에 떠나자 - 국내 가을여행 추천 여행지!"
관광두레 와우미탄-자연을 가득 담은 어름치마을과 뜨라래펜션
주말 강원도 여행코스 갈만한곳으로 알려진 TOP 5장소
강원작가트리엔날레 평창... 평창 강원트리엔날레 전시 공간... 
평창 가볼만한 곳 뮤지엄딥다이브 정보와 신비로운 미디어아트... 
강원도 평창 가볼만한 곳 평창 대관령 양떼목장 가을여행 추천!
강릉 여행지로 추천하는 하슬라 아트월드 (커플 포즈 추천 및... 
별 보는 여행지
"강원도 여행지 추천, 대관령 하늘목장 트랙터마차 투어!"
12월 국내 여행지 추천 BEST 4 : 겨울 국내 여행지... 
"강원도 평창여행 가볼만한곳 &lt; 이효석 문학관, 동 카페, 주차... "
"대관령 하늘목장 트랙터마차 후기,승마체험은 비추"
평창 가볼만한곳 대관령 하늘목장 BEST 4곳
평창 대관령 맛집 몽블랑 레스토랑 후기 알펜시아 리조트... 
대관령 아기동물농장 :) 강원도 여행지 추천
평창 맛집 월이 메밀 닭강정 :9 봉평 메밀국수 먹고 더블로 가
대관령 여행지 삼양목장&amp;평창한우맛집 추천!
"대세 여행지로 떠오른 시골, 촌캉스 떠나자! ::: 한국... "
탕탕! 취저를 노린다  #국내_여름휴양지
"1월, 2월 여행지로 추천하는 국내겨울여행 강원도 평창 여행... "
"[부름 생활 꿀정보] 설레는 봄 모임, 여기 갈까? 국내 여행지 추천!"
강원도 가을여행 주말 아이와가볼만한곳 대관령양떼목장
강원도 평창여행지 추천
"[강원_횡성,평창] 가을 여행 1박 2일 1부"
"가을 단풍 명소, 평창 가볼만한곳 월정사 전나무숲길"
"[강원도여행, 평창 아이와 가볼만한곳♡]용평리조트 발왕산... "
"강원도 평창 대관령 목장 특징 및 비교 (양떼목장, 삼양목장... "
"천년의 숲, 발왕산 모나파크 케이블카 - 강원도 평창군 대관령면"
"평창 가볼만한곳 1박2일 여행 코스 대관령 삼양목장, 발왕산... "
강원도 평창 가볼만한곳 대관령 양떼목장 여름 휴양지 목장... 
"평창의 도로명, 하나씩 알아볼까요?"
강원도 가볼만한곳 당일치기코스 _ 대관령양떼목장
강원도 강릉 은하수 별 보러 가는 곳 평창 안반데기 (화장실... 
[맛집] 오대산맛집 두일막국수에서 아이와 함께 저녁먹기 좋은... 
"청령포 망향탑 관음송 설경, 국내 강원도 겨울여행지 추천"
국내 겨울 여행지 추천 베스트 10
[추천 여행지] [한국의 아름다운 길 100선] 강원도 아름다운길
5월 국내 여행지 추천 BEST 5
Life Style 41.겨울 커플 여행지 추천 Best 3.
# 강원도 풀빌라펜션 평창 &lt;펜던트하우스&gt;
평창독채펜션 평창강 힐링하우스에서 마케팅 공부했어요
1월에 가면 좋은 국내 여행지 추천 ❄
[여행지추천/국내여행] 10월에 가기 좋은 국내 여행지 추천 :)
"강원도 대관령 양떼목장, 날씨 좋을 때 평창 가볼만한곳 주차... "
더욱 아름다워 보인다! &quot;강원도의 가을&quot; [강원도 여행지/영상]
"평창여행,대관령여행 가성비 좋은 호텔형 리조트 '평창 라마다... "
가을 강원도 혼자여행 대관령양떼목장
강원 평창 발왕산 평화봉 정상!
"강릉 여행지 추천 대관령양떼목장 소요시간, 포토존 추천"
국내1박2일여행 평창가볼만한곳 안반데기 대관령 삼양목장... 
강원도 유명한 절 평창 오대산 월정사 입장료 국내 힐링여행
강원도 겨울 여행 추천 : 강원도 평창 발왕산 케이블카... 
평창 봉평 백년가게 &lt; 옛골 초가집 &gt; 메밀요리 맛집 이전 위치... 
평창 알파카 목장 카페 마추픽추 알파카 먹이주기 체험도 즐겨요
"여름 청량함이 가득, 육백마지기"
인생사진 남길 수 있는 강릉 인생샷 추천지 / 강릉 여행지 추천
평창 1박 2일 여행코스 추천 7곳! (ft. 강원도 여행지)
가을 여행지 추천 :: 2016 강원도 가을 축제 소개~
강원도 체험여행ㅣ아이뮤지엄 컬러랜드 실내테마파크ㅣ아이와... 
겨울 얼음낚시 축제를 소개합니다!
"[가볼만한강원도여행지역] 강원도 여행, 강원도에... "
강원도 평창 카페 연월일 with 파뷰
"가을 단풍 여행가자! 2017년 단풍 시기, 국내 단풍 명소 소개"
[평창 숙소] 강원도 전나무숲 숙소 “밀브릿지” 3인실B(302호)... 
요즘 대세 레트로 감성 가득한 강원도 촌캉스 숙소 추천
강원도 평창/강릉 여행 코스 :: 1일_평창올림픽시장... 
"강릉 드라이브코스, 먹거리 가득 겨울 여행 한우육개장 및... "
"만난 강원도의 사람, 책, 자연이야기&gt;, 강원도 가볼만한곳"
[평창여행] 켄싱턴호텔평창(조식포함)/가족여행지추천
"강원도평창여행 :: 평창맛집추천 - 축협 대관령한우타운 , 평창... "
단풍과 노을이 멋진 강원도 캠핑장 2곳
평창&amp;가평 가족 여행 후기(평창 편)/여행지 추천/여행 후기
평창 발왕산 케이블카 스카이워크 다녀온 후기
2018 겨울 축제 여행지 추천! 지금이 딱이야!
우리도 잘 몰랐던 우리나라 이쁜 풍경을 가진 여행지 추천 명소
겨울에 가고싶은 강원도 핫플레이스 여행지: 평창 대관령... 
귀여운 동물 보고 먹이주러 떠나는 여행지 3곳
평창 비오는날 실내여행 : 뮤지엄딥다이브
광천선굴 어드벤처 테마파크 아이와 떠난 신비로운 동굴탐험
평창여행숙소 가성비 괜찮은 더화이트호텔 호캉스
강원도 평창 상원사와 선재길 1박2일 촬영지로 아이들과... 
강원도 평창 피닉스파크 맛집 해물뼈찜 봉평 장금이감자탕~
평창여행 가볼만한곳 강원도 루지 타러 휘닉스 평창루지랜드
12월 국내여행지 베스트 10 추천
강원 평창 인생 맛집 봉평 미가연(feat. 휘닉스 평창... 
새하얀 겨울에 떠날 수 있는 추천 여행지
강원도여행 평창강릉 당일치기 핫플 여행코스 추천
올해가 가기 전에 꼭 가봐야 하는 12월 인기 여행지 추천
2023 가을 추천 여행지 TOP 10!
강원도 여행 평창 가볼만한곳 대관령 삼양목장 입장료 할인 주차
달 밝은 밤 낭만을 즐기는 농촌체험마을여행
국내 겨울 여행지 추천 5 [설경]
"평창 여행코스 꿈의대화 캠핑장부터 밀브릿지, 흥정계곡까지"
국내 여행지 가볼만한곳
"[평창자연휴양림] 자작나무 204호 방문기, 숲속체험장 이용후기"
강원도 가볼만한곳 대관령 양떼목장 건초주기 체험까지
(2022년 단풍여행) 국립공원 탐방로별 사전예약 운영기간 및... 
[평창휘닉스파크맛집] 평창 대관령 한우 일송정 ㅣ... 
호텔스닷컴 9월 할인코드 핫한 호텔성급 예약해요
겨울 가족여행 추천 평창 대관령 눈꽃마을 눈썰매장
18개월 아기랑 다녀온 대관령양떼목장 강원도 여행 일기
사진으로 떠나는 여행! 사진 속으로 GOGO! 대리만족 여행! 3탄
"부담없이 다녀오기 좋아, 겨울에 떠나기 좋은 국내 여행지 추천"
강원 ) 평창 레지던스 호텔 횡계 AM호텔 디럭스 패밀리룸... 
오대산월정사 전나무숲길 카드뉴스
강원도 여행 겨울여행지 추천 [대관령양떼목장]
2월 국내여행지 추천 베스트 5
강원도 1박2일 가족여행 용평리조트 컬러랜드와 발왕산 케이블카
주차장 / 강원도 추천 여행지 / 가볼 만한 곳 / 사진 찍기 좋은 곳
"평창여행 대관령 삼양목장 젖소,양떼공연"
평창 이효석 생가 옆 메밀음식 맛집 메밀꽃필무렵
겨울 강릉 여행 1박2일 추천 여행지 대관령 삼양목장
강원도 평창 가볼만한곳 대파뷰 카페 연월일
강원도 별 여행지(펌글)
강원도 평창 가볼만한곳 대관령 양떼목장 입장료 할인 시간... 
"백신 맞고 농촌여행 가자!…자연에서 힐링하고, 1만원... "
"[평창가볼만한곳] 담백한 맛! 평창 횡계 맛집, 평창 촌닭"
"대관령 삼양목장, 양떼목장 겨울 여행 후기"
강원도 여행 : 평창 대관령 양떼 목장
평창 생태관광 어름치마을 동강슬로우보트
[강원여행]  삼척 영월 정선 평창
국내 여행지 베스트10  가을 여행 가볼만한곳
국내 여름휴가지 추천 :: 평창 가볼만한곳 흥정계곡 밀브릿지
"평창 영동고속도로 인근 가볼만한곳 추천 [광천선굴, 밀브릿지... "
평창 배두둑마을 시골체험 여행 목공체험 도마만들기 이색체험... 
대관령 양떼목장 코스 입장료 예매 주차장 국내 1박2일 여행지
대관령 삼양목장 강원도 평창 여행 풍력발전소
"추억을 담아 떠나는 나의 오렌지 나무 &lt;김소령의 양양, 대관령... "
강원도 막국수 믿고 가볼만한곳 평창 봉평 맛집 여행... 
"[강원도 여행] 전설이 깃든 천년고찰, 평창 상원사"
겨울 여행지 미리보기
평창 뮤지엄딥다이브 미디어아트 전시 관람
[일상] 강릉여행지 추천_대관령 양떼 목장_고선생 생선 화덕구이
"국립횡성숲체원, 무릉별유천지, 평창자연휴양림 강원 관광 이끌어"
휘닉스 평창 오렌지동 콘도. 와인 무제한 아베토와인마리아주
국내여행지 추천 평창 가볼만한곳 베스트 5
평창 가볼만한곳 여행 준비 호텔은 휘닉스호텔로
평창겨울여행 | 당일치기 코스 관광택시
"정겨운 우리나라, 국내여행 추천 정보"
평창시장 평창5일장 백룡동굴 라마다호텔  / 강원도여행지추천
대관령 양떼목장 아이랑 강원도 여행 가볼 만한 곳
강원도 별구경 육백마지기 은하수 휴대폰으로 찍기 꿀팁
"국내여행지 백패킹 성지 백두대간 선자령, 등산 초보 코스... "
[지자체 홍보영상 제작] 강원도청 관광과 홍보영상 제작
발왕산 관광케이블카 발왕산 氣 스카이워크 1박2일 강원도여행
여행지 추천 1
걸으면 건강하다 ··· 피톤치드향 그윽한 오대산 “천년 옛길... 
2TV생생정보 10월 24일 가게 정보 l 전설의 맛... 
2020.07.31 차박여행_육백마지기
"[평창 가볼만한곳] 꽈배기 인절미 빵 횡계맛집, 평창 루&amp;루... "
[강원 여행] 오대산 월정사 전나무숲길..'텅빈 충만... 
::가을 국내여행지:: 엄선작
