떠오르는 여행지! 강원특별자치도 양양군 | KBS 230629 방송
[강원 양양군 손양면] 수산항에서 즐기는 양양요트투어... 
"[강원 양양군]양양 현남면 갯마을해변 핫플레이스, 감각적인... "
[강원 양양군] 서피비치(중광정 해수욕장)
강원특별자치도 양양... 겨울 주말에 떠나기 좋은 여행지 TOP5
[강원 양양군] 강원 여행 3일차 양양 필수여행코스 낙산사
"[강원 양양] 오색매력 풍경, 쉼과 맛을 가득 담은 여행지"
생활의 발견 곰치탕 강원특별자치도 양양군 택시맛객들의수다... 
강원 양양 낙산사 주차장 정보 해수관음상 가볼만한 여행지
[강원 양양] 여자 혼자 국내 여행지 추천 ! #물치리 #서프살롱... 
여행이좋다 :: 강원도 양양 가볼만한곳... 양양군 볼거리 먹거리.... 
2023 강원 세계산림엑스포 /고성 가볼만한 곳 여행지 추천... 
"[트래블투데이] 곳곳마다 비경, 강원 양양군!"
포토강원 이달의 추천 여행지... 하조대 등대 양양 양양군 강원도
강원도의 겨울이야기! 강원네이처로드 ㅣ 겨울철 추천 여행지
"[강원 양양군] 강원 여행 3일차 한계령휴게소 카페 한방차, 옥수수"
양양군실내체육관으로 떠나는 즐거운 스포츠 여행
12월 국내 여행지 온 몸을 녹여 줄 노천온천 5곳 알아보기
[강원 양양] 단풍이 무르익은... 즐기기 위해 떠나보는 여행지
겨울여행추천 양양하조대 전망대 강원도겨울여행지_암석해안... 
개최중 강원세계산림엑스포 추석 여행지로 추천
강원도 워케이션 여행지 추천 청초호 야경 웨이브웍스 10월... 
양양군 동호리 마을과 동호해수욕장 카페부터 피크닉까지!
♬ 로컬100에 선정된 강원문화매력 20가지 공개 ♪
강원도 가을 여행 국내 10월 11월 여행지 추천 베스트 4
강원 양양 가볼 만한 곳 여행지 추천 공기 좋고 평온을 찾을 수... 
강원도 여행지 추천 동해안 가볼만한곳 고성 청간정... 
강원도 여름 여행지 양양 서피비치 해변 바다 썸머시즌 파티!
강원도겨울여행지 양양해변 하조대 해수욕장 겨울바다 눈구경
"강원 양양여행 일출 낙산해수욕장,물치항,물치해변"
강원도 여행지 추천 양양 관광지 죽도정 &amp; 죽도전망대
[양양 여행지] 양양 바다가 보이는 사찰- 낙산사
강원도 3대 미항의 한곳 양양 추천여행지 남애항
강원도 양양 가볼만한 곳... 부모님과 여행할 때 좋은 여행지
국내 강원도 여행지 추천 강릉 양양 강문 안목 해변
국내 1박2일 여행지 양양 속초 가볼만한곳 여행코스
강원특별자치도 기념물 제53호 선림원지를 아시나요?
양양 가볼만한곳 - 여행지 이색체험 ✧ 도자기공방 &lt;모꼬지공방&gt;
국내 온천 여행지 추천 5곳
"양양 여름 하면 떠오르는 여행지, 낙산 해수욕장에서 신나는... "
[강원/양양] 낙산사 양양에왔다면 꼭 가봐야하는 여행지 ♥
강원도 양양 가볼만한곳 물고기 먹이 주기 체험할 수 있는 양양... 
[강릉] 부모님과 가기좋은강릉여행지 *낙산사*
가을 여행지 추천! 아이들과 함께 가기 좋은 양양 에너지팜
7월 국내 여행지 추천 장소 1박2일로 가기 좋은 장소들
"가을 여행지 추천, 가을이 더 여유로운 가족 휴양지 쏠비치 양양"
강원도 가볼만한곳 강원도 가족여행 코스1박2일 여행지 추천
[강원 양양] 서핑&amp;낙산사 1박2일 뚜벅이여행
강원도 양양 하조대 아이와... 하며 걷기 좋은 가족여행지
서핑의 성지 강원도 양양 여행지와 양양 가볼만한곳 추천... 
강원도 양양 정암해수욕장... 양양 몽돌 해변 국내 여행지 추천
국내 1박2일 여름 여행지 추천 강원도 속초 양양 가족 커플... 
양양 가볼만한곳 양양여행 코스 핫한 양양 인기여행지Best10
강원 / 하루종일 예쁜 가을바다 양양해수욕장추천 동호해변!
"양양 애견동반, 강원도 여행지 추천(멍비치, 식당, 카페)"
"예술과 문화의 향연, 양양문화원에서의 하루"
[강원양양여행지] 낙산사 후기
양양군맛집 : 장산리 진미 메밀국수 : 메밀 100% 진짜 메밀면
11월 추천 여행지 색다른 경험이 가득했던 TOP5 장소
강원도 양양 하조대 해수욕장... 바다 드라이브 코스 여행지 추천
"강원 속초 가볼 만한 곳 | 하도문쌈채마을, 영랑호... "
강원여행지 [양양 낙산사]
강원도 양양 애견동반 식당 동호해변 팔도대게횟집 대게포장 가능
바다 앞 카라반 영국식대형카라반 반려동물가능한 여행지
양양여행 가볼만한곳 남대천 생태관찰로의 광활한 금빛 갈대숲
2023 강원세계산림엑스포 방문 후기! 고성 여행지 추천
&lt;강원 양양군/낙산사&gt;강원답사일번지....낙산사로... 
국내 여름 여행지 강원도 양양 설악산 숙소 오색연가 계곡 펜션
"중광정 해변 양양서피비치 핫플 여행지 (주차,포토존)"
양양 카페 추천 카페둔치 &amp; 레저 남대천과 갈대밭 가을 풍경
양양의 숨은 여행지 숲과 계곡이 아름다운 미천골 자연휴양림
여름 국내 여행지 추천 바다 축제 가볼만한곳
[강원도 양양] 강원도 뷰 좋고 힐링하며 산책하기 좋은 여행지... 
가을 풍경이 멋진 양양 추천여행지 설악산 주전골계곡
"혼자 여행하기 좋은 양양 여행지, 송전해수욕장"
[양양 카페] 배배젤라또 - 배과수원 카페
가족과 함께하는 5월 여행지
양양 남대천 양양연어송이축제 놀거리 강원도여행지 갈만한곳
양양 가볼만한곳 남대천 생태관찰로 갈대 11월 여행
[양양 가볼만한 곳] 강원도 여름 여행지 추천 양양 여행코스
"특별하게 농촌 여행을 즐기는 법, 색다른 농촌 체험 여행지 6곳"
강원/양양 : 리모델링한 깔끔한 펜션! 양양펜션 '양양 웰니스썬... 
강원도 양양군 오색온천 근처 맛집 등선대식당 돼지주물럭소개... 
자연의 아름다움을 만끽하며 평온히 쉴 수 있는 양양 영덕호
"양양 남대천 체육공원, 자연과 함께하는 청명한 낮의 휴식"
"양양 가볼만한 곳, 가평리 해바라기밭 사진찍기 좋은 곳"
9월 10월 가을 국내 여행지 추천 베스트 10
양양 #서피비치 #이국적인 #여행지 #꿀팁
부산삼촌계란호떡깡통시장비빔당면&amp;강원양양여행지휴휴암남... 
방탄소년단 뷔가 찾아간 힐링 여행지는 어디? #낙산해수욕장... 
"강원 투와이호텔(양양)(강원,양양군 추천 비지니스호텔)... "
현상공원 - 강원 양양군 양양읍
양양군 미천골자연휴양림-한국관광공사 추천 ‘6월에... 
양양 가을 여행지 가볼만한곳 추천 TOP5
5월을 위한 여행지! 양양 하조대 &amp; 남대천 연어생태공원
현지인 추천 양양 여행지 직접 가봤다! (feat.게하 스태프)
[강원 양양군] 1️⃣ 21.08.18~23 혼자 떠난 여행
가을 낭만 가득한 어촌체험마을 여행지 추천
10월2일 임시공휴일 확정! 떠나기 좋은 9월 10월 여행... 
[국내 여행지 추천] 해외 바다 부럽지 않은 국내 서핑 명소... 
안전하게 여행하는 방법! 언택트 강원도 차박 여행지!
해외여행 느낌 나는 국내 여행지 5
5월 가정의 달을 맞아 가족과 함께 가볼만한 농촌 여행지 소개
양양 수산항 요트 마리나에서 즐기는 체험 프로그램 알아봐요
강원 양양서핑여행5️⃣ 설악해변 고깃집 양양 이태원왕갈비
"바닷가 근처 힙한 피자 맛집, 강원 양양 남애 3리 해수욕장... "
양양 여행지 추천! 산책하기 좋은 송천떡마을과 갈천 약수터
"강원도 여행, 영동지역 여행지] ]가자!!!  강원 동해안 [속초... "
강원도 여행지 추천 / 양양 가볼만한곳 :) 바다가 보이는 사찰... 
8월 휴가 여행지추천 강원도 양양여행 남애1리해수욕장
강원도 양양여행 1박2일 코스 숙소 죽도정전망대 외 가볼만한곳
강릉 양양 : 여행지에서 즐기는 이색적인 농구 카페 오아오
국내여행지 추천 양양 휴휴암 방생물고기 황어떼 구경
[강원 양양군 강현면] -관세음보살이 머무른다는 낙산사
[165호] 좋은 마음을 이끌여름 국내 여행지PICK 5
설악산 일대 가을여행지 필수코스 추천 [백담사... 
"[월간웰촌] 가을 트레킹 명소, 단풍이 아름다운 여행지 7곳"
포토존 등 볼거리 놀거리 강원도 서퍼비치 국내 여름 여행지
속초 양양 여행 코스 영금정 갯배체험 외옹치바다향기로
국내 여행지 - 신안 증도... 함덕해수욕장 / 강원도 강릉... 
8월 국내여행지추천 강원도 동해안 양양여행 지경리 해수욕장
"[여행 여가] 강원_아름답고 깨끗한 자연이 있는 곳, 강원도로... "
12월 겨울여행지 추천 / 강원도1박2일여행코스
지금가면 더할 나위 없는 #양양추천여행지 총.정.리❤
혼자만 알고 싶은 국내 여행지 15
현대관광렌트카 양양여행을 편하게 다닐 수 있는... 
대한민국 꼭꼭 숨겨진 여행지 베스트 7
"강원도 여행지 추천 / 당일치기 드라이브 (풍수원성당,태기산... "
강원 양양 하조대 :: 양양 최고의 경승지
"강원도 양양 여행지, '휴휴암' 물고기떼가 장관인 해안에 위치한... "
여름 휴가 속초 강릉 가볼만한 곳 여행지 총정리
양양 막국수 맛집 메밀꽃향기
"강원도 차박여행지 추천&gt;, 강원도여행, 강원도 가볼만한곳... "
"강원도 양양관광지, 다가올 봄날 가볼만한 양양 여행지"
양양 양리단길 카페 인구해변 카루나 라운지
강원도 여행지 추천 고성 가볼만한곳 강원 세계산림엑스포
양양 여행 코스 추천 하조대 후기 (양양 제 5경)
"휴휴암(休休庵), 강원도 여행지 추천, 양양 가볼만한곳"
"플라이 강원, 10월 날아오르다"
"달맞이 마실, 어디로 갈까? 정월대보름 달맞이 여행지 추천!"
서핑족이 즐기기 좋은 서핑여행지 3
"겨울에 가기 좋은 국내 여행지, 노천온천 편"
정겨운 바닷바람이 반겨주는 남애항 양양 가볼 만한 곳으로 추천
"양양 가족캠핑장 추천, 조용함이 가득했던 양양 솔바다캠핑장"
양양여행지추천 후진항+비치마켓
아이들과 함께 가볼 만한 곳 양양 오산리 유적지와 선사유적... 
가을 가볼만한곳 양양 낙산사 강원도 여행지 추천 당일치기 여행
여행지 추천 | 강원도 여행_고성군(2023 강원세계산림엑스포)
"강원도 양양 바다, 팥빙수 닌베, 막국수 먹거리, 인구해수욕장... "
반려견 동반 양양 여행 필수 코스 강아지들의 휴양지 멍비치
양양볼거리 강원도양양서핑명소 양양서피비치 양양양리단길... 
강원도 단풍여행지 고성 8경 가볼만한곳 화암사 금강산 신선대... 
"[강원도] 가을 여행지 추천, 무료 입장 가능한 양양 낙산사"
[낙산사] 속초 여행지 추천 하이킹 느낌의 데이트
양양 여행 스릴 넘쳤던 해담마을 수륙양용차 (feat 하조대... 
생생정보양양방송촬영지?강원양양해변서핑해담마을ATV체험오... 
"너무 아름다운 양양 여행지 추천(주차장, 운영시간, 사진 有)"
강원도 3월 1박2일 여행지로 가기 좋았던 곳 5!
답답한 가슴이 뻥뚫리는 겨울바다 여행지 양양 서피비치... 
무더위를 신나게 날려버릴 수 있는 국내 서핑 스팟 추천 BEST4!
동해안여행지추천 놀거리 먹거리에 관한 모든것~
강원도 여행 양양 가볼만한곳 해변 볼거리
"강원 투와이호텔(양양)(강원,양양군 추천 비지니스호텔)... "
포근한 바닷바람이 반겨주는 갯마을해수욕장 야영장
강원도 여행지 추천 : 한국의 아름다운 풍경 낙산사
푸른 바다가 잠을 깨워주는 양양 남애해수욕장 캠핑장
[강원 양양] 온천리조트 추천! 가족여행 더앤리조트 디럭스더블... 
강아지와 함께하는 국내 여행지 추천
"푸른 바다를 한눈에 담아 갈 수 있는, 양양 가볼 만한 곳 죽도정"
양양 인구해변의 가을 스케치!
곳] 낙산사 - 동해바다가 한눈에 보이는 아름다운 양양 여행지
[강원/양양 여행] : 반나절 가볼만한 곳 - &quot;낙산사&quot;추천... 
"양양 여행 코스 추천 양양 죽도정, 죽도전망대 후기 (양양 제 6경)"
경북 가을여행지 추천 문경새재 도립공원 코스따라 단풍명소 여행
[강원] 양양 서피비치 | 강원도 양양 가볼만한 곳 이국적인... 
"강원 양양군 강현면 낙산지구에 지하 1층, 지상 3층... "
곳에서만큼은 쉬고 또 쉬어가라 한다. 강원도 여행지 추천
국내 온천 여행지 강원도 양양 오색탄산온천
"[강원도 양양] 힐링여행지 죽도정 (전망대, 해변,부채바위... "
"[초보가이드산,명산안내] 강원인제군 북면, 속초시,양양군... "
양양 솔게스트하우스 파티 와이비자 하나로 다 가능?
강원도 여행코스 양양 서피비치 대관령 양떼목장 포함 4곳
더 짠내투어 115회 강원 (양양 &amp; 강릉) 여행지 &amp; 음식점
9월 국내 여행지 추천 :: 추석에 떠나기 좋은 웰니스 여행지 4
강원도 겨울여행 갈만한곳 양양 오색탄산온천 그리고 속초... 
강원도 여행지 추천 : 양양 낙산사와 낙산 해수욕장 (양양 가볼... 
전국 가볼 만한 여행지
강릉~양양 반려동물 여행지] 애견동반 여행지 모음 (소형견... 
강원도 양양 당일치기 여행지 추천 정암 148 정암해수욕장... 
양양 여름 휴가 강원도 여행지 주말 나들이 명소 추천 10... 
"양양 맛집 :: 퀸즈블러바드 양양점, 죽도해변 맛집, 동산해변... "
쪽빛 봄 바다에 설레볼까…강원 어촌 여행지 5선 소개
가을여행지 오색약수터
[강원여행] 여행 3일차 -양양 (2박3일)
"인구항 생활 낚시 조피볼락(우럭), 강원도 양양군 현남면 인구리... "
강릉 여행지 속초 황어를 만나는 절 [ 휴휴암 ]
광주김치축제 2023 대한민국 김치 대표 축제
"양양군, 올가을 오색흘림골 단풍 탐방로 추천"
[강원] 남설악 주전골 &amp; 용소폭포
"9월 국내 여행지 속초 양양 낙산사 입장료, 주차, 카페"
"언제나 힐링 되는 설악의 그곳, 양양 주전골 무장애 탐방로!"
하조대 해변에서 느긋한 바다 산책을
"강원도 양양 여행 추천! 양양의 산책하기 좋은 곳, 매호"
"멍비치, 양양 애견동반 여행지 추천(준비물, 티켓 할인 받는... "
양양 낙산사 원통보전부터 홍련암 의상대까지 강추
속초펜션 사장이 가는 속초 맛집 리스트 (2303수정)
설악해변 낙산사 반려동물 동반 가능 카페 양양 컨센트릭
설악산 오색코스 주차장 이용정보 및 요금 확인하세요!
[강원 양양] 죽도해변이 보이는 오션뷰 숙소 '마할로 호텔(403호)'
강원도 여행코스 속초 척산족욕공원 남대천 등 국내 힐링여행
[강원도/여행] 추억의 가을 여행지_양양 알차게 1박2일 여행하기!
"강원도 여행지 추천 양양 라벤더 코지 풀빌라, 서피 비치... "
조용히 여행하기 좋은 국내 여행지 5곳 추천
강원도 여행지 추천 /히노끼탕 스파펜션 뒷나루스테이 내돈내산
동해안 해수욕장 추천 휴가철에 가볼만한 곳 BEST4
양양 해안 도로의 시작을 알리는 황금연어공원!
"물치 해수욕장ㅣ강원도 1박 2일 여행지 추천! 입장료, 주차 정보"
양양8경 중 한 곳 강원여행 추천 하조대
양양 여행지- 휴휴암.바닷가에 있는 절. 절 투어. 산책하기 좋은 곳
강원도 여행지 추천 세계산림엑스포 10월에 가볼만한곳
강원도 양양 여행 바다가 따스하게 반겨주는 곳. 동산리 해변
강원도 양양군 죽도해수욕장 다락막국수 추천
"[강원도 여행지 추천]양양 휴휴암,삼척 장호항, 대관령 양떼목장... "
강원도 여행지 추천 양양 가볼만한 곳 낙산사의 바다 절경
양양송이공원 뚝방마켓 다녀왔어요!
2023년 여름휴가지로 가볼 만한 여행지 BEST 5
한국관광공사 추천 - 국내여행지 100선(계절별)
강원도여행 휴휴암 황어떼를 볼 수 있는 양양여행지
[서강대학교 대학원 신문] 국내 여름 여행지 추천 5 (서울... 
양양 여행 코스 양양 낙산사 양리단길 강원도 여행지 추천
속초 양양 여행지 관동팔경 낙산사 가는법 지도 입장료 주차장... 
강원도 양양 겨울여행 서피비치 선셋바 하조대 해수욕장
서울에서 가능한 깨끗한 바다로 떠나는 당일치기 여행지... 
"가을이 성큼, 아이와 함께 떠나기 좋은 교육 여행지 추천 5"
국내여행지 베스트 10/ 양양 당일치기 여행
"양양 설해원 1박 여행기 (산촌생등심, 팔도대게횟집)"
양양 가볼만한곳 남애항 휴휴암 서피비치 드라이브코스
[강원도 가볼만한곳] 등산맛집 강원도 ! 강원도 등산 명소 추천
남녀노소 즐기기 좋은 남대천 파크골프장
"달인, 강원도 바다의 달인... 탕수육 달인, 숨은 여행지 달인"
[양양 맛집] 인생 들기름막국수로 원픽! 범바우막국수... 
국내여행 코스 및 여행지 정리
"[강원 양양군] 양양 8경+전국 3대 해수관음성지, 양양 낙산사... "
강원도 양양 여행지 추천 ' 서피비치 &amp; 스트롱비치'
여름 국내 여행지 양양 놀거리 가볼만한곳 추천!
국내여름여행지추천 양양 인구해변 죽도해변 서프오션... 
양양 대게 가격 좋은 팔도대게횟집 스페셜한 킹크랩 맛집
7월 7일 ~ 8월 20일 하조대 해수욕장 드디어 개장!! 아이들과... 
4계절 내내 서핑을 즐길 수 있는 강원도 양양 남애3리해변
강원도여행 양양 속초 가족/연인 함께 가기 좋은 여행지 코스 추천
"여름휴가 여행지 추천, 테마별 여행지와 안전수칙을 확인하자!"
강원도 여행지 추천 강원네이처로드 스탬프투어
강원도 양양 휴휴암 아이와 가볼만한 가족여행지 추천
"양양군, 낙산사거리 별꽃무늬 담장 연장 추진"
강원도 양양 서핑강습 조아서프 후기 죽도해변 게하 양양여행
양양 핫플레이스 강원도 여름 휴가 가볼만한곳 3곳 - 낙산사... 
양양 속초 가볼만한곳1박2일 강원도 여행 코스 팜케이션
추석연휴 가볼만한 곳 전국 국내여행지 Best 7
강원도 해돋이 명소 낙산사와 정암해수욕장
단풍이 곱게 든 설악산 주전골 무장애길로 편하게 걸으세요!
"플라이 강원, 양양-상하이 / 양양-청두 운수권 취득"
강원도 여자 혼자여행 두번째 이야기 (여행지 추천)
물치항카페 양양오션뷰카페 바다뷰카페텀블러
강원도 속초 양양 가볼만한곳 속초해수욕장 속초아이대관람차... 
일출 명소 강원도 양양 낙산사 여행 추천
"✈ 플라이 강원, 국제선 하늘길 복항을 위한 준비 박차"
[펌] 이국적인 국내여행지 1탄 best10
강원도 양양펜션 국내여행지추천 여름휴가 법수치계곡
"양양 다로산 펜션, 노천스파가 있는 강원도 감성 숙소 ♥"
[강원 양양]송이버섯마을 - 재료 본연의 맛에 충실한  양양 대표... 
"국내여행지 추천 :: 양양 낙산사 홍련암과 의상대, 낙산사 주차... "
양양 가볼만한곳 8월 국내 휴양지 강원도 양양 여행코스
양양 여행은 서핑과 함께 뭘 해야 할까? [강원렌트카 찜카]
강원도 양양 가볼만한곳 양양 여행 코스 바다 구경
"강릉 안반데기, 내 인생 최애 여행지"
2023. 10. 09  강원 고성-강원세계산림엑스포
양양 펜션 하조대 썬비치펜션 해수욕장과 5분거리 깔끔해
강원도 양양 가볼만한곳 양양 여행코스 서피비치 포토존 주차정보
"[대한민국 구석구석 / 양양 가볼만한곳] 한적한 바다를 찾아, 나... "
[강원도 양양] 강아지동반 여행지 추천 (숙소 &amp; 관광지)
강원도 양양 가볼만한곳 물치항 물치해수욕장 놀거리 서핑
아기랑 가볼만한 곳 강원도 양양 쏠비치 리조트 호텔 아기용품... 
"강원도 속초 양양 여행지 추천, 낙산사(코스, 주차정보 포함)"
양양 서핑 숙소 추천 가성비 좋은 패키지와 깨끗해서 재방문 예정
강원도 양양 볼거리 갈만한곳 죽도섬 여행 코스 죽도정 전망대... 
6월 여행가는달 혜택 및 국내여행지 추천
강원 양양여행 / 양양카페 / 브런치카페 / 양양가볼만한곳... 
"강원도 여행지 추천, 양양 낙산사(지도/ 입장료/ 주차장/ 의상대... "
강원도 양양 여행지 가볼만한곳 서피비치 주차장 선셋바 가격... 
강원도 벚꽃 명소 추천 Best 7곳 소개 - 이색적인 봄 여행지들
강원 양양여행 / 양양맛집 / 양양가볼만한곳... 
강원도 여행지 추천 양양 휴휴암 사찰 애견동반 불가로 바뀜
"정암해수욕장펜션, 낙산해수욕장펜션, 양양바다펜션, 양양펜션"
사운드가 곧 나의 힐링! 화려한 라인업의 뮤직 페스티벌 가볼까?!
[강원도 드라이브 코스]강원 네이처로드 (상)
강원도 해안도로 동해안 해수욕장 양양 서피비치 관광지 볼거리
강원도 양양 동해 겨울바다 서퍼강습 서프오션 바다로 최고인듯... 
양양 힐링하며 즐기는 1박 2일 낙산사 주변 여행 코스
휴휴암 국내여행 강원도 양양 황어떼 동해안 가볼만한곳
양양 가볼만한곳 추천 양양 하조대 카페 등 여행지
강원 양양군 청소년에 500만원 상당 교복 지원 싶어요저렴한
[속초여행 2일차] 척산온천휴양촌 ▶ 복골막국수 ▶ 낙산사... 
2023 여름철 강아지와 놀러 가기 좋은 강원도 여행지 5곳
시원한 국내 여름 여행지 시흥 웨이브파크 외 가볼만한곳
[양양 서피비치 하조대] 입장료 위치 주차장 및 색다른 풍경에... 
양양 1박2일 코스 서피비치 꼭 가야하는 여행지
꿈이 이루어지는 몽돌소리길 걷기 행사
"(1박2일 국내여행지 갈만한곳) 양양 쏠비치, 속초 여행 코스... "
강원도 가족여행 여행지 추천 낙산사 하조대 등대
"달인, 강원도 바다의 달인... 탕수육 달인, 숨은 여행지 달인"
"7월 갈만한 국내여행지 추천 (feat. 버릇처럼, 열두달 여행)"
강원도 양양 맛집 추천 쏠비치 주변 대게 맛집 킹크랩 (픽업 횟집 )
8월 첫째주의 추천 여행지(1) - 양양 남애해수욕장 - 에메랄드빛... 
설온 - 양양 족욕 카페 ㅣ 인스타그래머블한 목욕탕 컨셉 feat.... 
2023년 전국 봄 여행지 추천 BEST
울진 여행지 망양정  망양정 해맞이 공원 월송정 관동팔경
양양 트래킹 코스 추천! 특색 가득한 바람길 코스를 소개합니다
"인제 여행, 인제 가볼 만한 곳 소양강을 바라볼 수 있는 인제... "
국내당일치기 혼자 여행으로 알차게 놀다왔던 BEST5 장소
아이와 강원도 여행♡ 한화리조트 설악 쏘라노 울산바위 &amp; 양양... 
(10월 7~31일) 올가을 치유 여행으로 몸과 마음 회복하세요... 
강원 양양여행 / 양양호텔 / 양양리조트 / 양양가볼만한곳... 
펫밀리데이~반려동물 동반 여행지 추천
"양양 : 푸른 바다가 쉬어가는 곳, 죽도해수욕장&amp;죽도정"
"2월 갈만한 국내여행지 추천 (feat. 버릇처럼, 열두달 여행)"
7월 셋째주의 추천 여행지(1) : 양양 어성전~법수치계곡... 
양양 여행지 구석까지 하나씩 살펴보고 떠나보시기 바랍니다.
"강원도 양양 하조대 해변가 오션뷰 카페, A3CAFE"
플라이강원 타고 양양에서 여수 가기!
강원도 양양 숙소 코레일 낙산연수원 아이와 주말여행
[강원/양양] 낙산해수욕장 일출보다.
강원도 양양 자쿠지 숙소 숲속 산속 펜션 경치 좋은곳
"6월 갈만한 국내여행지 추천 (feat. 버릇처럼, 열두달 여행)"
[강원도 양앙 여행] 초록초록 마운틴뷰 '낙산비치호텔' 317호... 
[강원도] 속초 가볼 만한 곳 BEST 10 (1) - 속초 여행 코스... 
"양양 가볼 만한 곳, 마음 편히 다녀올 수 있는 양양 휴휴암"
강원도 양양 가볼만한곳 해변 바다 여행
[공유] 양양군맛집 : 장산리 진미 메밀국수 : 막국수가 아닌... 
"[서춘고타고] 캠핑의 계절, 오션뷰 양양 캠핑장 추천"
1박 2일 강원도 양양여행코스... 추천 ) 국내여행지 이색숙소 추천
"5일 플라이강원,삼수 끝 면허취득 성공··항공관광 강원시대... "
"양양군, 농촌체험마을 '수학여행지 넘버원'"
양양 여행지 가볼만한곳 강원도 양양 낙산사 템플스테이 맛집... 
"[겨울 강원 여행] 숙박, 맛집, 조용한 여행지/가볼만한 곳 추천"
