"여행지 추천 | 부산광역시 (해운대구,수영구,부산진구,동구)"
부산 여행지 추천 l 낮부터 밤까지 화려한 최고의 부산의... 
해운대 가볼만한곳 베스트 10 추천 부산 여행지
6월 부산여행 기장 가볼만한곳 추천
[3월여행지] 따스한 바람이 살랑살랑! 국내 봄여행지 추천
연휴 기분전환 힐링 여행지 추천 전국 100선 모음 가을 여행지
부산 호텔 추천 뷔페 수영장 부산 호캉스 추천 부산... 
"부산 송정 맛집, 편백 찜으로 건강한 식사"
부산 해운대구 전통시장 좌동재래시장 공용주차장 이용료... 
부산점보택시 오늘의 추천 여행지 청사포 블루라인파크
부산 장작구이통닭 맛집 단골하고 싶은 꼬꼬텐더 송정점
"인천공항방역택시 부산해운대구, 기장까지 안전한 이동... "
"대구 근교 물놀이장 8월 여행지 가볼만한곳 추천, 워터파크... "
연애 세포 되살아날만한 설렘 가득 여행지 5 (오디너리핏... 
부산) 부산 해운대 여행지 추천! &quot;부산요트투어G&quot; 방문 후기
부산 갈곳 아이랑 함께하기 좋은 여행지 추천!
동네한바퀴 ... 부산 해운대구
[국내 여행지 추천] 한국 관광 100선 - 부산 1편
부산 가볼만한곳 동해선 전철 주변 여행지(기장 죽성성당 등)
"부산 여행에서 가볼만한 곳, 데이트 코스로 최적인 해리단길... "
"[부산,센텀시티 가성비 좋은 오마카세 코스요리 - 천상일식]"
부산 가볼만한곳 9 동백섬 외 1박2일 여행코스 추천
씨클라우드호텔 (feat. 4성급 부산 해운대 호텔 아트스테이 )
부산 해운대 가볼만한곳 여행지 추천 #부산유람선... 
부산 여행지 추천 &amp; 건오 시클라우드 스위트룸 부산 호텔 추천
부산원아시아페스티벌 2023 놓칠 수 없는 K-POP 콘서트
"부산, 해운대구지역 관광하기에 편리한 파라다이스 호텔 부산"
호텔 부산] 28개월아가와 ktx기차타고 급부산여행 떠나요
부산 송정해수욕장 미리보기 및 공영주차장 안내
부산여행-해운대구/해운대해수욕장. 누리마루/
부산 해운대 파라다이스시티 호텔 오션뷰 신관 객실 수영장... 
부산 가볼만한곳 해운대 요트투어 부산 불꽃축제 명당!
[여름 바캉스] 2023 부산 해수욕장 개장 안내
해운대 추천 액티비티! 해운대 리버크루즈..부산 가볼만 한 곳
부산여행 해운대전통시장 해운대 골목시장 야식먹기 좋은곳
국내 여름 여행지 추천 2016 부산 해운대 모래축제
부산 해운대구 달맞이길 추억(부산 여행지추천)
부산 여행지
부산 송정해수욕장 부산 여행지
[부산/해운대 맛집] 해운대구 구남로 쩝쩝박사 It’s me
[국내 여행지 추천] 한국 관광 100선 - 부산 2편
부산 가볼만한곳 부산 당일치기 여행코스 8곳
[청춘빠블][부산맛집] 해운대구 수민이네 조개구이
[부산여행지추천] 캡슐열차예약방법 (미포정거장출발 추천♡)
부산외국어대학교 학생이 추천하는 부산 여행지 TOP 5
하늘 위의 바다 부산 엑스 더 스카이.. 부산 해운대 가볼만 한 곳
부산여행 필수코스 해운대리버크루즈 요트투어하고 무료로... 
부산 해운대 여행 그린레일웨이 해변열차 6월 국내여행지 추천!
기차여행 부산여행 절대 어렵지 않아요(부산여행지/부산관광... 
부산요트투어 추천 체크할 점과 유의사항
부산 10월 축제행사 가을 경남여행지 가볼만한 곳
부오노가 고른 여행지 ! 선선한 날씨엔 여행이죠 ? 여행지추천
송정호텔 오션뷰 호텔모먼트 (feat. 해수욕장 부산송정숙소 )
부산 해운대 호텔 &lt;그랜드 조선 부산&gt; 수영장 호캉스 추천
곳 [부산 해운대구 우동 갈만한 곳/ 여행지 추천 /여행할만한 곳]
"부산 맛집 리스트 추천, 부산역 밀면부터 광안리 국밥까지... "
"부산 야경 '해운대 더베이101'에서 피쉬앤칩스, 부산 여행지... "
"부산 해운대 술집, 와인바 : 잇시(ici) 분위기 깡패"
부산 해운대 스타벅스 오션뷰Top3 그리고 보너스 한 곳
부산 가볼만한곳 해운대 데이트 코스 부산 요트투어 ~
국내여행지 추천 2박3일 부산 여행코스 추천 2일차 부산여행... 
부산요트투어 :: [더요트] 부산여행지 추천
해운대 동백섬 누리마루 APEC 하우스 부산 가볼만한곳
부산 해운대 가볼만한곳 엘시티 전망대 포함 놀거리
부산 1박2일 여행지 부산 태종대 다누비열차 &amp; 해운대 청사포... 
[부산][일식] 해운대구 해목
"탐탐 매장★ 10월 국내 가을 여행지 추천, 2015년 가을방학... "
부산 해운대 도서관 우동분관 방문
부산요트투어  내돈내산 추천 고고요트
"부산 호텔레스토랑_뷰맛집, 파크하얏트 다이닝룸 디너"
부산 해운대 동백섬 가볼만한곳 누리마루
부산 여행지 추천 ⭐️해운대 블루라인파크⭐️  송정-청사포... 
부산 해운대 청사포 다릿돌 전망대 부산 핫플레이스
TV&amp;영화 촬영지 가을여행! 가족여행지 떠나봐요~*
부산 해운대 해리단길 핫플 소품샵 카페 빨간떡볶이
센텀프리미어호텔 조식 후기 부산 벡스코 해운대 가성비 호텔
"부산스카이워크 , 부산 3대 스카이워크 와 그 주변 여행지... "
"부산에 가볼만한곳, 송정해수욕장 소경, 부산 추천여행지"
"여름 여행지 추천, 여름철 국내여행지, 국내여행, 여름휴가"
부산 해리단길 히피몬드 갬성엽서 가득한 소품샵
"I Love Busan 1 (부산 여행, 부산 맛집, 부산 요트투어, 부산... "
8월여행지 추천 축제 일정 106곳 전국 리스트
2023 부산 전시회 &amp; 팝업스토어 BEST 05 실내 가볼만한곳
부산 놀만한곳 나들이 부산 해운대 해수욕장 바다
2023 부산 해운대 빛축제 기간 겨울 크리스마스 데이트 놀거리... 
부산 가볼만한곳 6곳 부산요트투어 포함
부산 해운대 야경 명소 가볼만한곳 더베이101
12월 1월 2월 축제 달력 겨울 여행지 추천 코스 가볼만한곳 정리
"아이랑 부산 가볼만한 곳 (송도 해상케이블카, 해동용궁사... "
(일상) 부산 동해선 지하철 노선도 테마별 추천여행지!
부산 해운대 데이트코스로... 한눈에! 청사포 당일여행지 추천
[부산여행/송정키즈풀빌라] 바다뷰와 해변열차가 보이는... 
"부산가족여행 오륙도, 청사포 다릿돌 전망대"
[해랑] 부산국제관광전에서 만난 해운대 관광 부스
부산 여행지 추천-해운대 블루라인파크 스카이캡슐
(벚꽃 개화시기 및 주차정보) :: 부산 가볼만한 곳 여행지 추천
"일출 [부산가볼만한곳,부산여행,청사포,사진출사추천여행지]"
국내여행지베스트10 전국 야경명소 10곳
2023 부산 전시회 &amp; 팝업스토어 BEST 05 실내 가볼만한곳
"11월 떠나기 좋은 여행지, 베트남 하롱베이, 사파트래킹 #부산... "
[지식채널 ⓜ] 폐역으로 떠나는 레트로 국내 여행지 추천
부산 야경 명소 l 부산의 아름다운 야경을 찾아서... 
코로나 무릅쓰고 한국 온 프랑스인 '취향 저격' 국내 여행지
부산 프리미엄 워터파크! 클럽디오아시스.. 부산 가볼만한 곳
해운대 놀거리 해수욕장 야시장먹방 부산미포철길 스카이캡슐... 
"당일 부산여행, 부산지하철 2호선 인근 여행지 추천"
부산 해운대구 &gt; 해운대 마린시티에서 광안대교보며 바람쐬기!!... 
부산 가볼만한곳:) 수국 여행지 기장 도토리카페 태종사... 
"사진모음[부산해돋이가볼만한곳,오메가일출,사진추천여행지]"
해운대 오션뷰 호텔 추천 ㅣ 그랜드 조선 부산 할인
2019년 3월 축제 국내 여행지 전국 축제 일정 49곳 인기순
[하츠] 국내 여행지 부산을 여행하다!
부산 가볼만한곳 센텀 스파랜드 웰니스 여행지
우리나라에서 가장 아름다운 여행지들
6월 여행지 추천 6월 축제 하는곳 174곳모음
[부산 해운대] 부산여행 해운대가볼만한곳 해운대빛축제... 
부산 가볼만한곳 해운대 여행코스 추천 베스트 9
부산여행코스추천 청사포 카페와 청사포 다릿돌전망대 모노레일
"부산 호캉스 파크하얏트 수영장 후기, 준비물 포토존 낮밤 야경"
부산 여행지 더베이101 등 부산여행코스추천
애견동반 여행지 추천 수국 명소 Best7
부산 여행코스) 부산투어패스 하나로 부산여행지 뽀개기
부산여행지 해운대 가볼만한곳 엑스더스카이 X the sky
해운대 놀거리 추천 :: 사계절 언제나 좋은 부산 여행 코스 총정리
집콕힐링여행 : 드라이브 스루 여행지 추천!
2020 부산관광공사 결산 l 부산관공사 공식 유튜브 채널... 
부산에가볼만한곳 걷기 좋은곳 해운대 부산동백섬 누리마루
국내여행지 추천 부산 놀거리 청사포 출발 미포 도착... 
부산 핫플레이스 디저트 호랑이젤라떡 엘시티 바로 옆
가을 부산여행 한번쯤 꼭 가볼만한 여행지 추천
해운대 동백섬 산책하기 :) 에이펙하우스 &amp; 부산여행지추천
"부산 가볼만한 곳 l 한옥에서 즐기는 차 한 잔의 여유, 부산... "
[국내 여행지 추천] 해외 바다 부럽지 않은 국내 서핑 명소... 
부산요트투어 더베이| 부산 해운대 여행지 추천 해운대... 
국내 트레킹 추천 여행지 | 해파랑길 종주자가 추천하는... 
[부산여행지추천] 해운대 해수욕장
부산 가볼만한곳 2박 3일 여행 코스 추천 10곳
"12월 부산 웨딩박람회 일정 허니문, 스드메, 웨딩홀"
"따뜻한 봄, 걷기 좋은 산책코스 부산 해운대 동백섬... "
"부산 가볼만한 곳 l 올 여름, 부산여행을 준비하는 분들께... "
부산 파라다이스 호텔 씨메르 수영장 부산 해운대 호텔 추천
부산 해운대 가볼만한곳 명소 부산 놀거리 여름 휴양지
"부산 야경 명소 l 다가온 겨울, 길어진 밤! 부산 야경 드라이브... "
부산당일치기 여행 볼거리 3 (부산아쿠아리움(씨라이프)... 
부산 가볼만한곳 야경명소 포함 부산 여행코스 추천
부산 드라이브 코스 송도해수욕장에서 해동용궁사
부산 갈만한곳 부산 해변열차 해운대 스카이캡슐 블루라인파크
"[국내여행/해운대여행] 부산신상호텔 블루스토리호텔, 가성비... "
부산바다카페 해운대... 쪽파크림베이글이 있는 부산오션뷰카페
부산 기장 펜션 송정 스케치 k
[ 2023년 야미 트레블러's 부산 맛집 추천 BEST 5 ]  30년 부산... 
"[다:정:해]  겨울맞이, 경상도 불빛 포토존 소개"
부산펜션 송정펜션 스파가능펜션 부산감성숙소 스테이서몽 후기
"부산 여행 코스 l 부산 언택트 여행의 끝판왕, 바다와 산으로... "
"부산 놀거리,아이랑 광안리 프라이빗 요트투어 했어요 사나요트... "
해운대중동맛집 한식대첩3 우승 먹거리 부산 이우철... 
"오메가,부산 가볼만한곳,해돋이사진출사추천여행지]"
부산 찜질방 추천 해운대 놀거리 데이트 센텀시티 스파랜드... 
싶은 해운대수목원/무료주차무료입장/부산식물원/부산근교여행지
100선에 부산 명소 8곳 선정! 부산 대표 관광지 추천 소개
부산 여행 해운대 맛집 : 배비장보쌈 해운대점
부산 해운대 호텔 가성비 숙소 오션뷰 이비스 버젯 앰배서더 추천
부산마린시티피자 부산불꽃축제식당 해운대파스타맛집
로컬 여행 트렌드가 바꾼 부산의 축제
"부산여행지 추천, 해운대 미포유람선 부산가볼만한곳 광안대교... "
부산 송정해수욕장 오션뷰 숙소 송정호텔 블루캐슬
부산 해운대 설렁탕 &lt; 청풍 설렁탕 &gt;
유라리 건맥축제 2023 부산 9월 축제로 만나는 건어물과 맥주... 
"부산 온천천 벚꽃, 4월 부산 가볼 만한 곳, 부산 여행지 추천... "
기억에 남는 부산 해운대 가볼 만한 곳 모음zip
추천여행지④ 부산편(인터넷 여행신문 투어타임즈/모모뉴스)
"~ 실전! 부산사람이 쓰는 부산 여행 가이드 ~ (1)(해운대구, 수영구)"
부산 해운대 해리단길 소품샵 할만한것 기념품 해수욕장 근처... 
방송0507-1408-2116안내영업 중18:00에 영업 종료부산 해운대구
국내 부산 여행 2박3일 코스 해운대 핫플 벡스코 일정
3월 여행지 추천 부산 여행 여긴 꼭 가봐야해!
부산 갈만한곳 아이랑 함께해보세요!
테마 별 국내 겨울 여행지 추천!
부산여행필수코스 부산 해운대 셀프사진관 오디티모드... 
부산 박물관 체험 놀거리 부산 데이트코스 갈만한곳
"부산여행 필수코스 추천 [해운대블루라인파크, 부산타워... "
고봉민 김밥 부산 해운대구 창업
부산 여행지 해운대 블루라인파크 해변열차 스카이캡슐
해운대 여행지의 중심 &quot;부산해운대에스원호텔&quot; 해운대숙소
해운대 센트럴 호텔 하이디럭스 더블룸 오션뷰 부산 가성비 숙소
"울산 부산 여행지 추천_ 기장 해녀촌, 메르데쿠르, 형제돼지국밥... "
부산 필수 데이트 코스 요트투어는 요트와에서 !! / 부산요트투... 
[배짱이의 2020년 해외여행지 추천 여행 강의] 롯데 백화점... 
[이벤트] '곧 만나 부산' ㅣ코로나 전 추억이 담긴 부산 여행... 
"부산 해운대블루라인파크 스카이캡슐, 해변열차"
"부산 여행지 best 4 추천, 부산 여행 호텔 추천"
[부산/송정] 돌솥밥이 정말 예술!!  ‘다솥맛집 송정본점’
부산 경남 12월 축제&amp;행사 여행지 가볼곳 추천 TOP 4
부산 여행지 해운대 해변열차 스카이캡슐 부산 놀거리... 
국내 여름 여행지 추천
부산온천으로 해운대온천센터과 함께 대영온천... 
"이번년도 겨울 여행지 , 동백꽃은 어떠세요? ♬"
"달맞이 언덕, 문탠로드, 갈맷길 [부산광역시 해운대구] - 15.07.27"
부산여행지추천 시원한 밀면 먹고 힘.차.게!
부산 여행지 l 방구석에서 즐기는 작년 빛 축제의 화려한... 
부산 호텔 추천 해운대 오션뷰~ 부산 1박2일 숙소... 
부산 해운대 맛집 해리단길 와인과 치즈 유어네이키드치즈
"부산숙박, 해운대게스트하우스, 이코노미 해운대 (부산 해운대구)"
[#307] 한국 - 부산 : 가슴시린... 겨울바다 / 겨울여행 / 사진여행지]
부산 가볼만한곳 해운대 반지만들기 등 5곳
부산 여행코스 추천 해운대 요트투어 부산 데이트 코스 장소
부산 혼자 여행 해운대 놀거리 해리단길 소품샵 산리오 러버스... 
부산 가볼만한곳 해운대 먹거리 놀거리 부산 요트투어
"'부산여행 해운대 빛축제' 아이들과 가볼만한 곳, 경남 겨울여행지"
부산 해운대 실내 데이트 코스 부산 엑스더스카이 엘시티 전망대
"인천공항방역택시 부산여행택시 해운대,기장 24시픽업 안전이... "
2월 국내여행지 및 꽃축제일정 / 2월 가볼만한곳
"부산여행지 추천, 해운대 해변열차 - 블루라인파크"
서핑족이 즐기기 좋은 서핑여행지 3
부산 여행 해운대 동백섬 해안 절경이 있는 동백꽃 명소
부산 가볼만한곳 요트투어 체험 등 여행코스
"부산 여행지 추천, 토박이가 추천한 맛집까지 총 6곳♣"
부산 여행 코스 l 송정부터... (송정해수욕장 - 부산 5대 트레킹... 
"겨울에도 따뜻한 여행지, 부산 인기 명소 추천"
[부산 맛집] 해성막창집 본점 :: 부산에서 제일 유명한 막창집... 
부산 여행 코스 l 부산의 아름다운 풍경을 한눈에 담아보자!... 
부산 가볼만한곳 부산 관광명소 볼거리 놀거리 부산 여행 코스... 
부산 해운대 접근성 좋은 호텔 추천 &quot;펠릭스바이에스티엑스&quot;
해운대(친구) 영화촬영지_ 부산 1박2일 여행지
해운대해수욕장 주차장 개장기간 입수 파라솔 식당 부산 바다... 
8월 부산 가볼만한곳 해운대 그린레일웨이 해변열차 부산... 
1박2일 부산 여행 해운대 여행 코스 갈만한곳
부산 가볼만한곳 :: 해운대 송도 남포동 놀거리 등 여행코스 추천
부산 여행 부산 요트투어 해운대 더베이 요트탈래 가격 시간
"반려견과 함께 가볼 만한 부산 여행지 | 장림포구, 감천문화마을... "
[동네한바퀴 180회] 부산 해운대구 가게 정보 l 달맞이 언덕... 
부산 파라다이스 베이커리 &lt; 부티크 베이커리 &gt;
장마철 여행지_ 비오면 더 좋은 여행지 &amp; 실내놀이터 추천
"겨울여행 추천] 당일여행 워터파크, 온천여행지를 추천합니다!... "
부산 여행 코스  해운대 요트투어 가격 부산 해운대 놀거리
부산 블루라인파크 스카이캡슐 노을후기 (청사포 출발-&gt;미포... 
부산 여행 코스 추천 부산 해운대 여행 바다 소경~
부산 해운대 여행 센텀시티 스파랜드에서 힐링
부산 아이와 가볼만한곳... 제14회 부산국제어린이청소년영화... 
동백꽃-겨울꽃^^도심의 동백꽃 여행지~부산 동백섬으로... 
부산 여행지 추천 청사포 다릿돌 전망대
[국내여행]부산여행 해운대 해리단길 티카페 “고재” 소품샵... 
"부산여행, 부산 해운대구 동백섬의 누리마루 APEC 하우스를... "
부산 해운대 가볼만한곳 부산 해운대 놀거리 부산 야경 볼거리
해운대 더베이101맛집 (ft. 부산바다전망여행지추천)
"부산 가볼만한 곳, 해운대리버크루즈 - 수영강 광안대교 뷰 포인트"
부산 해운대카페 로우앤스윗
부산 겨울 여행지 해운대 빛축제 점등시간 및 주차 팁
부산 가족여행 여행지 추천 송정 죽도공원
1박 2일 부산 여행코스 부산요트투어 포함 6곳
Photo Newsletter No.01 - 금주의 추천 출사지 및 여행지... 
부산 가볼만한곳 흰여울문화마을 및 해운대 숙소까지
"부산 여행 가볼만한 곳, 맛집 추천 (TIP 주정차단속 무료알림앱)"
국내 겨울여행지 추천 경주 서울 부산 등 가볼만한곳 모음
아고다 2월 할인코드 부산 바다 뿌셔뿌셔
"맛집, 부산 기장 해운대 맛집, #당일치기여행 #1박2일여행지... "
조개구이 분위기와 맛을 동시에 잡다 부산광역시 두번째 여행지
부산 여자 혼자놀기 해운대 해리단길 소품샵 이티비티샵 놀거리... 
[ktx예매] 웹투어 기차 최대 35%할인+부산호텔 추천 TOP3!
아름다운 국내여행지 14선 부산 송정해수욕장 일출
내돈내산 부산 해운대를 느낄 수있는 부산요트투어 요트미르
부산여행지추천 굿! 초이스
부산 비오는날 갈만한곳 해운대 부산 시립미술관 전시회
2022 재미난투어 추천 부산 여행지로 떠나볼까요? _ 해운대... 
부산 해운대구의원 하동군의회 방문
&lt;헤어질 결심&gt; 촬영지가 부산이었어? 부산촬영지 모아보기5
"365일 매력적인 철도 관광지, '부산 해운대 블루라인파크'"
부산축제 | 드디어! 광안리 불꽃축제가 열리네요 :) 불꽃축제... 
"떠난 부산&gt; :: 영도... 다대포 해수욕장, 부산 가볼만한곳"
부산 송정 고기집 휴양지 분위기 맛집 랍스
부산 해운대 호랑이젤라떡 아이스크림 웨이팅 30분에 낱개... 
부산 여행지 추천 / 겨울에 부산을 가야하는 이유
[국내여행지] 전국 호텔을 특가로 만나다! 웹투어 화요 위클리... 
부산여행지 갈만한곳 해운대 해리단길 디저트 카페투어 CCD... 
부산 기장 여행지 best7 (현지인 추천)
홀견적비용플래너 부산박람회부산해운대구홀홀
부산여행 센텀시티 벡스코 호텔 &quot;센텀프리미어호텔&quot; 조식... 
누리마루 APEC 하우스 동백섬 야경 부산 여행지추천
"부산투어패스 라이트권 , 여행코스, 요트 탑승 후기"
부산 여행지 카페/맛집 1탄!
부산 해운대횟집 배달맛집 털보횟집
부산 빛축제 해운대 겨울... 야경 국내 겨울 여행지 추천
해운대 그랜드 조선 부산 키즈룸 아이와 함께 단연컨대 최고 !
부산 수제 버거 인사이드버거
[부산여행코스] 부산투어패스 24시간 (feat. 해운대구)
"환상의 순간, 아름다운 여행지 소개!"
"부산 가볼만한곳 해운대 블루라인파크, 해동 용궁사, 101베이"
"부산의 재발견, 영화 속 주인공처럼!_ by 지금은 로컬시대"
부산 당일치기 여행 감천문화마을 &amp; 해운대 요트투어... 
부산 해운대 숙소 한화리조트 해운대 | 디럭스 오션뷰 호텔형... 
부산관광공사 12월 추천관광지…해운대구 동백섬 등 선정
부산 여행지 추천 : 해운대 청사포
[부산 해운대]2023... 다양한 여행지에 대한 이야기를 함께... 
"광안대교가 보이는 풍경[부산에가볼만한곳,부산여행지추천... "
올여름 가족 레포츠 여행지로 가볼 만한 5곳
이동→부산 해운대구 아시아선수촌 아파트. 안심방역택시... 
"태종대 수국축제와 더불어 태종대와 부산시민공원, 부산... "
2박 3일 바다뷰 제대로 즐기고 오는 실패 없는 부산 여행 코스
"[부산] 해운대구 - 동남아의 맛, 라오스 샌드위치 맛집"
아이와 함께 가기 좋은 겨울철 실내 여행지
씽굿이 추천하는 이국적인 국내 여행지 TOP 6
부산 해리단길 카페 핫플레이스 듀플릿
부산 해운대 달맞이길 오션뷰 카페 비비비당 / 전통차와 다과가... 
이비스 버젯 앰버서더 부산 해운대ㅣ해운대 오션뷰 호텔... 
국내 여행지 소개!
부산요트투어 요트홀릭 부산 여행 필수 코스
부산 해운대 놀거리 해운대 블루라인파크 스카이캡슐 부산... 
"[부산/해운대구] 스카이캡슐 타고 보는 오션뷰, 해운대... "
부산 여행지 추천 핫플레이스 맛집/카페 2탄
부산 여행 가볼만한곳 해리단길 해운대 놀거리 주차팁
부산해운대달맞이길프리미엄... 여행지노천탕스파사우나수영장... 
부산 해운대 '거대갈비' 부산여행지 필수코스  가격은... 
더운 여름 부산 시원한 곳 가볼만한곳 BEST 07... 
경상도 여행지 창원 근교 드라이브 top 7
부산 해운대 블루라인파크 미포 스카이캡슐열차 X 청산포... 
부산 가볼만한곳 해운대 미포정거장 외 4곳
"찍기 좋은 부산 여행지/장림포구, 해운대블루레인파크,광안리"
[부산]ITX-마음 타고 다녀온 1박 2일 부산 가족여행
"부산, 해수욕장 말고도 볼 거리 풍부한 [부산광역시 해운대구... "
부산 여행 코스 l 부산 1박 2일 풀코스 여행 일정 추천드려요!... 
부산요트투어 광안리요트 요트다
부산 가볼만한곳 데이트 코스 부산 관광지 핫플 볼거리... 
센텀시티맛집 부산의 핫한 먹방코스 여기부터~
부산 해운대구 송정 ○○○도트 호텔 전기차충전기 설치사례
HARIBBUU :: 부산 스카이 캡슐 이용 후기  (해운대... 
부산 여행지 부산 가볼만한곳 블루라인파크 스카이캡슐... 
부산요트투어 해운대 요트어때 부산여행지 추천
"대한민국 무료 관광지 탐방: 서울, 부산, 제주도"
해운대 가족 동반 여행지 추천 씨라이프 부산 아쿠아리움
부산여행 호텔 추천| 해운대 호캉스! 그랜드 조선 부산 아리아... 
"5월 마지막 주말, 국내 대표 바다 여행지 ‘부산’으로 떠나자!"
가을 여행지 부산 울산 3박 4일 여행코스 추천
"[13여름내일로] 부산, 해운대 맛집 기장산꼼장어 @"
여자혼자 부산 뚜벅이여행 3일차
부산 해운대 맛집 거대곰탕 / 국물이 다르다?!
부산 볼거리 놀곳 사진명소 해운대 동백섬 누리마루 송림공원... 
[각종정보] 부산 여행지 추천
"부산 바닷가 여행지! 영화의 거리, 광안리&amp;해운대 해수욕장"
부산 송정 맛집 랍스 휴양지 분위기에서 포크 2인세트 식사
서울러 만족도 200% 부산 해운대 이색 카페들
[부산 여행 정보] 꽃가루를... 터트려~ 꼭 가봐야 할 부산 벚꽃 명소
해수욕장/ 광안대교/ 부산 필수 여행지/부산 뚜벅이 여행코스
한 여름 날의 추억 부산여행! 매년 나의 최애 먹방여행지 ~2019
부산 해운대 에어비앤비 코티스 오션뷰 가성비 숙소 접근성... 
최대 15% 호텔 할인 (~2022.12.31) 5월 부산여행지 추천
해운대 5성급 호텔 그랜드 조선 부산 l 디럭스 시티뷰 킹 숙박... 
'22 부산여행 #3. 해운대 블루파크라인 | 스카이캡슐타고 경치... 
스파 효능과 탈모 예방 ! 국내 스파 TOP 5 여행지 추천
부산 해운대 달맞이길 오션뷰 맛집 동백샤브샤브 메뉴추천
"부산 근교 여행지, 송정 에스스테이 숙박 솔직 후기"
