"여행지 추천 | 부산광역시 (해운대구,수영구,부산진구,동구)"
부산 여행지 추천 :: 동부산권(수영구/해운대구/기장군) 부산... 
[부산/해운대구] 부산 여행지 추천 부산 현지인 추천 씨라이프... 
부산콜벤택시 오늘의 추천 여행지 해운대구 청사포
[부산 뚜벅이여행지] 부산 해운대구 해운대시장 해운대가볼만한... 
첫 여행지 부산 해운대구 아내 한숙희 화요초대석 아침마당... 
부산 해운대구 오션뷰 호텔 추천 - 해운대 MS호텔
[부산/해운대구] 내 고장 부산여행 2023년 제10회 해운대 빛... 
부산 해운대구 숙소 날 잡고 가본 뒤에 느낀 부분들.
부산 해운대구 숙소 감상평 (직접 방문한 후 기록).
"부산 해운대구 숙소, 자세한 정보 요약."
상당수의 분들이 알지 못 하고 있는 부산 해운대구 숙소 관련... 
대다수의 분들이 알지 못 하고 있는 부산 해운대구 숙소에 대한... 
부산 해운대구 가볼만한곳 송정해수욕장 바다가 보이는 주변... 
부산 가볼만한곳 여행 국내 1박2일 여행지 해운대 놀거리
부산 해운대구 우동 요트홀릭
[부산/해운대구] 시립미술관 :: 새 단장을 앞둔 곳의 과거와... 
부산해운대구 송정동 먹거리와야식 카페보스&amp;송정 토스트... 
부산 해운대구 숯불치킨 중동 야식으로 선택을 한... 
[부산/해운대구] 해운대 중동 광안대교 뷰 야경 요트투어 요트랑
해운대 빛축제 리뷰 후기 / 부산 야경 가볼만한곳 겨울 여행지 추천
부산 가볼만한곳 인생샷 여행지 5곳
"[부산 해운대구] 미포 맛집, 큼직한 대구로 고아낸 국물이 일품... "
부산 여행 코스 추천 1박2일 여행지 부산 요트투어 일몰 데이트
부산 해운대구) 케이스티파이 오프라인구매후기... 
부산 갈만한곳 해운대 빛축제 겨울여행지 부산핫플
부산 가볼만한곳 부산 데이트 코스 여행지
부산 해운대구 송정 맛집 돼지야 리뷰
사계절 매력이 넘치는 부산 여행지
BOF 부산 여행지 추천
부산여행!(+이벤트) #김해공항 #김해국제공항 #부산여행지
"여행, 가족과 함께 하면 더 좋은 부산 여행지 추천"
부산 가볼만한곳 여행지 명소 부산 데이트 코스
부산 가볼만한곳 핫플 여행지 부산 여행 관광지 명소 나들이
부산 해운대 카페 달맞이길 더소가 국내여행지 추천
부산 가볼만한곳... 등 실내 포함 여행지 6곳 볼거리 놀거리
봄 여행지 정보 ④ 부산 2편(해운대구) - 달맞이고개/동백섬... 
부산 여행지 가볼만한곳 송정해수욕장 죽도공원
[사카츠 - 송도탕(부산 - 해운대구)] 반신욕으로 빨갛게 익은... 
"전국 동백꽃 명소 2023 동백꽃 피는 시기, 겨울 여행지 추천"
부산 엑스더스카이 할인 전망대 야경 여행지 추천
부산차이나타운으로 떠나는 7월 부산 여행지 추천
부산 여행코스 추천 해운대 블루라인파크 외 부산 여행지
부산 울산 경남 애견 동반 여행지 추천 반려견과 함께 할 수... 
부산 가볼만한곳 해운대... 미포철길 볼거리 먹거리 10월 여행지
[부산/해운대구] 미포철길... 부산가볼만한곳 부산여행지... 
가만히 생각에 잠기기 좋은 [부산 여행지 8곳]
부산 송정 핫플 여행지 바다뷰 카페 추천 ‘젬스톤 송정점’
부산의 새로운 여행지 해운대수목원
부산여행 2박3일 코스 추천 여행지 7
[부산 아침식사] 풍원장 미역국 정찬 (부산 해운대구 맛집)
부산원아시아페스티벌(BOF) 최종 라인업 공개 및 주변 여행지... 
대동철물금속이 부산 해운대구 재송동에 위치한 빌라의 방화문... 
"부산 1박2일 여행코스, 명물 맛집 + 여행지 8곳☆"
부산 여행지 추천 명소로 남파랑길과 해파랑길이 시작되는 곳... 
"부산여행지추천 5곳, 부산가볼만한곳(해운대블루라인파크... "
내가 제일 가고 싶은 여행지는 : 부산에서 하는 일본 여행 (일본... 
부산 가볼만한곳 해운대... 데이트 장소 외 국내 겨울 여행지 추천
부산 가볼만한곳 해운대 해변열차 블루라인파크 부산 핫플
부산 여행지 추천 해운대 블루라인파크 스카이캡슐 후기
부산 파크 하얏트 호텔 조식 뷔페와 수영장 호캉스 추천 후기
부산 실내 데이트코스 여행지 8월 부산시립미술관 영점 전시회... 
기억에 남는 부산 여행지와 음식점 동백섬과 해운대
부산 흰여울문화마을 걷고 부산 여행지 야경 명소 데이트
명소 BEST 6 l 가을 부산에 간다면 꼭 가봐야 하는 단풍 여행지
동해안권 가볼만한곳 부산 여행코스 K-문화 콘테츠 관광... 
"부산에 온다면 꼭 가봐야 할 여행지 (다대포, 장안사, 황령산, 흰... "
부산 연말여행지 추천 _ 부산 파라다이스호텔 본관 시티뷰
부산 삼광사 연등축제와 함께 부산 5월 여행지 추천 명소
부산 여행지 명소 해운대 을숙도 다대포 가족여행 추천... 
부산 도시철도와 떠나는 부산 단풍여행지 추천 !
"배틀트립2 구구즈 여행지 부산, 웨스틴 조선 부산 호텔... "
"추억과 낭만이 있는 여행지 3선/구로 항동철길, 부산 미포철길... "
10월 부산 해운대 여행 동백섬... 국내 여행지 추천 동해... 
해운대가볼만한곳 부산 아쿠아리움 씨라이프
7월 여행지로 떠나기 좋은 국내 해수욕장 추천 Best 4 (부산... 
부산 영화의전당에서 빅루프... _국내여행지/국내여행지추천
[부산/해운대구] 부산여행 부산여행지 부산가볼만한곳... 
부산 해운대구 송림공원 &amp; 동백공원 [무료 데이트// 여름철 예쁜... 
부산 가볼만한곳 부산 데이트 코스 여행지 갈곳 부산 핫플
부산 여행지 추천 l 부산에서 공항부터 세계여행까지!... 
부산 갈곳 해운대 2박3일 여름휴가 여행지 해리단길 볼거리... 
데이트가 딱이야! 이색 체험을 즐길 수 있는 부산 실내 여행지 4
[부산/해운대구] 부산여행 부산여행지 부산가볼만한곳... 
2023년 11월 축제 38곳 전국 모음10월 축제196곳 여행지... 
"바다의 고백을 따라, 부산 해운대구 여행"
3월 부산가볼만한곳_대저생태공원 포함 봄여행지 5곳
부산 여행코스 부산 여행지 추천
부산 여행지 해운대구 청사포다릿돌전망대
부산 해운대구 철거 업체 원상복구 가벽폐업폐기물처리... 
"부산 여름 여행지 l 부산 안심 여행지#9 부산 서핑의 성지, 송정... "
"국내여행지는 바로 '이곳':: 향일암, 경복궁, 부산시립미술관... "
"추석 연휴 가볼 만한 곳, 부산 여행지 추천"
부산 여행지 추천 l 부산 송정에서 해외여행하기! 이국적인... 
[부산/해운대구]... 부산가볼만한곳 부산여행지 부산여행코스... 
"부산 여행지, 부산 가볼만한 곳은 어디?"
"뮤직비디오, 정은지 '하늘바라기' MV 속 부산 여행지를 찾아서!"
국내 크리스마스 가볼만한곳 겨울 추천 여행지 BEST 07
[부산 해운대구 우1동/해운대역] 미나미 (본점) : 모듬오뎅... 
부산 여행지 추천 l 더 쌀쌀해지기 전에 즐기기 좋은 부산... 
국내 여름휴가 추천 여행지 부산 해수욕장 코스 해운대 광안리... 
부산 해운대 핫한 간식 기념품 추천 내돈내산 후기 :: 호랑이... 
완벽한 여름 휴가를 위한 국내 여름 바다 여행지 3곳 추천(부산... 
부산 해운대 에어비앤비 코티스 호텔 가성비 오션뷰 숙소... 
"휴대폰충전, 식당, 라방, 짐보관, 캐리어보관, 부산 추천 여행지"
[부모님 여행지 추천] 부산광역시 - 해운대 블루라인파크
부산 가볼만한 곳 및 추천 여행지 TOP 14 :: 알뜰 살림 정보통
기념품을 원한다면? 부산 해운대구 기념품샵 방문기! ( 내돈내산 )
"여행자들이 뽑은, 부산의 숨은 이야기가 담긴 여행지 best 5"
부산 송정해수욕장 오션뷰 머물다가 송정 풀빌라 펜션 숙박후기
"부산 가볼만한 곳 베스트 10, 추천 여행지 관광지"
[부산/해운대구] 동백섬 동백꽃 더베이101 동백공원 부산동백섬... 
부산 해운대구 송정해수욕장에서 부터 기장읍에 있는... 
"여행지 추천! (동백섬, 더베이101, 파라다이스 호텔 부산 로맨틱... "
해운대구 / 부산 광역시 / 해운대 / 관광특구 / 국내 여행지... 
"부산 여행지 추천 l 부산 로컬의 냄새가 가득 묻어있는, 부산... "
부산 해운대구 산 정상 6층 아파트 가계약 후기
국내 여름여행지 추천 부산 여행 경주 통영 여행 (가족여행)
부산전시  &lt;상실의 징후들&gt; 미디어아트 전시 (미래사회는 어떻게... 
여행지 오락실은 한번 방문해줘야지! &quot;왕미미오락실 해운대점&quot;
부산 해운대구 우동 라마다 앙코르 바이 윈덤 부산 해운대... 
부산여행지추천 해변열차 종점 송정해수욕장
부산 가볼만한곳 겨울 해운대 요트 투어 부산 여행 코스
국내 크리스마스 12월 겨울 여행지 및 야경 추천 5곳
"[부산] 가볼만한 곳 해운대 해수욕장 일몰이 예쁜 여행지, 근처... "
"부산 여행지 추천 l 빙수가 생각나는 계절, 여름에 딱! 가기... "
부산해운대스테이크 마린시티점심밥집 캥거루와 오션뷰가 있는... 
늦은 여름휴가를 즐길 수 있는 국내 여행지 부산 &amp; 제주의 8월... 
부산 &amp; 경남 여름휴가 여행지 BEST 8 총정리
부산 여행 코스 / 부산 여행 일정 여행지 추천 / 부산 가볼 만한 곳
부산 여행지 추천 l 여행작가들이 부산 요트를 타면 생기는 일?... 
하는 부산 맛집 2 탄; 부산 해운대구/센텀시티 먹거리 정보
국내 여름 여행지 추천 주말 2박3일 부산여행 여름휴가지
"택시투어 비오는 날도 즐거운 부산, 인근 여행지 추천 코스입니다~"
부산 여행 2박3일 코스 추천 놀거리 볼거리 여행지 부산 갈만한곳
부산여행지추천 어디가 놀러가기 좋을까?
바다가 아름다운 부산 해운대구
"부산, 대천, 부안, 포항! 연말... 연말 국내 겨울바다 여행지 추천 4"
"빈티지 인형, 외국과자, 부산 송정 선물가게, 부산 추천 여행지"
부산 축제 연말 여행지로 좋은 해운대 빛축제
부산 해운대구 해운대주간보호 신세계실버데이케어 &quot;열기구... 
5월 국내여행지 부산편 부처님오신날 더 이쁜
"일상을 떠나 동심의 세계로~부산 동심 여행, 부산 여행지 추천"
[부산/해운대구] 금수복국 본점
[국내여행지] 혼영 추천  부산광역시/ 부산추천 여행지
"부산 여행 코스 l 부산의 핫한 여행지, 해운대 그린레일웨이와... "
날씨좋은날 부산 해운대구 해운대해수욕장 고등학교동창과... 
노티드 부산 해운대점  웨이팅1번지 해운대 도넛을 아시나요
[부산 해운대구]원가야밀면 _ 송정 밀면집. 고명으로 올리는... 
부산해운대구) 핑꾸핑꾸 아기자기 키티문방구... 
부산 2박3일 여행 코스... 2일차  해운대 광안리 근처 여행지
(부산 해운대구 중동) 해운대블루라인파크에서 스카이캡슐타고... 
명소 부산 해운대 센텀시티 가볼만한곳 추천 (국내여행지 추천)
[부산여행] 부산 해운대 해수욕장 근처 가볼 만한 BEST 여행지
신혼여행지인 &quot;남해 사우스케이프 /부산아난티 힐튼/ 부산 파크... 
"한국관광공사 데이터렙으로 보는 부산 인기 여행지 순위, 지역... "
"부산 겨울여행지, 해운대 빛축제, 야경명소, 사진명소, 위치, 시간"
부산 여행지 엘시티전망대 엑스더스카이 100층 오션뷰
찍기 좋은 부산 여행지 BEST 3(+특급 호텔 신혼여행 패키지)
부산 여행지 바다 여행 부산 해운대해수욕장 여름휴가
"부산1박2일, 여름대표 여행지 해운대해수욕장 &amp; 부산맛집... "
브런치 맛집 클램 :: 분위기 좋은 야외테라스 바 부산여행지 추천
부산 근교 여행지로 걷기 좋은 산으로 부산 여행코스 추천
부산 여행 코스 추천 핫플 데이트 코스 부산 관광지
부산 여행지 추천 l 추운 겨울엔 역시 카페 데이트지! 부산... 
"누리마루(역사,바다,야경 한번에 해결되는 부산 여행지)"
부산 여행지 추천 l 부산 여행지의 새로운 재탄생?! 새로운... 
부산 해운대구 우동 해운대아이파크 경매 권리분석... 
부산 가볼만한곳 해운대 해수욕장 밤 데이트 코스
갯벌 부산 해운대구 해운대해수욕장 썸남과 눈가자미매운탕
부산 여행지 추천 l 부산 밤바다의 매력 싹쓰리~ 시원한 밤에... 
데이트 하기 좋은 부산여행지 베스트 추천 부산데이트코스
부산 해운대구 Busan - 겨울에 만나는 아름다운 해운대의... 
"[부산 해운대구] 부산여행 2일,살짝 아쉬웠던 뮤지엄 다... "
부산 해운대 엘시티 전망대 부산 엑스 더 스카이 주차... 
국내여행지 부산 해운대 송림공원 수국 핫플 개화상태 주차장팁... 
부산 달맞이 브런치 맛집 라운지룬
한 여름 다녀온 부산 여행지. 청사포 다릿돌 전망대 + 맛집... 
부산불꽃축제 가볼만한곳 부산여행 1박2일코스
국내 겨울 여행지 추천 : 부산 해운대 청사포 다릿돌 전망대... 
"부산 해운대 가볼만한 곳, 여행지(볼거리, 즐길거리) 추천 BEST... "
[부산/해운대구] 부산 3대 밀면 맛집 중 한 곳인 '해운대... 
부산 여행코스 부산 여행지 108곳 모음
"여름철여행지, 부산으로 1박2일 떠나자!"
부산 해운대 &amp; 광안리 근처 가볼만한 (놀만한) 여행지 공유
"인천공항방역택시 부산해운대구, 기장까지 안전이동... "
부산 해운대 가볼만한 곳 2022 업데이트 여행지(볼거리... 
부산 청사포 다릿돌전망대 해상스카이워크 해변열차 스카이캡슐
가볼만한 곳 ｜친구랑 우정뿜뿜! 사진 찍기 좋은 부산 여행지 4
국내 여행지 겨울축제 부산 해운대 빛 축제 정보
부산 데이트 장소로 영화보다 더 영화 같은 부산 여행지 추천
부산 여행지  Top10 초등학생 아이와 실내 가볼만한곳
[HOT] 오시리아 숙박부터 풀패키지로 부산 BEST 여행지만 소개
[부산광역시/해운대구] 부산여행 / 무브먼트랩 / 송정해수욕장... 
해운대 놀거리 부산 청사포 다릿돌전망대 부산 스카이워크
"제10회 부산 해운대빛축제 총정리(프로그램 안내, 주차정보 포함)"
"부산 해운대구 한샘인테리어 거실편, 패키지로 호텔 라운지... "
부산가볼만한곳:) 해운대여행은 이걸로 끝! 로컬 추천 여행지 5곳
부산 여행 | 부산 여행 선물용으로 추천하는 옵스 OPS 내 돈... 
국내여름여행지 해운대해수욕장 포함 부산바다 여행코스 5곳
부산 가볼만한곳 해운대 블루라인파크 요트투어 등
부산 근처 여행지 드라이브 부산 근교 당일치기
부산여행 야경 더베이101 크리스마스트리 핑거스앤챗
여행지 추천 | 부산 2박 3일 코스 그리고 맛집
2월 국내 여행지 추천 ( 부산 &amp; 포항 &amp; 제주도 )
봄초 부산 해운대구 송정해수욕장 썸남과 숭어
국내 온천여행 부산 이색 데이트 해운대 온천센터 할매탕 가족탕
여행지 추천 | 7번국도 타고 푸른 바다 만끽하자! 속초~부산... 
[부산] 부산 여행지 추천 가볼만한곳 최대 장소 top5
부산 여름 휴가지 바다 명소 해변 해수욕장 여행지 추천 5... 
부산 가볼만한곳 해운대 요트투어 야경 부산불꽃축제 명당
[배리어 프리뷰] 부산 여행 2박 3일 - 1일차(2/2편)
부산여행지[부산여행추천] - 해운대 달맞이고개 와 청사포
"국내 봄여행지, 추억을 실어나르는 간이역 여행 :: 일산역... "
부산 해운대구 맛집 리스트 28선
[부산 해운대구] 디지털 미디어 아트에 눈감을 틈이 없는 새로운... 
겨울여행지 눈부시게 아름다운 경치를 품은 예쁜바다  TOP3
[부산/해운대구] 청사포 부산청사포 해운대청사포... 
부산 센텀 스파랜드 가격 할인 식당 편의시설 총정리 부산... 
"[해운대구] 고즈넉한 말차 전문 카페, 심미안"
"내셔널지오그래픽 트래블러, 최고의 여행지 35 [부산] 선정"
겨울 부산 가볼만한곳 부산 요트투어 가격 부산 놀거리
스카이캡슐]캡슐열차  탑승후기 / 부산여행지 추천!
"[부산 해운대구] 현지인 맛집,  청사포조개구이 전문점 &quot;도희네... "
ft. 국내 여행지 추천/제주/충남/여수/부산/태안 등
"[월간지] 여행지 추천 - 국내... 시그니엘 부산, 파르나스 호텔... "
K마케터의 부산워케이션 한달 체험기!일과 휴식의 결합
부산 가볼만한곳 요트투어 &amp; BEST 여행지 4
"️부산 해운대 여행지, 맛집 추천 | 이번 연휴에 가기 좋은... "
부산 해운대 해수욕장 : 국내여행지추천
[부산여행지추천]청사포조개구이-하진이네
BIE 실사단 다녀간 ‘2030 엑스포 부산여행 코스’ 여행지는?
부산 가볼만한곳 해운대 위주 부산 명소 5곳 모음
부산요트투어 요트더퀸 광안대교 야경보고 왔어요
부산송정해수욕장 송정동핫도그 기분좋은 부산송정카페!!... 
[부산 해운대구 반송동 하이샤시] 예비신혼부부 편
부산 송정 우호적 무관심 / 아이랑 가기좋은 스튜디오같은 감성... 
부산 여행지 해운대 동백섬 해안산책길
바다 구경하기 좋은 부산 여행지 5곳.
부산 가볼만한곳 부산 요트투어 부산 불꽃축제 명당
[부산 해운대구] 해운대역앞 가성비는 5등급인... 
부산여행지 추천 (해운대유람선 운항시간과 요금)
부산 가볼만한곳 황령산 전망대 야경 부산여행코스
[부산여행] 많은 볼거리에 산책로가 예쁜 동백섬
"부산 여행지 추천 l 우리동네로 떠나는 여행, 우리동네 예쁜... "
방역밴택시 부산해운대구까지 안심이동
부산 여행지추천 해운대 청사포 다릿돌전망대 당일치기... 
"시간, 주차, 예약, 현장 가격 (부산 가볼만한곳, 국내여행지 추천)"
빨간등대 부산 해운대구 해운대해수욕장 연인들과 불볼락
감성여행지로 좋은 부산 가볼만한곳 다섯곳
부산 영화의전당에서 블루보틀 한잔하며 부산여행영화제... 
[부산] 관광코스/산책코스/데이트코스/부산여행지/청사포 다릿돌
"부산항,승학산,시약산,구덕산,부산가볼만한곳,부산여행지추천"
해운대구 / 부산 광역시 / 해운대 / 관광특구 / 국내 여행지... 
부산마린시티맛집 수영하고 해운대브런치카페 탐방기
부산 수영구 여행지 추천: 갤러리이배 오브제후드 F1963
부산여행 2박 3일 코스 1일차 돼지국밥 맛집
부산투어패스 관광지 관광지도 부산 뮤지엄원 전시회 미술관
&lt;부산 해운대구 타이백스트릿&gt;아이와 함께 해리단길 맛집.... 
부산 가볼만한곳 베스트 8 부산여행코스 추천
"동해남부선 전동열차 여행지 5 (해리단길, 롯데월드 부산... "
"떠나는 부산, 제주 야외... 아이들과 함께 하는 가족여행지... "
부산 실내 데이트 가볼만한 곳 뮤지엄원 상실의 징후들 전시 관람
"[부산 해운대 맛집]... 해운대 여행지 밥집 추천, 59년 전통... "
SRT → 부산역 → 해운대 마린시티 → 광안리 (feat. 여행지... 
[부산 해운대구] 쌀국수로 해장하는 친구를 위한 해리단길 태국... 
부산 가볼만한곳 실내 데이트 부산 아쿠아리움 씨라이프 할인... 
부산고등어축제 2023 부산 10월 축제로 펼쳐지는 먹거리 축제
부산 아이랑 해운대 블루라인파크 가볼만한곳 / 스카이캡슐... 
[부산여행] 친정 같은 여행지 해운대
부산여행지추천 / 청사포 / 동해남부선 기차길 /달맞이올레길... 
대구치맥페스티벌 2023 국내 여름 여행지 필수 코스
"태종대, 부산가볼만한곳, 부산해무, 부산여행지추천"
[1박2일 부산여행지추천] 2일차 : 해운대블루라인파크/청사포... 
국내여행지 겨울축제로 화려한 빛축제를 열고 있는 곳 TOP5
부산 여행지는 해운대 해수욕장 추천 운영정보 파라솔 확인하기
"식품위생교육 신규영업자 교육 수강, 해운대구복합문화센터"
아이랑 다녀왔던 부산 여행지  더베이101 공영주차장 위치 요금... 
부산 단풍 명소 7선 TOP7 / 아름다운 가을 여행지
"해운대 아침식사 하기 좋은곳, 아키차"
"부산 해운대 맛집: 해목에서 장어덮밥, 카이센동 성공적"
부산 송정 펜션 국내 럭셔리 풀빌라 오션뷰 숙소 추천 머물다가
부산여행지 해운대해수욕장+해운대블루라인파크 솔직후기... 
부산 여름 여행지 부산요트투어 데이트 코스로 강추 요트가이... 
"부산팬케이크맛집 거루캥테이블,부산송정커피 즐기는법!"
[배리어 프리뷰] 부산여행 2박 3일 - 관광지 2일차(1/2편)
[부산_가볼만한곳] 핫한 신상 여행지_해운대 캡슐열차(+이용꿀팁)
"부산 애견동반 여행 / 여행지 코스 추천 : 해운대 동백섬, 광안리... "
"부산) 해운대구 숨은 명소 '청사포' - 다릿돌 전망대, 쌍둥이 등대"
부산 W웨딩홀 견적 후기(ft. 웨딩박람회 신세계백화점)
[ 부산여행지 ] 부산 해운대 미포철길 따라 청사포가지 걷기... 
부산 요트투어 부산여행 필수 코스 요트가이
해운대 놀거리 아이와 가볼만한곳 관광 명소 부산 여행지 추천... 
[TRAVELOG] 결혼 후 첫 여행지. 부산-거제도(1)
시그니엘 부산 오션뷰 911호후기! [국내여행지추천 및 시그니엘... 
부산펜션 송정 풀빌라 폴마레 뷰는 이런 느낌입니다.
부산 송정해수욕장 주차 포토존 근처숙소 서핑구경하기
[취미먹방] 부산송정맛집 바오버거 바삭한 하얀빵이 대박이네요... 
강아지와 함께 떠나는 여행지는 어디?
겨울은 노천탕이지!  [국내 온천 여행지 추천]
부산 가볼만한곳 해운대 요트투어 핫플 부산 데이트 코스
"부산가볼만한곳, 부산전문가의 추천 여행지, 든든한공인중개사"
복어탕이 맛있었던 복어요리 전문점 금수복국 해운대 본점... 
부산 여행 코스 추천 관광지 먹거리 부산 드라이브 코스
해운대 블루라인파크 부산 해운대 해변열차 스카이캡슐 가족여행
::에이든여행지도:: 부산관광지도로 국내1박2일여행지 완성
경상도 여행지 추천 부산 사진 명소 해운대 가볼만한곳 해운대... 
부산 겨울 여행지 l 동백섬에 예쁘게 핀 동백꽃의 개화 소식!... 
"부산, 해운대구 여행하기 좋은 팔레드 시즈 콘도"
내가 보려고 만든 부산 무료 여행지 TOP 5
부산전시회 랄프 깁슨 사진미술관 &lt;Political Abstraction... 
"부산 가성비 접근성 좋은 숙소 코티스 해운대, 조식 아키차"
[ 부산 해운대구 / 우동 태국요리 맛집 ] 타이백스트릿 해리단길점
부산 해운대 맛집 해운대 우동... 자주가는 부산 해운대 맛집
KTX 타고 부산여행 2박 3일 부산여행코스 추천/2일째날... 
"부산 해운대 여행, 파라다이스 호텔에서의 여름 호캉스 (ft.... "
[냠냠쩝쩝] 해운대구맛집 해리단길 숨은 맛집 오르 :-)♡
부산 택시 기사님 추천 맛집... 판매하는 부산 여행 필수 맛집... 
부산 오션뷰 숙소 스테이온 해운대 블루라인파크 근처 시점... 
"부산 해운대 여름 휴가 여행, 워터파크 '클럽디 오아시스... "
"기술&quot;, &quot;Good by, Good buy Ⅱ&quot;/ 부산 해운대구 가볼만한 곳"
[부산 가볼 만한 곳] 해운대 아이와 가볼 만한 여행지 방문 후기
부산 해운대 인근 미술관... 실내 여행지(주차·할인·운영시간... 
와인무제한(feat.친구추가할인/부산인기여행지할인)
부산 해운대 여행 센텀시티 데이트 코스 놀거리
부산 핫플 해운대 계절별 매출은? (feat. 해운대구 숙박... 
부산 벚꽃 명소 추천 Best 10곳 - 꼭 가볼 만한 부산 벚꽃 여행지
부산 겨울 여행｜겨울에 가볼만한 부산 여행지 추천 5곳
부산 가볼만한곳 관광지 국내 여행지 추천
부산여행지 추천 청사포 포토존 정리 (feat. 해운대... 
부산 해운대 해변열차 미포역 출발 청사포 다릿돌 전망대코스... 
"좋은 부산 여행지(이기대해안산책로, 동백섬, 다대포 산책로)"
부산 여행지 동백섬 누리마루APEC하우스
부산 여행 신라스테이 해운대 프리미어 스탠다드 패밀리 트윈룸... 
"부산 동백섬 야경 (부산 애견동반 여행지, 부산 가볼만한 곳)"
