"[2023년 9월의 어촌안심여행지] 전북 군산시 선유도마을, 강원... "
전북 군산시 신역세권 예다음 아파트 일반분양정보
전북 군산시 서수해장국
군산시 채만식 문학관 - 군산시의 특별한 문학여행지에서... 
전북 군산시 가볼만한 곳/ 아리랑코스/ 군산여행!
전북 군산시 비응도와 비응항 후기
전라북도 여행지 추천 전북여행 군산 가볼만한곳 군산 경암동... 
전북 군산시 고군산군도    ‘무녀도’     2023년 2월 9일
전북 여행 군산 가볼만한곳 테디베어뮤지엄 군산 실내 여행지
군산 가볼만한곳 선유도 등 11월 군산여행 전북 여행지 추천
전북 군산시 수송동 소금빵 맛집 - 블루본즈 (By. 맛간다람쥐a)
군산 경암동 철길마을 시내 볼거리 전북 여행지 추천
전북 군산 가볼만한곳 전라도 여행지 추천 경암동 철길마을... 
전북 군산시 유명 빵집 이성당
전북 군산시 경암동 군산여행지 '경암동철길마을'
군산 경암동 철길 마을 전북 여행지 볼거리 가득 가볼만한곳
여행이좋다 :: 군산여행지도... 전북 군산시 갈만한곳 여기저기..... 
전북 군산 가볼 만한 곳  시내 원도심 시간 여행지 코스
은파호수공원 주차장 야경 코스 전북 1박2일 군산 여행지... 
1박2일 전북 여행지 추천 군산 가볼만한곳 군산 여행 코스... 
전북 군산 여행지 일제강점기 군산역사관
[한국관광 100선] 여유와 낭만이 있는 전북 여행지 7곳 소개
전북 여행지 추천 군산... 시내 볼거리 군산 신흥동 일본식가옥
전북 군산 가볼만한곳 볼거리 많은 군산 여행지 추천
군산 볼거리 신흥동 일본식 가옥 전북 여행지 추천
군산 가볼만한곳 1박2일 여행지 전북투어패스
전북 군산여행지 베스트 군산 가볼만한곳 전북투어패스로 알차게
전북 여행지 추천 실내 관광지 군산 시내 군산 테디베어뮤지엄
전북 가을 여행지 추천
전라북도 여행지 추천 가볼만한곳 전북 드라이브 군산 새만금... 
인기 여행지는 &amp; 작년... 최대…여행·교통 93% 급증 &amp; 군산시 &quot;해
전북 군산시 여행지 추천: 선유도 몽돌해수욕장
고군산군도 전라도 서해안 섬 여행 서해섬 전북 등산 서해 여행지
[전북 군산] 군산 1박2일... 국내여행지 추천 (지린성... 
아이와 가볼만한곳 군산 근대역사박물관 주차 전북 여행지 추천
여행코스 | 죽성포 째보선창 군산 동국사 | 전북 여행지추천
[전북 군산] 선유도 여행지 / 옥돌해수욕장 해안둘레길 산책... 
가을여행지 추천 - 전북 군산시
9월에 가기 좋은 어촌 안심 여행지 - 전북 군산 선유도... 
[여행/전북 군산] 뚜벅이 1박2일 국내여행 (추천여행지... 
전라도 여행지 추천 군산 대장도 대장봉
군산 가볼만한곳 신시도 설경 일몰과 야경 국내 겨울 여행지... 
부안 가볼만한곳 전북 여행지 추천 변산마실길 1코스... 
군산 여행지 박물관 여행코스 근대역사박물관/세관/미술관/건축관
군산시 야경 - 달빛 품은 언덕 신흥동 도시숲공원에서 군산 야경... 
전북 군산 여행지 :: 옛날 철길을 따라 맛있는 군것질거리가... 
군산 선유도 트레킹 코스 - 가을 전북여행지 추천
7월 국내여행지 추천 군산가볼만한곳 전북특별한관광지
"거리, 군산 시간 여행, 전북 군산 당일치기 관광지, 1박2일 여행지"
군산 철길마을(전북 군산시 경암동)..
추천 여행지 동국사... 안내 전북 군산 군산시 금광동... 
전라도여행지추천 | 전북 군산가볼만한곳 추천!
11월 군산 갈만한곳 가을 나들이 전북 여행지 명소 추천 BEST... 
전북 가볼만한곳 군산 여행지 추천 경암동 철길마을
전북 여행지 추천 새만금 방조제 홍보관
[전북여행지]전주.군산 맛집투어 - 맛따라가는여행
군산 1박2일 여행지  옛군산세관 역사 둘러보기
[전북 군산] 군산 1박2일... 국내여행지 추천 (백년삼계탕 or... 
군산시 문화여행 - 일제강점기 군산역사관 강제동원 교류전
가볼만한 곳 경암동 철길마을 전북 군산 당일치기 여행지 추천
전북 군산 가볼만한곳 선유도 해수욕장 군산 경암동 철길마을... 
군산 1박2일 여행지 고군산군도 가볼만한곳 선유도... 
역사를 따라 가는 여행지 전북 군산 가볼만한곳... 
군산 근대역사박물관 시내 볼거리 여행지
"군산 당일치기 여행지 볼거리 4곳 (군산은파호수공원, 철길마을... "
전북 아이와 가볼만한곳 군산 당일치기 드라이브 실내... 
전북 군산여행지 당일치기 가볼만한곳 사진찍기 좋은곳 추천... 
"전북 군산 여행지, 군산 시간 여행, 가족 연인 친구 아이들과... "
하늘을 나는 꿈! 군산 패러글라이딩 스쿨.. 전북 가볼만한 곳
전북 여행지 추천 2탄 군산 맛집과 군산 여행지 유명한곳은... 
"군산관광지,전북여행지,연인끼리 데이트하기 좋은 야경 뷰"
전북 군산 가볼만한곳 근대화거리 초원사진관 경암동 철길마을... 
군산 여행지 아이와 가볼만한곳 초원사진관 | 해망굴
"길 따라, 책 따라 [채만식 ‘탁류’ 속 그곳 전북 군산]"
"군산 야경 어디로 가야할까? 군산 여행지: 월명공원, 은파호수공원"
군산 가볼만한곳 당일치기 시내 군산 여행 코스 5곳
군산 여행지 추천 - 군산 신흥동 일본식가옥 히로쓰 가옥 내부와... 
전북 군산 여행지 진포해양테마공원 뜬다리부두 해군상륙함... 
군산 여행지 당일치기 드라이브 군산 경암동 철길마을 볼거리
군산 가볼만한곳 선유도 시내 여행지 군산 여행 코스
군산 꼭 가봐야할 곳 동국사 추천여행지
철길마을(주차 정보)은 모든 세대가 어울릴 수 있는 군산 여행지
군산 가볼만한곳 국내 여름 여행지 군산 여행 코스
군산 여행지 당일치기 군산 경암동철길마을 볼거리
군산 여행지 가볼만한곳 - 영화 8월의 크리스마스 촬영지 초원... 
[농어촌에 풍덩] 놀러가기 좋은 어촌 뉴딜 여행지
서해금빛열차타고 가볼만한 전북여행지5
"군산세관,미즈커피 : 전북 군산 가볼만한곳/여행지"
전북 당일치기 여행지 - 군산 선유도 기도등대
여행 경암동 철길마을 : 전북 군산 가볼만한곳/여행지/갈만한곳
[전북 군산시] 군산 여행지 추천 : 다리개통으로 드라이브... 
[전북/군산] 호텔린 군산린... 군산여행지 &lt; 호텔 린 &gt;
사람없는 여행지 전북 군산 가족여행 가볼만한곳
전북 여행지 추천 군산 초원사진관 볼거리
군산 아이들과 가볼만한곳 전북 여행지 볼거리 나들이 추천 10... 
전북여행지추천[군산여행♥군산세관♥군산근대미술관... 
"부잔교, 진포해양테마공원 : 전북 군산 가볼만한곳/여행지... "
[전북 군산여행] 사진찍기 딱좋은 대장봉 바다뷰
전북 여행지 추천 : 고군산군도에 위치한 장자도를 따라 가본... 
시간따라~ 길따라~ 조용하고 여유로운 [전북 군산시 군산여행]
"전북 가볼만한곳 3월 군산 시간여행, 시내 관광명소"
"군산 일제강점기 군산역사관, 전북 여행지 추천, 군산관광지 추천"
전북 군산 가볼만한곳 동국사 여행 (feat. 군산 지도)
은파호수공원 고군산군도 여행지 가족 추억여행 레트로 감성여행
군산 시내 번화가 당일치기 군산 동국사 전라도 여행지 추천
"전북 군산 여행지 카페, 어시장 등 복합 쇼핑몰 군산 공설시장"
군산 놀거리 아이와 가볼만한곳 관광 명소 전북 여행지 추천... 
"[2016.08.21 전북 군산시 가볼 만한 곳] 새만금 방조제, 선유도"
❤️전북 군산 여행지추천 테디베어뮤지엄 ❤️
군산 말랭이마을 주차 군산 새로운 명소 가볼만한 여행지
전북 군산 가볼만한곳 경암동철길마을 등 군산 여행 코스 6
국내 여행지 가볼 만한 곳 서해안 바다 노을 명소 일몰 명소... 
전북군산 여행지추천 [군산여행♥진포해양테마공원]군산... 
국내 가을 여행지 충남 서천 가볼만한곳 신성리 갈대밭 여행코스
전북 군산 여행지 추천 동국사
전북 나들이 가볼만한 곳 5 반려견 동반 여행지
전북 군산 가볼만한 곳! 군산 BTS 벽화 투어 feat. 경암동... 
전북 익산여행지 가볼만한곳 SRT 익산역
전북 군산 여행 가볼만한 곳 군산항 진포해양테마공원 옛... 
"전북 여행지 추천, 해망굴 지나 군산 월명공원까지 군산 산책 코스"
군산 여행코스 경암동 철길마을 레트로 여행지
전북 군산 문화동 짬뽕 맛집 왕산 중화요리 반점
"히로쓰가옥, 동국사 : 전북 군산 가볼만한곳/여행지/갈만한곳"
"군산을 걷다!  가을 여행지 추천, 전북 군산"
"군산 여행지 선유도 해수욕장, 짚라인, 바이크 대여, 장자도 호떡"
군산 바다 멋지게 보이는 여행지 군산 월명공원 해망굴 코스
"[트래블투데이] 역사 그리고 꿈, 전북 군산시!"
(책일기) 풍경이 아름다운 이국적인 국내여행지 64(ft.여행심)
추억의 여행지 전북 군산 가볼만한곳 8월의 크리스마스촬영지... 
가볼만한곳 초원사진관 이성당 빵집 나혼자산다 이주승 여행지
전북 충남 여행지추천] 서천 군산 금강하구둑 놀이공원... 
전북여행지추천 군산당일치기 은파공원 임피역 말랭이마을 등... 
군산 여행 주말 갈만한곳 경암동 철길마을 군산 당일치기 여행지
전북 &gt; 1203_군산시
전북 군산 가볼만한곳 동국사 대나무숲 뚜벅이여행 1박2일 코스
말랭이마을 자유극장신흥동일본식가옥 [전북 군산] 내돈내산
전북 군산시 경암동 철길마을에서 옛 추억을 떠올려 본다.
가을 여행지 추천 정원이 예쁜 군산 채만식문학관 나들이
1박2일 군산 여행지 테디베어... 전북투어패스 군산시간여행권... 
국내 여행지 가족들 모두가 떠나기 좋았던 장소5
"[군산여행] 고군산군도 장자도, 대장도, 군산여행지, 섬여행"
"국내여행지 전북 가볼만한 곳 Best4 : 담양 죽녹원, 부안... "
전북 군산 동국사 대웅전 주차장 일본식 사찰 필수 볼거리
전북여행지 추천 군산여행 군산근대역사박물관
군산 금강하구둑 금강미래체험관 볼거리 많은 가족 여행지
집순이 일상씨의 초보스럽지만 괜찮은 여행(전북 군산시)
&lt;군산&gt;국내여행지 추천 전북 군산 가볼만한곳 드라이브 코스... 
군산 비대면 여행지 추천 – 군산 금강습지생태공원
"군산 숙소 팔레드군산 / 전라도 풀빌라 펜션, 전북 1박2일 여행... "
군산 가볼만한곳 베스트10 추천 전북 여행지
가족과 함께하는 역사 여행! 군산 여행지 추천!
&lt;군산&gt; 전북 여행지 추천 영화 8월의크리스마스 촬영지... 
군산 여행지 오래된 달동네 말랭이마을
&lt;군산&gt; 전북 군산 근대화거리 여행지 일본식 적산가옥 카페... 
군산 여행 가볼 만한 곳 선유도 여행지 1박2일 코스 당일치기... 
전북 김제 가볼만한곳 베스트10 여행지 추천
새만금에 초록빛 물결이 가득한 감성 뿜뿜 여행지 &lt;군산 청보리밭&gt;
"전북여행지 추천 군산 경암동철길마을, 군산 여행코스로 딱~"
군산여행지 군산 빵지순례 대한민국에 가장 오래된 빵집... 
"전북 이색여행, 어슬렁어슬렁 길 투어(천리길 연계 코스... "
미러리스 카메라 추천 Nikon Z5 with 국내 여름 여행지
어슬렁 어슬렁 전북여행 '길&quot;중 청암산 둘레길을 다녀 왔습니다
생크림앙금빵 [전북 군산]  대기시간 주차 휴무 내돈내산
"찾아가고 싶은 가을 섬 추천 9곳, 행안부 선정 가을철  여행지... "
서천 신성리 갈대밭 서천 겨울 여행지에서 설경 만나고 가세요
전북 군산 1박 2일 여행 코스 선유도 대장봉 야미도 외... 
'2022 전북 아시아·태평양... 전라북도 가을 비대면 여행지'
2020년 마지막 여행은 어디로? 여행지 추천
전라북도 군산시 월명동 수제비&amp;냉면 맛집 '부활냉면'
전라북도 여행지 추천 군산 시내 근대화거리 볼거리... 
전북 군산 가볼만한곳 비응마파지길 뷰가 환상적이에요
전북 여행지 추천 / 군산 가볼만한곳
전북 군산시 신창동 영화 8월의크리스마스 촬영지 초원사진관
군산 경암동철길마을 추억으로 떠나는 여행지
전라북도 군산시 영화동 향수 가게 '소이바이셀'
"[전북,군산] 일흥옥 | 가성비 넘치는 모주+콩나물국밥조합 맛집... "
전북 계곡&amp;해수욕장 살펴볼까요? 더운 여름을 시원하게 보낼 수... 
군산근대역사박물관 : 전북 군산 가볼만한곳/여행지/갈만한곳
군산 여행지 근대역사박물관 당일치기 입장료 통합권 볼거리... 
전북 군산 고군산 군도에 펼쳐진 63개의 섬
목포 가볼 만한 곳 자연사 박물관 공부도 되는 여행지추천
임피 노성당과 주변 여행지
군산 근대역사박물관 옛군산세관 볼거리 시내 여행지
여행이좋다 :: 군산 가볼만한곳 여행지 추천 군산여행코스 후기
2023 새해 일출 명소 추천! 겨울 드라이브 여행지 BEST 4
"군산여행지추천, 군산여행 스타트 근대쉼터부터 시작해요:♡"
군산저수지 둘레길 호수 숲길 구불길 애견동반 힐링 여행지
한국어촌어항공단이 추천하는 생태여행지 군산 신시도... 
6월 7월 여름 휴가지 추천 장소로 유명한 여행지 추천 BEST
[전북:군산시]군산맛집 일력생선 #7 【ft.군산 명물 박대구이】
군산 여름 가볼만한곳 베스트 10 추천! (ft. 전북 휴가 여행지)
군산 가볼만한곳 비응항 선유도 군산 여행코스
[전북 군산시] 공설시장내 별미매운잡채맛집 (공설시장내... 
전북 군산 감성숙소 스테이 따숨과 이룸 1박2일 뚜벅이여행... 
[전라북도여행] 전북 베스트 여행지 13
군산여행지 군산짬뽕맛집 내돈내산찐후기
군산 선유도 여행 - 선유도해수욕장 (전북여름여행지 추천)
6월 여행지 추천 Best 24
&lt;군산&gt; 전북 당일치기 여행지 추천코스 군산 근대화거리... 
전북 군산 불주사 여행 중 가볼만한곳
전북의 관광 핫플레이스가 여기에! 전북 트래블마트
[군산 여행] 군산 여행지 경암동 철길 마을
과거로 돌아가 보는 군산 여행 우체통거리부터 8월의... 
전북 군산여행 군산 경암동 철길마을 군산아이랑 가볼만한곳
아이랑 군산여행 경암동 철길마을! 마이마이트래블 전북여행
군산 여행지 군산근대역사박물관 볼거리 많아요~
익산 1박 2일 여행코스 추천 7곳! (ft. 전북 여행지)
뚜벅이 전북 여행 추천 코스 - 군산 당일치기 (지린성... 
한일옥 소고기 무국 - 전북 군산시 (feat. 초원사진관)
전북 여행지 추천 군산 여행 코스 새만금 방조제 드라이브 코스... 
[군산가볼만한곳] 국내여행지 군산근대미술관 안중근 의사... 
11월 떠나면 참 좋은 여행지!
[탐식지도: 전북 군산] 군산 여행 중? 선택지 줄여드림 (feat.... 
전라도 여행지 추천 : 군산 고군산군도 장자도 대장봉
소설 속으로의 여행/소설의 배경이 된 국내여행지 3선... 
"군산 여행지 추천 옛 군산세관 , 동국사 , 초원사진관"
충남아이와가볼만한곳 서천 필수여행지 2곳 (국립생태원... 
전라도 여행지 추천 볼거리 가득한 군산 근대역사박물관... 
[군산·서천 여행] 1편 - 국내 1박 2일 전북 여행지 추천! 군산... 
크리스마스에 연인과 함께 가면 좋은 전라북도 여행지 6곳을... 
[전북투어] 군산으로 떠나는 봄 여행주간 가볼만한곳 12선
[golf&amp;] 명문골프장 &lt;3&gt; 전북 군산시 군산골프장
"우리나라 근대문화거리 여행지 5선/대구 근대문화골목, 군산... "
"옛날 감성을 느낄 수 있는 군산 여행 정보, 레트로 감성 느낄수... "
"전북 여행지  익산,김제,부안,군산 후회없는 전라북도... "
전북 군산 근대화 거리 숙소 | 게스트하우스 동국 | 여자 혼자... 
군산 여행지 가볼만한 곳 시내 여행 코스 추천
그때 그 시절 추억이 묻어있는 멋진 겨울 여행지! #군산여행... 
경암동 철길마을.(전북 군산)
"전북군산, ' 경암동 철길마을 ' 을 찾아갑니다."
추석연휴 가볼만한 국내여행지
"[국내 여행지 추천] 늦가을, 지금 자전거 여행 떠나기 가기 좋은... "
드라이브 ft. 당일치기 군산여행지/진포해양공원 체험
군산 선유도 가볼만한곳 전북 선유도해수욕장 군산 여행 코스
블로그 체크인 챌린지 시즌1 마지막날 결산 및 Best 여행지와... 
"전북 여름여행, 일몰 명소 추천 - 군산 대장봉"
홍보대사 남상일과 떠나는 안심여행지도 - 비대면 여행지 ①
군산 임피향교 - 전북의 문화유산 여행지
전북 여행지 추천 임피역 폐역 데이트 추천 전북 군산 갈만한... 
언택트 힐링 여행지 휴가철 찾아가고 싶은 섬 33선/우리나라... 
여행이좋다 :: 군산 여행 추천 전북 한 달 살기 12일째
까칠 투어 제 2탄 전북 군산 경암동 철길마을
선유도펜션 추천 20가지 및 순위 구매 가이드 후기 가격 정보... 
1930년대의 군산을 재현한 체험 및 전시공간. 전북어린이체험관
[전북/군산시] 군산 비응항 어화 맛집과 위더스 모델 1박2일... 
전북여행지추천`맛과멋이 있는 아름다운 여행/전라도가볼만한곳
전라도 여행 군산 가볼만한곳 군산 경암동 철길마을
전북 가볼만한곳 : 군산 선유도 해수욕장 서해안 섬 여행
전북 천리길 구불 8길 - 신선이 노니는 군산 선유도
군산 여행 가볼만한곳 경암동철길마을 째보선창 선유도 여행지
군산 뚜벅이 여행지 모음 (1)
겨울 전북여행지 추천 군산 여행 드라마 촬영지 구경하기
국내 여름 여행 커플 여행지 데이트 추천 군산 여행 무녀도... 
[군산펜션 성산애] 독채에서 즐기는 가족여행지 추천♡ 대만족!!
가정의 달 5월 부모님 취향저격 여행지 추천
"타짜, 군산을 가다(사진발 좋은여행지)"
군산 가볼만한곳 선선했던 가을날 당일치기 여행 코스 5곳
(군산 월명동) 째보식당 ... 맛집이라 알려졌지만 저와 아들은 보통
"전북 군산 여행 당일치기로 가볼만한곳 이성당, 초원사진관... "
한국 관광  100선 전북 무주... 곤충 박물관 전라도 여행지 추천
"전북여행, 전북여행지 추천, 오늘은 전주시 소개"
전북여행 군산 가볼만한곳 모아보기 : 천리길 선유도해수욕장... 
국내 바다 섬 여행하기 좋은 베스트 한국 여행지 추천 5곳
[국내 여행지 추천] 8월 여행지로 딱! 파도와 자갈의 하모니... 
요즘 뜨는 여행지 '군산'의 매력속으로!!
군산 갈만한곳 놀거리 꽉 채운 당일치기 여행코스
[군산 여행지 볼거리] - 경암동 철길마을 주차 놀거리 먹거리 ♥
(전라도 군산 추천 여행지) 차 타고 들어가는 섬 군산 장자도... 
군산당일치기 여행 코스 완벽정리 feat 전북투어패스
"군산 경암동 철길마을, 전북 군산 여행의  특별한 볼거리"
"산책, 전북 여행, 군산 여행, 당일치기 데이트 1박2일 관광지... "
전북 여행지 추천~* 한국관광 100선! 전주한옥마을 입장료..
"국내 섬 여행지 추천, 전북 군산 장자도"
"인생에 쉼표가 필요할 때, 행복 힐링 충전 여행지 3선... "
군산 신역세권 영무 예다음 분양가 모델하우스! 군산시 내흥동... 
"전북 군산 대박짜장 , 내 인생... 가을여행지 추천 군산 어때?... "
군산 조촌동 몽실정 간장게장 군산시 현지인 추천 맛집... 
사람들이 적어 추천하는 비대면여행지! 전북 군산에서 가볼만한... 
군산 시간여행축제 출연... 군산행사 10월 여행지 가볼만한곳
핫한 국내 여행지 인생샷 사진찍기좋은곳 전국 여행지 추천
"전북 힐링 여행지 추천, 전북 군산 초원사진관 어때요~!"
전라도 여행지 추천 군산 동국사 일본식 사찰 1박 2일... 
"[전북/군산] - 군산빵집 이성당 본점 빵지순례 (주차, 야채빵... "
2023 새만금 팸투어 전주 군산 1박2일 여행지코스 가볼만한곳
전북 군산 여행 추천지 “야미도/선유도해수욕장/대장봉”
[전북/군산] 한일옥 군산한일옥... 전라도맛집 전북맛집... 
[전북/군산] 국제반점
"[전북] 군산 장자도 대장봉 가는법, 주차, 위치, 꿀팁"
"호텔,음식,체험까지 가성비 패키지여행(feat.전북투어패스)"
"군산의 핫한 여행지, 청암산오토캠핑장을 소개해요!"
"전북 역사 여행지, 전북 군산 해망굴"
국내 여자 혼자 여행하기 좋은 곳 | 전북 군산 근대화 거리... 
전북 군산 카페/ 군산과자조합 &amp; 무녀2구마을버스
경암동 철길마을 교복대여와 주차 군산 여행코스 레트로 여행지... 
홍보대사 남상일과 떠나는 안심여행지도 - 비대면 여행지 ③
11월 여행지 추천  늦가을에 떠나보아요~~
[전북 군산] 군산 여행/ 고우당/ 초원 사진관 / 신흥동 일본식... 
전북 군산 기차여행 KTX 타는방법 군산역 내흥동유적전시관... 
군산 역사 여행지 시원한 실내 근대역사박물관으로...
군산 여행 아이와가볼만한곳 | 신흥동 일본식 가옥 주차정보
군산 아이와 가볼만한곳 여행지 추천 군산근대역사박물관
"군산 여행지 사진 찍기 좋은 곳 5곳 소개, 인스타 감성"
"전북 군산 여행 주말 데이트 신흥동 일본식 가옥, 군산 시간... "
전북 군산 가볼만한곳 드라이브 코스 볼거리 먹거리 군산 여행... 
[군산여행] 아이와 함께 꽉차게 즐기는 군산 1박 2일 #맛집... 
"9월의 수산물, 어촌여행지, 해양생물, 등대, 해양유물... "
군산 여행 가볼만한곳 Best 7
다양한 예술을 접하다 전북 군산 가볼만한곳 군산근대미술관... 
전북 여행지 추천 드라이브 군산 가볼만한곳 새만금 방조제... 
군산경암동 철길마을 주차 시간 휴무 풍경 아이와 여행
전북 가볼만한 곳 사진찍기 좋았던 군산 신흥동일본식가옥
알려지지 않은 여행지/한적한 여행지 휴양지/여행지 추천... 
‘無車 여행지’ 전북…관광지-축제 등 85개 코스
전북 군산 선유도 가볼만한곳 대장봉에서 인생샷 건지기
개강러들을 위한 당일치기 여행지 :: 군산
[6-1] [新택리지] 전북 군산시  +
전북 유형문화재 제200호 이영춘 가옥 - 군산 숨은 여행지
"[군산근대역사박물관] 군산 여행지 추천 , 포토존 낭낭한 체험... "
"군산 여행지, 가볼만한 곳 ‘임피역’"
날아가는 기러기 모양을 닮은 전북 군산 비안도 섬여행
군산 여행코스 비응항 군산 선유도 여행지 볼거리 먹거리
군산 뚜벅이 여행지 모음 (6)
"[군산여행] 5월 연휴 여행지 군산 선유도, 군산 선유도 가는... "
국내 여행지 추천 군산 선유도 해수욕장&amp;새만금 방조제 드라이브
"교과서 밖 역사여행지, 전북 군산항쟁관"
군산가볼만한곳 군산여행 /  경암동철길마을 / 전북여행지추천... 
군산 1박 2일 여행지 추천 | 군산 데이트 | 군산 여행 | 군산... 
군산 뚜벅이 여행지 모음 (3)
군산 여행 동국사 일본식 사찰 군산 번화가 1박2일 여행 코스
"가족여행지 추천, 전북 군산 진포해양테마공원 어때요~?"
전북 군산맛집 옛날손짜장과 군산여행지 초원사진관
전북 군산 중국집 내돈내산 :: 엄청나게 긴 웨이팅에 불같이... 
"전북,★익산여행 best★[군산시서천군 이사전문... "
전북 여행 1박2일 군산 맛집 리스트 추천 군산 먹거리 현지인... 
"전북 역사 여행지, 전북 군산 3.1운동 기념관"
나혼산 군산여행코스 후기 &amp; 추천 여행지
"전북 군산맛집 영화원 / 물짜장, 해물짬뽕밥 줄서서 먹는... "
막 찍어도 이쁜 마을여행지 추천
호국여행 진포해양테마공원 - 호국보훈의 달 의미있는 여행지
[전북/군산] 일력생선 군산일력생선 군산맛집 군산여행... 
"군산 청암산 둘레길, 청암산오토캠핑장 옆 여행지"
"[포이톡톡] 가을 가족여행, 국내여행지 추천5"
"전북 여행 군산 미즈 커피, 주말 당일치기 여행으로 추천 관광지... "
전라도 여행지 역사박물관 추천 뚜벅이 군산 당일치기... 
