"사계절 내내 오고 싶은 도시 군산, 나 홀로 전북 한 달 살기 두... "
전북 군산 뚜벅이여행 경암동 철길마을 기찻길 당일치기... 
아이들과 함께 가기 좋은 군산여행지 추천 일제강점기 군산역사관
"군산 드라이브 여행지 추천, 전북 군산 새만금방조제"
"2020 경자년을 추억하다, 국내 사진과 여행지"
전북 군산 가볼만한곳 사진찍기 좋은곳 테디베어뮤지엄... 
전북 군산 독채 자쿠지 숙소 팔레드 군산 로망 객실 이용한 후기
"전북 가족 여행지 추천, 전북 군산 경암동 철길마을 :)"
군산 횟집 비응항 당일치기 먹거리 바다 여행지 새만금 횟집
군산 경암동 철길마을 시간 여행 커플 여행지
"전북 군산 야경 뷰가 아름다운... 여행, 전북 여행, 주말 1박2일... "
군산 뚜벅이 여행지 모음 (5)
전라도 여행지 추천 전주 한옥마을 익산미륵사지 임실옥정호... 
[전주 서신동 우리휘트니스] 봄에 가기 좋은 전북 여행지
전라북도 여행지 추천 군산 번화가 시내 여행 볼거리 독립서점... 
전북 아이와 가볼만한곳 군산 근대화 거리 주말 여행코스... 
전라북도 가볼만한곳 아이와 여행지 추천 군산 근대화거리... 
군산 시내 근대화거리 초원사진관 영화 8월의 크리스마스... 
"군산 가볼만한곳 ㅣ 당일치기 여행지 추천, 히로쓰가옥"
집현면 직원MT-전북 군산 고군산군도와 새만금방조제
"전북 군산 3.1운동 기념관... 관광지, 전북 여행, 군산 여행... "
군산 뚜벅이 여행지 모음 (4)
[국내여행]말숙이가 추천하는 전라도 여행지 6곳!!
군산 야경 은파호수공원 유원지 국내 1박2일 여행 군산 호텔... 
"[테마 여행] 과거로 떠나는 여행, 전북 군산"
혼자만 알고 싶은 국내 여행지 15
해물이 푸짐한 왕산중화요리 콩나물짬뽕 : 전북 군산 짬뽕집
"군산 가볼 만한 곳, 8월 여행지 추천 신시도 &amp; 선유도 해수욕장"
"[20150411 전북 군산시 가볼만한곳] 군산천길,이성당(빵집)... "
(전라북도 여행지) 군산 가을 여행 경암동 철길마을 교복 입고... 
군산 여행지 장미갤러리 장미카페 구 미즈상사
[전북 군산] 나만 알고 싶은 군산 벚꽃 명소 / 군산 가볼만한곳
"전북/군산 여행 -  왕년에 저택, 신흥동 일본식 가옥(히로쓰 가옥)"
[전북 군산 여행] 전라북도 군산 당일치기 여행 가볼만한 곳... 
전라도 여행지 추천 가볼만한곳 BEST7 주차정보 이용요금... 
군산여행지 2탄! 여름철 시원한 섬 여행
"전북 여행지 추천, 전북 가볼만한 곳 군산 은파호수공원"
전북 군산 가볼만한곳 : 은파호수 공원 걷기 좋은 길
군산 시내 볼거리 여행지 옛 군산세관 호남관세박물관
전라북도맛집 전북맛집 군산여행 군산여행지 군산가볼만한곳... 
"그림같은 풍경이 있는 아름다운 섬, 신시도 여행코스"
[전북 군산] 무녀2구마을버스 #테마카페 #수제버거맛집 #쥐똥섬
전라북도 여행지 계절의 풍미를 느낄수 있는 전북여행지 추천
전북여행-전라북도여행지|전라북도 여행지 총정리~!! 전라북도... 
군산 단풍 명소 가볼만한곳 전북 가을 여행지 추천 10 :: 로띠스마
[국내여행지 추천/군산여행] 동국사/경동철길마을/신흥동... 
군산 뚜벅이 여행지 모음 (2)
군산 근대역사여행지 옛군산세관 무료 관람이라 좋아요
전북 군산: 소바 올해만 30번 넘게 먹고 강.추. 서울소바
군산시 가볼만한곳 데이트 명소 경암동 철길마을 주차 및... 
국내 5월 여행지 추천 12곳 및 5월 축제
군산근대역사박물관 군산 아이와 가볼만한곳 비오는날 여행
▷ 전북 어디까지 가봤니? 전라북도 여행 가이드 1(군산시... 
[군산아침식사]군산 나들목 매운잡채 꼭 먹어봐요
아기공룡 둘리 의성 국가지질공원 제오리 공룡발자국·만천리... 
광주 전남 전북 10월 축제 일정표. 전라도 가을축제와 여행지
"군산 여행지/군산 가볼만한곳, 동국사, 히로쓰가옥, 한국... "
★국내여행★ 전라북도 군산시 여행지!!!!!!!!!!!구경거리!!!!!!!!!!... 
군산 여행지 비응마파지길 새만금방조제
05 - 고군산군도 / 선유도 / 장자도 / 전북 군산시
군산 배롱나무 꽃 명소 옥구 향교
[전북 군산 수송동] 네일그레이스 :: 엄마의 두번째 젤네일... 
군산 숙소 감성 팔레드군산 아이랑 자쿠지 펜션
2012 전북여행 | 가족여행지로 추천해요! - 금강 철새 조망대... 
6월 여행가는 달 어디로 떠날지 고민이라면? 여기 새만금으로!
국내 여행지 여름휴가 섬 여행 떠나볼까
[군산/여행지] 군산 추천 여행지 진포해양테마공원
군산 가볼만한곳 선유도 해수욕장 전북 여행 군산근대화거리
무당이 상을 차려놓고 춤을 추는 모양을 가진 전북 군산 무녀도
전북 군산시 경암동 철길마을
군산 해망굴 일제강점기와 6.25한국전쟁의 역사를 담고 있는... 
"엄마, 아빠 여행 가요! 아이와 떠나는 여행지 &quot;역사여행&quot;"
"3월 여행지 추천, 나혼산 주승도 다녀간 실패없는 군산 1박 2일... "
[슬립앤슬립 맛집탐방] 벚꽃 나들이 시즌 최고의 여행지 군산과... 
군산 여행 경암동 철길마을
어촌여행코스 공모전
[전북 군산여행]남편과 당일치기 군산여행(음미당... 
수능 끝나고 가자! 친구랑 갈만한곳 힐링 여행코스 추천 3
8월 여행지 추천 군산 가볼만한곳 영화 8월의 크리스마스... 
전북 군산 '순천곱창'
겨울여행지 군산 가볼만한 곳 - 경암동 철길마을
"전북 신년 여행지 추천, 전북 군산 해돋이공원"
9월에 가기 좋은 어촌 안심 여행지 - ② 전북 군산 선유도... 
전북 군산 가볼만한곳 뚜벅이 여행 추천지 근대역사박물관 외 7곳
전북 군산 여행 코스 선유도 대장도 대장봉 소요시간 야간산행... 
군산 가볼만한곳 국내섬여행 군산항 출발 서해 끝섬 어청도
[전북 군산] 새만금 상설공연 '뮤지컬 판타스틱' | 여행지에서... 
6월 국내 여행지 추천 여기 5곳 안가본 분들은 무조건 가보세요!
&lt;전라도&gt;군산여행 - 경암동 철길마을 군산의 마지막 여행지
군산여행지 추천 오션뷰 신상카페 13% 후기
"4월 지역축제, 여행지"
"전북 이색 여행지, 군산 금강철새조망대!"
[여행 여가] 전북_전통시장... / 전주남부시장 / 군산신영시장... 
국내 여행지 베스트 10 추천 전국 3대 빵집 군산 이성당
전국 4대짬뽕 쌍용반점 전북 군산 맛집 추천 - 복성루 교동반점... 
&lt; 국내여행 / 전라도여행 &gt; 전북 군산여행 1탄 - '이성당... 
"광복절 공휴일, 군산 가볼만한곳으로 추천하는 일제강점기... "
기차도 멈추고 시간도 멈춘 추억의 여행지 군산 임피역!
"전북 군산 여행지, 전북 군산 은적사"
"전북 군산 여행 군산근대 건축관, 군산 시간 여행, 전북... "
12월의 여행지 - 저무는 한해 마무리는 이곳에서... 
[전북 군산] 군산과자조합... 스템프투어 / 군산시간여행카페... 
군산 신흥동 일본식가옥 '히로쓰가옥' / 군산 여행지 추천.
군산 대장봉 훌륭했던 고군산군도 전북 가볼만한곳
전북군산여행 요쿠야마치 초원사진관 일본식가옥
전북순례길 군산 전주 국내성지순례  돌봄여행사
군산 가볼만한곳 경암동철길마을 포함 여행코스 5
"1운동 100주년 기념관 놀거리, 볼거리 많은 여행지"
"전북 군산 여행지 추천, 전북 군산 경암동 철길마을"
"꽃게찜 전북 군산시 금동 벽란도횟집 위치, 전화번호, 영업시간... "
군산 여행 첫 코스 임피역 사진 명소!
"군산 여행지 추천 :: 가을에 유랑하기 좋은 도시, 군산"
전라도 12월 축제와 여행지 / 전남 12월 축제 / 전북 12월... 
군산 가볼 만한 곳 군산 여행지 베스트 쓰리!
"군산 가볼 만한 곳 신흥동일본식가옥, 말랭이마을, 초원사진관"
"무림태풍의 문화 예술 :: 문학과 바다와 절개가 있는 고장,전북... "
군산 경암동 철길마을 정감어린 시간 여행지
군산 여행지 가볼만한곳 | 나혼자산다 촬영지 군산 경암동... 
전북 뚜벅이 여행 | 군산 신흥동 일본식 가옥 | 구 히로쓰 가옥... 
전북 펜션 군산 게스트하우스 가성비 좋은 감성 가득한 군산... 
군산 뚜벅이로 가볼만한 실내 여행지인  테디베어뮤지엄 추천... 
[여행지-선유도해수욕장] 늦은 오후 해풍을 마시며 데이트하기... 
"전북 역사 여행지, 전북 군산 임피역사"
전북 군산 가볼만한곳 비응마파지길 군산 시내 1박2일... 
"[전북 군산여행] 군산맛집, 군산여행지 가볼만한 곳들 추천!... "
경암동 철길마을 :: 추억여행 떠나기 좋은 군산여행지 경암동... 
"가볍게 가기 좋은 여행지, 전북 군산 월명공원"
군산 여행지! 이국적인 국내 여행 속으로 Go Go~!
전북 월별 여행지 추천
한국관광공사 추천 - 국내여행지 100선(계절별)
"군산 가볼만한곳 10곳, 유명한 여행지, 명소 추천(경암동... "
"&lt;아이와 군산여행&gt; 군산으로 떠나는 시간여행, 군산여행지 추천"
2tv생생정보오늘방송맛집여행지?... 
"고군산군도 트레킹 추천 – 장자도, 대장도와 할매바위"
"전북 군산 여행 시간 여행 데이트, 진포해양테마공원, 가족들과... "
"[전북 군산 숙소] 스테이 따숨과 이룸, 감성 에어비앤비 독채 펜션"
[7년 전 오늘] [전북부안]새만금 방조제/새만금 홍보관/세계에서... 
"군산 가볼만한 곳 l 4월의 기운이 가득한 남도여행, 전북 군산"
군산 장자도 카페 라파르 전북 드라이브코스
군산 최고의 여행지 베스트7
"군산 선유도 해수욕장 짚라인 대신 칼국수 맛집 방문, 주차"
초등아이와 반드시 가야하는 군산 여행지_군산 3.1운동... 
"군산가볼만한곳 경암동 철길마을, 주차 방법 및 BTS 정국 벽화... "
"[전북/군산] 타임머신 타고 떠나는 시간여행지, 군산여행"
#101. [쫀데기 1973 군산본점] - 기념품이나 선물하기 좋은... 
전북여행지추천/전북유적지 익산시웅포면 입점리고분
/ 군산철길마을추천 / 군산철길마을 놀거리 / 군산유명여행지... 
군산 가볼만한곳  선유도 군산 여행 코스 군산 먹거리까지
&lt;겨울여행지 추천&gt; 먹거리... 겨울여행지를 소개합니다!... 
"11월 가볼만한 여행지, 11월 축제소개, 11월 가족여행지등... "
전북 1박2일 추천 여행코스 아마존워터파크 -&gt; 전주한옥마을... 
군산 여행 군산 무녀도 드라이브 추천 코스 서해 섬여행
군산 여행지 추천 가볼만한곳 재밌는곳 군산 데이트하기좋은곳... 
군산여행-군산테마여행지/ 근대문화유산투어/ 군산... 
전북 군산 섬 여행 대장도 &quot;대장봉&quot;
군산 고군산군도 해상관광 군산유람선 관광코스
"근대역사박물관] 군산 데이트 코스, 군산여행, 전라도 여행지"
군산 여행지 은파호수공원에서 발견했던 카페 - 군산 빈타이... 
"[군산]1박2일 군산여행(여행지,맛집추천)"
[국내여행지/군산 여행/군산 중화요리 빈해원]분위기 좋은... 
군산여행지 볼거리 초원사진관 신흥동 일본식가옥 겨울군산여행
전북 군산 왕산중화요리
그림처럼 아름다운 선유도 유람선관광
전라북도 여행지 계절의 풍미를 느낄수 있는 전북여행지추천
군산 당일치기 일정 이성당 테디베어뮤지엄 초원사진관
군산여행지 경암동 철길마을 힐링여행
"전북 군산 선유도, 이국적 감성의 수제버거 카페 '무녀2구... "
전라도 여행지 추천 근대화 거리 군산 근대역사 박물관
군산여행 필수 코스 초원사진관 8월의 크리스마스 촬영지
나만 알고싶은 국내여행지 가볼만한곳 Best10 핫플레이스는... 
"철길마을, 놀거리 볼거리 무궁무진한 레트로 여행지(ft. 주차)"
군산 경암동 철길마을 군산 여행 볼거리
한국에 이런 곳이?! 관광 사진 공모전 수상작 공개
"수경월드항공여행사 [전북 군산시] -  여행사,항공여행사... "
군산 새만금방조제 드라이브 하기 좋은 서해안 여행지
군산 경암동 철길마을  레트로 볼거리 여행지  주차정보
"[군산 맛집] 군산 지곡동 맛집, 태국 음식점, 쌀국수 맛집 타이"
"바닷물이 푸르고 맑아서 붙여진 이름, 고군산군도 어청도 여행"
"군산 이성당 빵집, 우리나라에서 가장 오래된 빵집이자... "
국내 1박2일 여행지로 다녀온  군산 가볼만한곳 6곳... 
:) 겨울이 깊어지기 전 떠나면 좋은 늦가을 추천 여행지... 
"전북 군산 애견동반여행 ::신흥동 일본식 가옥, 군산 여행 코스... "
[여행지-낙조대] 바다위 짙은 주홍빛이 마음을 따뜻하게 합니다
[군산] 장미칼국수 - 겉절이가 미쳤어요
210807 전북여행지 추천 ] 여름휴가로 변산 격포해수욕장 주변... 
[군산] 테디베어뮤지엄 군산 아이가 좋아하는 군산 여행지
금년 추천 여행지 10곳 소개
"3, 4월여행지 추천 군산 고군산군도 무녀도갈매기 버스카페... "
[군산혼행] 뚜벅이가 가볼만한 곳 군산 여행지 7선 (추천... 
선유도해수욕장 백사장에서의 황홀한 일몰 감상 및 한밤의... 
전북 군산 벚꽃 명당 - 군산에서 벚꽃 즐기기 좋은 곳
군산 근대화거리 여행지 근대미술관 근대건축관... 
전북 전라도 가볼만한곳 부안 채석강 해식동굴 포함 베스트7
[전북 군산] 군산 여행... (1) 선유도 - 주말가족여행지로 딱입니다.
국내여행 코스 및 여행지 정리
전북 군산여행 근대화거리 독채펜션 감성숙소 추천 : 스테이... 
군산 가볼만한곳 볼거리 먹거리 군산 여행 코스
전라북도 군산 여행지 추천 신흥동 일본식가옥
9월 가족여행지 추천 누구나 오기 좋았던 장소 5!
군산 경암동 철길마을 옛추억 여행 주차 볼거리 먹거리 시간
군산 가족과 아이와 함께 가볼만한 여행지 코스 추천... 
"[GrillRoom 71] 중동연탄구이, 군산중동연탄구이, 연탄구이... "
군산:: 옛감성 그대로 짧고 굵게 떠난 여행 (1박 2일 코스... 
가을은 여행의 계절
철새의 낙원 금강호 - 전북 군산
"9월 가족 여행지 추천! 한국관광공사가 선정한 전북 군산, 익산"
군산 야경 은파호수공원 은파 유원지 군산 숙소 추천 호텔
"직접 다녀온 전라도 신안, 군산 명소 여행지 추천"
생생정보 전설의맛진주안의갈비찜... 
서천여행지] 가볼만한 서천여행지 추천 &quot;서천 신성리갈대숲에서... 
"추억의 시간여행지, 군산 '경암동 철길마을'에서 시간의 중첩을... "
군산 시내 볼거리 진포해양테마공원 당일치기 여행코스 자전거... 
벚꽃 구경하며 걸을수 있는 전북 군산 가볼만한곳... 
군산 고군산군도 장자도 대장봉ㅣ대장봉전망대 가는... 
"전북여행지추천! 김제가볼만한곳 금산사,벽골제 그리고... "
카페 신민회 신창동에 위치한 분위기 맛집 군산여행지 추천
"군산 아이랑 경암동 철길마을, 기차마을 주차 / 재밌는 추억... "
선유도 구불길과 신시도 국립자연휴양림
군산 경암동 철길마을 주차 교복사진 달고나체험 여행코스
한국관광공사 선정! 9월 가족여행지는 어디?
뚜벅이 군산 여행코스 다양한 놀거리 있는 경암동 철길마을
군산 여행 코스 추천 비응마파지길 말랭이마을 군산시내 야경... 
군산 가볼 만한 곳 근대건축관 구) 조선은행 군산지점
"국내 당일치기 여행 군산 동국사, 신흥동 일본식가옥 볼거리"
군산 신흥동 일본식(히로쓰) 가옥-군산여행지
[전라도 여행지 추천] 1박2일 알찬 코스
[군산 여행] 이당미술관 구.군산시청 광장 그리고 해망굴
전라도 군산 뚜벅이여행 당일치기 코스 신흥동 일본식가옥... 
갑자기 떠난 여행지 근대유산 등록문화재인 군산 임피역사 간이역
국내 맞아? 외국에 놀러 온듯한 9월 국내 여행지 추천!
군산예쁜카페 데이트코스로 추천하는 Cafe Airport
[전북 군산/부안 ]  선유도해수욕장 / 복성루 / 내소사
추천 11월에 가볼 만한 곳] 두 바퀴로 만나는 늦가을 여행지
[막노는생활]경암동철길마을_군산철길마을_군산가볼만한곳... 
"군산 경암동 철길마을 주차, 놀거리와 볼거리"
전북 코로나 비대면 가을 여행지 추천 7곳
군산 여행 추천
신흥동 일본식 가옥 근대역사 흔적 군산 가볼만한 곳
"군산 벚꽃 3경, 은파호수공원 월명공원 그리고 월명체육관"
"군산 여행지, 군산관광지, 군산 금강 [전라북도 군산시] - 15.... "
군산 당일치기 여행지 볼거리 가볼만한곳 경암동철길마을 주차
"군산여행 가볼만한곳, 1박2일 군산여행지 추천 코스"
[2022.09.18] 익숙한 여행지
"군산 나홀로 여행! 군산 스탬프투어, 초원사진관, 구 군산세관... "
전북 군산 여행 - 신흥동일본식가옥(히로쓰가옥) &amp; 옛군산세관... 
군산1박2일 여행코스 다녀온곳들 총정리!
군산 여행지/군산 갈만한 곳/ 군산 볼거리/ 히로쓰 가옥(일본식... 
| 컬쳐 | 아름다운 우리나라 겨울여행지 추천! /겨울여행지추천... 
인문학 기운 가득한 아날로그 북카페 #정담
"전북 군산 고추짜장 지리는 지린성,미원동 맛집(주차/웨이팅 정보)"
[트래블 리더 지원미션] 20대에 꼭 가봐야 할 여행지
군산 가볼만한곳 선유도 해수욕장 대장봉 뷰~ 6곳
전북 군산 1박2일 선유도여행 숙소추천 선유도리조트 선유펜션... 
전북 군산에 가볼만한 곳 모음
봄 맞이 새만금 여행지
"군산 가볼만한곳, 군산항쟁관, 여미랑, 신흥동일본식가옥... "
군산 여행 국내 당일치기 여행 군산 경암동철길마을 주차
2023 여름철 섬캉스&amp;섬여행을 위해 떠나고 싶은 섬
군산 가볼만한곳 선유도 여행까지 6곳
"군산여행 전북가볼만한곳 :: 경암동 철길마을, 사진고 복고풍... "
2월 가볼만한곳 여행지 추천
"[군산 여행 숙소 추천] 에이본 호텔, 슈페리어 더블룸 숙박 후기"
군산 아이와 가볼만한 곳 테디베어뮤지엄군산
[테마여행지] 전국 3대 전통 빵집
군산 가볼만한곳 은파호수공원 벚꽃 만개했던 은파유원지
2023 새만금 팸투어 전북 군산 부안 가볼만한곳 1박2일 여행... 
군산 여행 신흥동 일본식가옥(히로쓰가옥) 타짜 촬영지
군산 무녀도 무녀2구마을버스 수제버거 &amp; 쥐똥섬(모세의 길)
전북 군산 여행(2) 은파호수공원 야경 보러 산책 / 공유자전거... 
군산여행 신흥동일본식가옥 말랭이마을 탐방기
전북 군산 구도심 투어와  '무녀도'     2023년 2월 9일
군산 가볼만한곳 선유도 등 새만금 방조제 지나 군산 여행
"군산 가볼만한곳 동국사, 일제강점기 군산역사관... "
[군산] Cafe Airport
군산 당일치기 드라이브 볼거리 먹거리 (근대화거리... 
"촌캉스, 반려견 여행, 한옥스테이 등 국내 이색 여행! 살아보기... "
"동대문구ㆍ군산시 자원봉사센터, 볼런투어 진행"
어버이날여행지 효도관광 Best 7 추천 핫플레이스 요약정리
"[군산 여행] 장자도 대장봉(142M), 군산 고군산군도 섬 여행"
"멋진 풍경을 품고 있는 겨울 군산 여행지 추천, 겨울바다를... "
군산 여행지에서 만난 영화촬영지 빈해원 3대 짬뽕 중국집
[군산]메인쿤브루잉(군산선물 추천)
&lt;군산&gt; 전북 군산시내 가볼만한곳 구도심 볼거리 - 군산도시숲길
군산 가볼만한곳 선유도 당일치기 군산 여행 코스 7곳
고급 일식당 월명 | 군산시 경장동 [해망로 프리미엄 일식집... 
"진포해양테마공원 :: 아이와 가기좋은 군산 여행지, 진포대첩과... "
대한민국 숨겨진 여행지 100을 보면서 - 3
"군산 경암동 철길마을, 7080 추억여행"
"고군산군도 여행 Best 5, 드라이브 코스, 군산 대장봉, 선유도... "
"(전북/새만금, 군산여행,1 ) 희망의 땅 새만금에서 여름휴가를......"
"군산 경암동 철길마을, 초원사진관 시간 여행.."
"4월 갈만한 국내여행지 추천 (feat. 버릇처럼, 열두달 여행)"
군산 우체통거리 / 순돌이곱창
"군산 &amp; 전주 1박 2일 가족여행 : 군산 지린성, 근대화거리, 이성당"
전북 아이와 가볼만한곳 특별한 전시와 체험 군산 근대역사박물관
여행/도보/음식/사진] 2. 전북 군산 - 3부. 짬뽕의 4대천왕 '복성루'
군산 가볼만한곳 야경 명소 은파호수 공원
군산여행  가을여행지  장자도 대장봉 #페이지
여행코스 근대시간여행 속으로 옛군산세관부터 6곳 군산여행지
"전북 군산 당일치기 - 군산 맛집 무녀도갈매기, 야미도꽃게바위... "
군산 가볼만한곳 먹거리 등 비응항 군산 여행 코스
군산여행지 군산 시내 당일치기 가볼만한곳 공설시장 먹거리
"무한도전에 나온 군산 짜장면집, 주차장, 군산여행지 추천"
익산 아가페정원 군산 은파호수공원 유원지 전북 여행필수품... 
아이와 군산 여행 가볼만한곳 근대역사박물관
군산 여행지 이국적인 사찰 동국사
군산 초원사진관 8월의 크리스마스 촬영지 시내 번화가... 
수송동 맛집 ♡ &quot;방이편백&quot; 편백찜
낮선 여행지의 맛집이야기... 유락식당/아귀찜 맛집/전북맛집]
군산 카페_군산과자조합_적산가옥 개조 카페
군산 독채 펜션 따숨과 이룸 아이랑 감성숙소 후기
[안내] 군산시 생활관광 프로그램 백투더모던 팸투어2차 참여자... 
이성당을 성당으로 알고 가다. 빵집이였다.
7월 국내여행지~놀거리 많은 전북으로 떠나요!
전라북도 순환관광 버스 시간표 요금 코스 알아보기
군산 여행 볼거리 고군산군도 지질공원과 공룡 발자국 화석산지
군산 가볼만한 곳 초원사진관 8월의 크리스마스 영화 촬영지... 
"시간을 걷는 여행지, 군산 가볼만한곳 여행!"
[전북/군산] 지친 여행객 입맛을 달래주었던 맛있는 고기집... 
전라도 군산 가볼만한곳 뚜벅이 여행 코스 근대역사박물관... 
"전라북도 가볼 만한 곳 고군산군도 섬 여행 (대장봉, 선유도... "
전라도 뚜벅이여행 군산 가볼만한곳 말랭이마을 당일치기... 
"자극하는 여행지 (탐방 정보, 주차 정보 팁) 전북 군산 여행/가볼... "
군산카페/선유도카페/장자도카페 _  오션뷰 맛집 카페라파르
&lt;군산&gt; 전북 군산시내 구도심상권 볼거리 먹거리 여행코스... 
국내 뚜벅이여행 군산 시외버스터미널 동서울 휴게소 시간표... 
과소평가 된 국내여행지 &lt;전북군산 여행 2박 3일-둘째날... 
국내여행지베스트10 군산여행 알찬코스 한눈에
군산카페/군산근대화거리카페 _ 군산과자조합
군산 삼겹살 / 안동집
전북 군산 가볼만한곳 군산 여행 코스 먹거리와 함께
"[군산여행] 봄나들이 여행지, 경암 철길마을!"
군산 가볼 만한 곳 - 아픈 역사가 남아있는 신흥동 일본식 가옥
황홀했던 군산cc 맛집
전북 군산 선유도 당일치기 / 1박2일 여행코스
"빌딩 숲 탈출기, 그늘 없는 파란 하늘 도시 군산 1박2일"
군산 여행지 맛집 추천 해물조개찜 해물포차 영화동 1호점
2023-2024 한국 여행 100선
[군산] 여행지 추천 말랭이 마을 &amp; 시간 여행 마을
근대역사박물관... 아이들과 함께 하기 좋은 실내여행지~~^^
집배원이 추천하는 진짜 겨울 여행지와 맛집
뚜벅이여행 : 군산 맛집 한일옥 + 초원사진관 + 이성당
"220513 군산 교복 데이트(경암 철길마을, 마리서사... "
군산 가볼만한 곳 리루서점 군산 철길마을 소품 가득한 독립서점
군산 선유도: 여행 신선처럼 즐길 수 있는 전라북도 여행지추천
적산가옥에서 만나는 분위기 가득한 군산 가볼만한 감성여행지... 
12월 국내여행지 겨울여행지 어디가 좋을까요?
[군산여행] 군산카페: 근대미술관 옆 일본다다미룸이 있는... 
(전북 군산) 퀄리티 좋은 각종 모둠장을 한자리에서 맛 볼 수... 
전북 군산 철길마을 아이와 추억여행
[여행 WITH 원광][공유] 군산 비대면 여행지 추천_추억속의... 
