[예산여행] 충북 근교 여행지로 제격인 충남 예산군 | 예산시장... 
"충남 예산군, 추천할만한 여름 여행지 3곳은?"
"[충남 예산] 남보부부 여름휴가... 예산군 데이트코스, 여행지... "
충남예산군   알뜰하게확실하게
&quot;백종원이 아니었으면 좋은 여행지 놓칠뻔...&quot; 충남 예산군에서... 
"충남 예산군 대표 관광지,예당호 출렁다리 추천"
충남예산군  똑똑한선택
&quot;백종원이 아니었으면 좋은 여행지 놓칠뻔...&quot; 충남 예산군에서... 
(충남예산군) 가족외식 장소 추천 예산 예당저수지 맛집... 
#충남예산군#예산추천여행지#덕산#대치리#가야산#가야봉#KBS.... 
충남 예산군 한정식 맛집 수덕사 산고을 식당 더덕정식 반찬... 
충남예산군 충남 예산군 덕산면 날씨  시원하게! 방법은 여깁니다
[예산] 예산 여행지추천 :: 예산군 하루 만에 잡아먹기
충남 예산군 내포보부상촌 아이들과 가볼만한곳
충남 예산군 역사문화슬로시티여행~스탬프투어 사과온천황새... 
충남여행지 예산 여행 예당호 출렁다리 음악분수 시간... 
올 추석 명절 가족과 함께 '충남 예산군' 관광명소 즐겨봐요
힐링 국내 여행지 추천 : 예산군 수덕사 템플스테이 체험... 
충남여행지 예산 여행  김정희 추사고택
"#충남 예산군 온천여행 《예당호출렁다리, 예당호모노레일... "
충청남도 예산군가볼만한곳 예산군 핫플레이스 먹방여행지... 
예산 가볼만한곳 충남 여행지 예당호 출렁다리 모노레일 음악분수
1박2일 가족여행 추천 여행지  충남 예당호 예산 출렁다리... 
[충남 예산군] 덕산 스플라스 근처 ; 나만 알고싶은 정갈한 밥집... 
출렁다리 음악분수 시간 주차 예당관광지 충남 여행지 데이트 코스
충남 예산 여행지 아이랑 갈만한곳 덕산온천 눈썰매장... 
충남예산 아이와갈만한곳 7월여행지 호국영령 유적지... 
국내여행지추천 충남예산 예당호느린호수길 &amp; 출렁다리 주말여행
심완예 충남 예산군의원 “학생 관광상품 발굴해야”
예산 가볼만한곳 충남 여행지 천년고찰 예산 덕숭산 수덕사
예산 가볼만한곳 여행 예산 수덕사 충남 여행지
[충청남도 예산군 골목양조장... 5월 비오는날 가볼만한곳 여행지]
추사 김정희 고택(충남 예산군)
여행이좋다 :: 예산 가볼만한곳 예산군 볼거리 여행지 숙박 정보
"예산군 황새공원, '충남 생태여행지 10선' 선정"
충남 자연뷰 산책맛집 여행지를 추천합니다! (펌)
예산 가볼만한곳 윤봉길의사 기념관 충남 여행지 아이와... 
충남여행 예산 가볼만한 곳 &lt; 수덕사 &gt; 예산 여행지
[8월 여행지 추천] 충남 예산 가볼 만한 곳!
충남 예산 가을여행지 당일여행 추천 수덕사 보덕사 남연군묘... 
"김영진 충남 예산군의원, 관광지 반려동물 동반 입장 확대 제안"
예산 가볼만한곳 9 놀거리 1박 2일 여행지 충남 여행 코스
충남 당진 아그로랜드 태산목장 국내 여행지 추천 입장료 주차
예산 윤봉길의사기념관 충의사 충남 우리나라 여행지
충남 여행지 당진 아그로랜드 태신목장 주말 아이와 가볼만한곳
골목양조장 백술상회 예산 핫플레이스 국내 주말 여행지
Best10 충남 가볼만한곳  충청겹벚꽃 4월추천여행지... 
충남 여행지 가볼만한곳 백종원 예산시장 먹거리 영업시간 주말... 
겨울 국내 여행지 추천 충청도 여행 충남 예산 예당호 출렁다리
"향기로운 충남 나들이 예산 향천사, 붉은 단풍 여행지"
내 고향 충남 예산 여행... 리솜 워터파크) ♨ 겨울 여행지 추천
충남 예산 가볼만한곳 예당호 출렁다리 등 여행코스
가을 여행지 추천:: 목가적인 풍경이 아름다운 충남 예산 카페... 
충남 여행지 예산 가볼만한곳 의좋은형제 공원 의좋은 형제... 
예산국수 예산8미 예산시장 여행지 먹거리 장옥 선봉국수
1박2일시즌4 충남예산촬영지... 덕산온천 수덕사여행지
"[충남 예산] 아름다운 충남 여행지 예산 가볼만한곳, 수덕사... "
"추억의 골목스케치, 충남 골목 여행지 베스트 8"
송림산림욕장/충남 지역 ‘친환경 추천 여행지’
충남 여행지 예산 예당호 출렁다리와 예당국민관광지
국내여행 충남 예산여행지 아이와함께 가볼만한곳 내포보부상촌
충남 예산여행 11월 풍경을 담아낸 금오산 향천사의 단풍 명소
예당호 카페 아레테 충남 예산 여행지 가볼만한곳 황금나무... 
충남 예산 덕산온천 겨울철 여행지 &quot;스플라스 리솜 온천 워터파크&quot;
[촌식이의 하루] 부모님과 함께 다녀온 충남 아산 1박 2일 코스... 
충남 예산 덕숭산 수덕사! 절... 시간 가을 여행지 가볼만한 곳
예당 저수지와 예당호 출렁다리가 있는 충남 여행지로 떠나요
충남 예산여행 의좋은형제공원 아이와 가볼만한곳
덕산 스플라스 리솜 워터파크 준비물 충남 예산 여행지 아이와... 
충남 근대공주 전통예산 국내 뚜벅이 시간여행 (충청남도... 
예산군 여행 아그로랜드 태신목장
충남 예산 가을나들이... 예당호모노레일: 청주근교여행지로 추천
충남 예산 덕산테라스 무인텔 노천탕이 있는 복층 예산 숙소
"충남 예산 예당호 모노레일 요금 예약, 아이와 가볼만한 여행지"
충남 가을여행지 예산 예당호 출렁다리에서 야간 빛 축제... 
충남 여행지 예산 가볼만한곳 백종원 예산시장 맛집 추천... 
국내 여행지 추천 충남 가볼만한곳 10월 여행지 예당호 모노레일
공주 1박 2일 여행코스 추천 8곳(+충남 여행지)
예산 여행지 예당호 출렁다리 야경 음악분수 멋지고
[충남/예산] 백설농부 | 예산정원카페 | 대전근교 가을여행지... 
충남여행지 예산시장 9월 축제 백종원 맥주 페스티발 일정... 
충남여행 예산 수덕사 고즈넉한 덕숭산 힐링여행지
충남 예산 예당호 출렁다리 가볼만한 여행지
9월 10월 가을꽃 여행지 모음10 가을여행 국내여행 청산수목원... 
충남 예산 추사 김정희 고택 여행 가볼만한 곳
"사회적 거리두기 실천하는 충남 여행지, 드라이브 코스 5선"
"데이트♡ | 충남 예산군 [T.... 고향, 예당저수지, 커플여행지 추천]"
"충남 예산 숙박, 예산시장 근처 숙소 추천, 가성비갑... "
예산시장 예산장터광장  백종원골목  충남여행지추천
샤스타데이지 명소::청보리밭이 펼쳐진 충남 예산  카페 여행지... 
"캠페인 방역 우수 관광지 중 강원, 경기, 충북, 충남 소재 여행지"
충남 예산 덕산 내포보부상촌... 당일치기 여행지 입장료 할인... 
충남 예산군의여행지
충남가볼만한곳 예산여행지 수덕사 단풍에 물들다.
&lt;예산&gt; 충남 10월 아이와 가볼만한곳 가을여행지... 
종강을 맞이해 가볼 만한 충남 언택트 여행지 4곳! 거리 두기... 
아그로랜드 태신목장 수레국화 (충남 당진 가볼만한곳 여행지)
충남 예산황새공원 충청도 생태체험 여행지
"트레킹 (충남 여행... 5코스, 충의사, 남연군묘) 국내여행지 추천"
충남 예산군 네번째로 길다는 예당호 출렁다리
"충남 예산 윤봉길 의사 생가와 유적 충의사, 윤봉길 의사 기념관... "
충남 예산군 ; 새로운 핫플! 백종원의 예산시장 살리기 프로젝트
가을 국내 여행지 추천 예산 가볼만한곳 대흥면 '더 느린 여행'
충남 여행지 아그로랜드 태신 목장 겹벚꽃 포함 볼거리 다양한... 
찬란한 덕숭산 수덕사 단풍 예산 가볼만한곳 충남 단풍여행지추천
충남 예산 여행 백종원 예산시장 장터 광장 테이블 (feat.... 
충남예산/예당저수지/예산맛집/소쿠리밥상/여행지추천[강남... 
충남예산 가볼만한곳 여행지추천 [수덕사] 예산여행 주차... 
"[충남 예산군] 현지인 추천 모임장소, 광시한우길/한우맛집... "
충남 예산 여행지 가볼만한 곳 추천 :) 주말 아이들과 다녀오기... 
충남 여행지 예산 관광지 가볼만한곳 예당저수지 산책로... 
충청남도에서 충남 15시군의 여행지 10곳 총 150곳을... 
"충남여행 2편 - 예산군 광시한우마을, 의좋은형제공원... "
충남여행지 예산가볼만한곳 : 삽다리곱창 현지인 맛집
충남 예산 가볼만한곳 추사고택 볼거리 혼자 여행 추천 힐링... 
"[국내여행지추천] 당일치기 여행, 충남 예산 가볼만한 곳... "
이번 주말 추천 여행지 예산 코스모스 만발 아그로랜드 태신목장
8월여행지 여름휴가 아이와가볼만한곳 예산 보부상박물관... 
충남여행지 덕산 스파캐슬 스플라스 리솜 워터파크 개장
충남 축제 9월 가볼만한곳 예산황새축제 황새는 못말려가... 
충남 예산 가볼만한곳 대흥면 생활관광 더느린여행 예당호... 
"충남 여행지 추천 : 예산 여행, 스탬프투어(기념품)"
"국내 온천여행지 추천 - 충남 리솜스파캐슬, 속초 설악워터피아... "
연꽃의 계절 여름 가볼만한곳 충남  당진 합덕제 7월 8월 여행지
[충남/예산] 충청도 여행지 ‘아그로랜드 태신목장’
"충남 예산군 해미읍성, 추사 고택, ... 태안반도 안면도 여행"
[충남 예산군] 기억들 모아 모아 1
충남예산군 사찰 '쌍지암'
충남 가볼만한곳 예산황토사과축제 다녀왔어요~~
"겨울에 놀러가기 좋은곳, 국내온천여행지로 유명한 충남 예산"
충남 예산 가볼만한곳 가을 생활관광 대흥면 더느린 여행 체험기
충남 여행지 예산 달팽이 미술관 슬로시티 가볼만한곳
"[국내여행지추천] 당일치기 여행, 충남 예산 가볼 만한 곳... "
[충남 여행지 추천]코로나19를 극복하는 방법!... 
"[충남예산여행지][예당저수지][예당호] 예당호 출렁다리,예당호... "
예산 봄 여행지 추천 추사고택 :: 충남 수선화 명소 가볼만한곳
충남 예산 숙소 출렁다리 감성 개별 바베큐 펜션 구공스테이... 
충남 예산시장 백종원 상설시장 맛집 이용팁
화담숲 추사고택 지리산치즈랜드 3월추천여행지 4월추천여행지
충남 예산 카페 수덕사 근처 가볼만한곳 유양창고
[예산여행] 한옥카페 간양길 추석연휴 여행지 카페여행
[충남 예산] 예산 가볼만한 곳 백종원 예산시장 방문후기... 
2021.06.12-13 당진 뚜벅이여행 가볼만한곳 충남 예산군... 
호반호텔&amp; 리조트:) 충남 여행지 워터파크추천 리솜스파캐슬... 
#충남방역우수여행지
"충남 당진 여행 신리성지 한국여행지 추천 조용한 공간, 순례길"
우리나라 주말 여행지 추천... 입장료 겹벚꽃 충남 벚꽃명소
충남 예산군 덕산 스플라스 리솜 워터파크 - 온천과 함께 가족... 
예산 내포보부상촌 어린이날 나들이 주말 여행지
충남 예산군 예당호출렁다리&amp;음악분수 (21년 2월 20일... 
충남여행지! 가족여행 스플라스 리솜 워터파크로 고고! 리뉴얼... 
충남 여행지 예산 추사고택 &amp; 사브작 걸으며 주변 가볼만한곳
충남 예산 여행지 가볼만한곳 드라이브 코스 황새공원
충남 예산 여행 예당호 출렁다리 음악분수
"충남 예산 당일치기 여행, 백종원 예산 시장 재개장 후"
충남 예산 가볼만한곳 백종원거리 예산시장 상설시장이라... 
걷기 좋은 충남 예산 가을 여행지 예당호 출렁다리 걸어요
충남 서산 예산 가볼만한곳... 예당호출렁다리 간월암 여행지 추천
충남 여행지 추천 예산시장 백종원거리
충남 예산 가볼만한곳 백종원 예산시장 예당저수지 등 5
충남 예산 가볼만한곳 예산여행 6 예당호 출렁다리 음악분수... 
"충남 예산 여행지 가볼만한곳, 수덕사 외 3곳"
충남 예산 여행! 예당 저수지와 예당호 출렁다리
충남  예산 사과축제 가을 나들이
충남 봄 겹벚꽃 명소 데이트 여행코스 베스트 6
예산군 '예당호 느린호수길' 대한민국 안심관광지 선정
손짜장대가 - 짜장면 &amp; 송이덮밥 맛집 | 충남 예산군 [T. 오가면... 
충남 예산 여행 온천을 즐길수 있는 덕산 스플라스리솜
충남 예산 여행지 추천 분위기 좋은 카페 &quot;제2막&quot;
"(충남 내포 걷기좋은길) 예산군 명상치유숲길, 댑싸리원"
"[국내여행지추천] 당일치기 여행 추천, 충남 예산 가볼만한 곳... "
"충남 여행  예산 가볼 만한 곳 : 예산 백종원 시장, 예당저수지... "
충남 당진시 서산시와 맞닿은 예산군 오토캠핑장 테슬라... 
예산군 주말에 갈만한곳 내포보부상촌
국내 9월 축제 여행지 추천 가볼만한곳 10 기본정보 (서울 근교... 
충남 예산 놀거리 아이와 가볼만한곳 관광 명소 여행지 추천... 
타임 -카페소복 | 충남 예산 [T.... 충청남도 예산군 예산읍... 
예산가볼만한곳 수덕사 예산여행 추천 입장료 충남여행지... 
외국 부럽지 않은 이국적인 분위기의 충남의 명소
"충남 예산 청보리가 가득한 신상 카페, 백설농부"
예산여행 대한민국 안심여행지 선정된 예당호느린호수길
가볼만한 곳 예산 보부상촌테마파크 물놀이 추천 충남여행지
충남 예산군 가볼만한 곳: (2015.05.02) (예산여행지 추천... 
[당진여행] 충남 당진 여행추천 :: 봄 여행지 아그로랜드 태신목장
예산 아그로랜드 아이들과 함께 하기 좋은 여행지
"아름다운 충남의 봄,여름,가을,겨울"
충남 예산 예당호 빛축제 빛나유 출렁다리 야경 환상이야
"충남 예산 가볼 만한 곳 | 아그로랜드 태신목장, 내포보부상촌... "
충남 예산 수덕사 대웅전 여행 가볼만한곳 입장료 운영시간
충남 예산 여행 힐링하기 좋은 예당호출렁다리(운영시간 정보)
"충남여행지 + 예산맛집 :: 예당호출렁다리, 민물나라 어죽, 수덕사"
예산여행 겨울에는 뜨끈뜨끈한 덕산온천에서 몸을 담그고... 
충남 예산 카페 추천 백설농부 메리골드가 만개인 정원카페
충남 예산여행코스 고속도로 예산휴게소 당진방향
덕산 스플라스 리솜 워터파크 온천 겨울 스파여행
충남 아이랑 여행 / 덕산 스플라스 리솜 주변 여행지
가족의 사랑을 확인할 수 있는 충남 예산 의좋은형제축제
경북 가을여행지 추천 문경새재 도립공원 코스따라 단풍명소 여행
충남 온천 여행 예산 덕산 스플라스 리솜 리조트 워터파크 온천몽
충남 예산 가볼만한 곳... 음악분수 시간 반려견 동반 여행지
충남 예산가볼만한곳 예산 핫플 여행지 예산시장(백종원... 
예산군 군청 고시 공고 로고 관광 명소 맛집
충남 예산 예당호 출렁다리 가야하는 이유 의외의 주변 볼거리... 
충남 예산군 아름다운 예당저수지의  좌대가 있는 낚시터 풍경
국내여행지 추천 충남여행지 예산 예당호 모노레일
아산 7개 여행지 1박 2일! (ft. 충남 여행지)
아름다운 충남 3대 출렁다리
"예산군,으뜸 청정지역에서 즐기는 힐링투어"
"[충남/예산] 충남 예산 '백종원' 예산 전통시장, 금요일 방문... "
충남 여행 예산시장 맛집 추천 장터 광장 및 삼국 축제
자연이 아름다운 슬기로운 충남여행  베스트 8
예산 가볼만한곳/충남 여행/예산 여행/충남 가볼만한곳
"충남 서해안 당일 여행…공세리 성당, 김정희 고택, 예당호... "
추사고택 충남 여행지 예산10경 아시나요?
추석 여행지 추천 가족과 시간 보내기 좋은 장소 5
예산여행 봉수산자연휴양림 예산 가볼만한곳 충남 아이와... 
충남 예산 가볼만한곳 수덕사/수덕사 대웅전 삼층석탑
충남 여행 예산 가볼만한 곳 의좋은 형제 공원 &amp; 대흥동헌... 
국내 겨울 여행지 추천 가족 여행지로 좋은 아산 온양온천과... 
충청남도 예산군 갈만한곳 여행지... 입장료는 없습니다...
충남예산여행 호수로 떠나는 힐링여행지 예당호 느린호수길... 
[충남 충북] 전국 캠핑장 중부지역 방문 추천 총정리
[6차산업] 올 여름 핫플! 6차산업 국내 여행지 여기 어때?!
충남 여행 예산 예당호 출렁다리 예당 저수지 예당 관광지
예산시장 맛집 ft. 예산 가볼만한곳/충남 여행/예산 여행 갈만한곳
2023 가을 추천 여행지 TOP 10!
예당호 출렁다리 예천여행 데이트코스로 굿
모노레일 타고 국내 최대 저수지 둘러보기
"충남도의 숨겨진 명소, 나만 알고 싶은 매력적인 여행지!"
충남 예산 가볼만한곳 예당호 출렁다리 모노레일 운행시간 입장권
충남 여행 가볼만한곳 예산황새공원 | 제3회 예산황새축제
충남국내여행 카페둔리 가족 커플 친구 누구와도 아늑하게 즐길... 
충남 가볼만한곳 덕산... 리솜 리조트 국내 온천여행 충남여행 코스
충남 감성숙소 독채 온천 풀빌라 온연 프라이빗11월... 
"[예산 가볼만한곳] 명실상부 충남 생태여행지, '제1회... "
11월 국내 서울근교 가을 당일치기 여행지 추천 예당호... 
예산 스탬프투어 여행도 하고 선물도 받고~[콘텐츠제작... 
겨울은 노천탕이지!  [국내 온천 여행지 추천]
충남 나들이 아이랑 가볼만한 곳 추사기념관 예산 여행지로 추천
충남 여행지 꼭 가볼만 한 곳 추천 예산 예당호 출렁다리
"충남 예산군 가야산(677.6ｍ) 등산로 코스/소개,산악회"
충남 예산군 수덕사에서 엄마는 오늘도 또 식사중~~♡
충남 예산여행 예산시장 백종원거리 먹거리 추천해요!
"[예산군 응봉면]예당호 출렁다리, 모노레일 그리고 벚꽃(긴글... "
충청도 가볼만한곳 충남 예산... 만들기.농장체험 1박2일여행지
공주 1박 2일 여행코스 추천 8곳! (ft. 충남 여행지)
충남 예산 출렁다리 음악분수 모노레일 예당호 관광
태랑 타운하우스(단독형)☆★☆충남 예산군 덕산면 옥계리... 
충남 예산 여행 대흥 슬로시티 대흥동헌과 달팽이 미술관
여행지에서 맛보는 군자삼락 첫날
충남 여행지 추천 : 예산 아그로랜드 태신목장
맞는 여행을 위해! 2020 특별 여행주간 추천여행지(feat.이벤트)
"예산군, 여름휴가 추천 여행지 “여기는 꼭 가자”"
충청도 예산 여행지 아이와 가볼만한곳 내포보부상촌 물놀이장... 
임시정부 수립 100주년 기념! 충남에서 꼭 가봐야 할 역사 여행지
서산 가볼만한곳 베스트10 추천 충남 여행지
충남 당진 아이랑 가기좋은 아그로랜드 태신목장
충남 가을 단풍여행지 수덕사 한정식 맛집 ' 덕숭식당 '
예산 가볼만한곳 충남 수덕사 엄마랑 여행하기 좋은 예산여행... 
한적한 가을 여행지 충남 예산 성당
충청남도 가 볼만한 곳 예산군 예당호 출렁다리 엄청 길다!
골때리는 외박 1회 충남 예산 카페 숙소 촬영지 FC 아나콘다... 
예산 언택트(Untact) 여행지 Top 5
"[충남 예산군] 예당호 출렁다리 강아지랑 여행,음악분수 시간... "
"예산 가볼만한곳 예산시장, 예당호 출렁다리 모노레일 등... "
충남 갈만한곳 예산 덕산 스플라스 리솜 리조트 (ft. 충청도 여행)
청양 1박 2일 여행코스 추천 7곳! (ft. 충남 여행지)
"다시 가고 싶은 곳, 예산황새공원 .. [충남예산여행]"
광시 한우테마공원의 여유로움 깊은 가을
충남 예산 여행 백종원 예산시장 장날 주차 오픈 시간 휴무 평일... 
"충남가볼만한곳 예산여행, 언택트힐링여행지 예당저수지"
겨울여행지 추천 덕산 스플라스 온천 워터파크
"충청남도 예산군 예당저수지 출렁다리, 너무 예쁜 뷰!"
충남 예산 여행지 :) 예당저수지 예당호 출렁다리 여행 후기... 
연휴 기분전환 힐링 여행지 추천 전국 100선 모음 가을 여행지
충남 나들이 예산 가볼만한곳 백종원 예산시장 장날 장터광장... 
내포보부상촌/ 아이들과 함께하는 추억 역사 공부여행/충남예산... 
예산 가볼 만한 곳 백종원거리 예산시장 장터광장
[충청남도여행] 충남 베스트 여행지 - 2
4월 가볼만한곳 : 충남 예산 수선화 꽃구경 추사 고택
"예산 수덕사 대웅전 관람 입장료, 충남 사찰여행 가볼만한곳"
여행후기: 충남예산군 1)아그로랜드 (태신목장)
"충남 예산여행 맛집, 백종원 삽교 곱창거리 곱창인가 후기!"
"예산가볼만한곳 덕산온천, 수덕사 맛집&amp;카페, 삽교곱창거리 추천"
충남 예산 여행코스 OK웨스턴승마클럽 승마장 일일체험 즐거워
예산 추사 김정희 고택 추사기념관 완당 예산 가볼 만한 곳
충남 데이트코스 예산 내포보부상촌 물놀이터 입장료 할인 식당... 
5월 가족의 날 가기 좋은 여행지
색다른 국내여행지 충남 홍성 홍예공원 독립운동가의 거리
충남 여행지 / 음악 분수가 장관이었던 ' 예당호 출렁다리 '
충남여행 예산 가볼만한 곳 &lt; 예당호 출렁다리 &gt; 음악분수... 
충남 당진 가볼만한곳 사진찍기 좋은 아그로랜드 태신목장의 봄
운해가 아름다운 예당저수지의 가을
충남 단풍 구경 명소 예산 향천사
푸른 초원과 목가적인 풍경이 아름다운 충남여행지 아그로랜드... 
충남당진 가볼만한곳/ 당진 아그로랜드 태신목장 삽교호... 
충남 예산 가볼만한 곳 백종원거리 예산상설시장(신광정육점... 
2021년 11월 축제일정 전국 93곳 모음 11월 여행지 추천... 
수덕사 겨울풍경 예산 가볼만한곳 겨울여행지추천
예당호 음악 분수 시간과 출렁다리 낮과 밤 비교 충남 예산... 
낮과 밤의 아름다운 매력 '예당호'
충남 여행 예산 가볼만한곳 덕산 스플라스 리솜 워터파크 / s25... 
예당호 출렁다리 예산여행 코스(충남여행지)
손가락 닮은 여행지? '대박 손가락 바위'
깊은 가을도 아름다운 예산황새공원
예산 가을 여행지 아그로랜드 태신목장 코스모스
"충남 예산 여행 예당호 출렁다리, 걷고 싶은 느린호수길"
[ 아산온천여행 / 겨울여행지 추천 ] 충남 아산 가볼만한곳
충남 예산 가볼만한곳 예당호 출렁다리 와 음악분수
"예산군, 예당호 야간 음악분수 및 느린호수길 '여름 시즌... "
충남 당진 1박 2일 여행 코스 아그로랜드 신리성지 호텔로씨오... 
충남 아이와 가볼만한곳 나들이 당진 아그로랜드 태신목장... 
&lt;예산&gt; 충남여행 가볼만한곳 드라이브 데이트 코스-예당호... 
"[머물다] 충남 예산 수덕사, 2020년을 마무리하는 즈음에.."
예산 1박2일 여행지 가볼 만한 곳 수덕사
[충남예산 숙소] 구공스테이 해월
"당진 아그로랜드 태신목장, 충남 당진 예산 여행 맛집 캠핑장"
여행지 사전 답사-충남 예산 출렁다리
초록을 담은 5월 국내 여행지 추천 7곳
충남가볼만한곳 대흥슬로시티 의좋은형제마을
당진/예산 아그로랜드 태신목장 충남 아이와 가기좋은곳
"예산 윤봉길의사기념관, 충의사 아이와 가볼만한 역사 여행지"
"예산군 대흥슬로시티, 2월 가볼만한 곳 선정"
충남 예산 야경 여행 가볼만한곳 예당호 출렁다리 음악 분수... 
충남 예산 예당호 느린 호수길 예당호 출렁다리
"충남 당진 여행, 가을로... 당진여행지추천, 당일치기"
[예산 여행] 충남 가볼만한곳 예산시장 맛집 털고 왔어요^^
&lt;예산&gt; 충남 가볼만한곳 드라이브 데이트 코스-덕산... 
&lt;예산&gt; 충남 가볼만한곳 예산 가을 여행지 - 삼국축제
&lt;예산&gt;충남 아이와가볼만한곳 가족여행 가을나들이... 
충남여행지 내포보부상촌::충남비오는날갈만한곳... 
가을 단풍여행지 - 여승으로 유명한 예산군 수덕사에 다녀오다.
예산 가볼만한곳 봄꽃 여행지 추사고택 수선화 살구꽃 자목련... 
사과 따고 소세지 만들고~충남에서 보내는 가을 이색 농촌체험!
"충남 여행지 스플라스 리솜 리조트, 워터파크 다녀온 주말 여행"
충남 여행 예산 대흥동헌
당진 아그로랜드 초록초록해!가족여행지로 추천~
"[충남예산: 예당호 출렁다리, 모노레일]예산의 대표관광지 꼭... "
"고즈넉함이 폴폴~ 충남 나들이 예산여행! 향교, 카페이안, 산성"
