[예산여행] 충북 근교 여행지로 제격인 충남 예산군 | 예산시장... 
가볼만한곳 농장체험 예당호 출렁다리 음악분수 외 가족여행지
당진 아그로랜드 태신목장 수레국화 초원 당일여행지 가볼 만한... 
예산 갈만한곳 예당호출렁다리(이용시간)
당진 예산 당일치기 추천 여행지:: '아그로랜드' 입장료 포토존... 
예산가볼만한곳 예산시장
[충남예산여행지/충남 예산 가볼만한곳] 우리가 이렇게 편하게... 
[충남예산여행] 의좋은 형제의고장 예산 팸투어 -4편  저한당... 
곳 '내포보부상촌' 할인 정보 덕산 스플라스 리솜 주변 여행지 추천
[충남 예산] 유양창고
충남 예산 여행 의좋은형제 공원
예산 가볼만한곳 예산치유의숲 걷기좋은길 메타쉐콰이어길... 
예산가볼만한곳 예당호출렁다리 설경 예산맛집 : 대흥식당... 
"레트로감성카페, 주말데이트코스 커피향에 취하는 아저씨커피"
대전 근교 겨울 여행지 추천 덕산 스플라스 리솜 온천 워터파크
충남 예산여행 역사 인물:면암 최익현 선생묘소(재실)
충남여행지/예산 가볼만한 곳/ 보부상유품전시관[예덕상무사]
12월여행지 수덕사 눈이와요!
kt금호렌터카 가 추천하는 1박 2일 충남 예산
스파  워터파크 / 플렉스타워 s30 후기ㅣ충남 아이와 가볼만한 곳
충남 예산 가볼만한 곳 : 아그로랜드
"덕산온천과 공세리성당을 찾아가는 여행 (충남 아산, 예산... "
충청도 여행지 아이와 가볼만한곳 예산황새공원
충청도 가볼만한곳 여행지 예산 가을축제 의좋은 형제공원
고즈넉한 사찰 여행 예산 수덕사 (단풍 시즌 방문하기 좋은 곳)
예당호 모노레일 충남 예산 가족여행
미세먼지 없는 세상 되었으면...충남 생태여행지 10선... 
"충남 예산 가볼만한곳 추사고택, 기념관, 체험관, 가을여행"
【충남명소/예산】... 있는 충남 모노레일 명소 / 야갼에도 탈 수... 
"[전국 겹벚꽃 명소] 서울, 충청, 전라, 경상도, 겹벚꽃 여행지"
당일치기 가능한 해외같은 온천여행 예산 덕산 스플라스 리솜... 
"서울 근교 여행지, 자연과 함께 힐링충전! 당진 여행지 추천!"
"12월 겨울 여행지 추천, 전국 방방 곳곳 BEST. 5"
예산시장 백종원 시장이 되다 충남 가볼만한곳 국내여행
충남 겨울여행 천년고찰 예산 수덕사
"예당호 출렁다리,대천해수욕장(충남 나들이 코스)"
"충남 예산 여행 가볼만한곳 BEST 6 (예산 시장, 예당호 음악분수... "
예산여행 자연 속에서 힐링 아그로랜드 태신목장
예산 시장 주차장 정보와 백종원 국밥거리 포함 예산 여행
9월과 더불어 선선한 가을에 가면 좋은 여행지 Top5
"당진 가볼만한곳  한진포구, 카페피어라, 삽교호 놀이동산... "
[충남 예산] 아그로랜드 태신목장
"[예산군 덕산면] 수덕사도 둘러보고 , 전통한정식도 먹은 여행... "
충남 예산여행과 함께하는 스탬프투어
아이와 함께 갈만한 곳 예산 내포 보부상촌
충남 가야산 겨울 산행 - 2014년 2월 23일(일)
충남 여행 예산 가볼만한곳 예당호 출렁다리 음악분수... 
충남 예산 &lt; 가야산 덕산도립공원 &gt;
"[충남여행지] 충남예산 예당호, 예당저수지~ 우리나라에서 가장... "
"예산 코스모스 여행지, 아그로랜드 태신목장(주차, 입장료)"
덕숭총림수덕사/대한불교조계종/대웅전/예산군
볼거리 많은 충남 예산 가볼만한곳~ 내포보부상촌
예산여행 100선 5 예당호
오후 6시 이후 무료로 입장해서 바비큐체험(유료)을 즐길 수... 
안전한 여행 중심 '2020 특별 여행주간(7월 1~19일)'
"예산 가볼만한곳 암하리생태공원, 웅장한 열녀바위 &amp; 경치 좋은... "
[리솜리조트] 차가운 겨울에 즐기는 따뜻한 힐링! 리솜 브랜드... 
충남 예산 가볼만한곳 &lt;메타세콰이어길 &amp; 덕산온천 족욕체험장... 
국내 야외 노천 온천탕 추천 BEST 9
7월 국내여행지추천 충남 예산 가볼만한곳 봉수산 자연휴양림... 
충청도 예산 여행코스 덕산 내포보부상촌 봉수산 자연휴양림... 
힐링여행에 좋은 충청남도 예산군 대흥면
스플라스 리솜 온천 워터파크 요금 및 운영 시간
"예산 여행 예당호 모노레일,출렁다리 예산시장"
충남 예산 가볼만한곳 예당호 출렁다리와 예당저수지 둘레길
"가을 축제, 9월 축제 / 계림바스 9월 #경품이벤트"
국내여행지추천: 당진여행- 당진아그로랜드 태신목장에서 가을... 
예산 기차여행 단풍이 곱게 물든  예산 성당 꽃밭
[예산 애견동반 여행] - 돌다리농원에 사과 따러 가요/봄의 꽃과... 
국내 6월 여행지 '당진 가볼만한곳' BEST 3 : 아미미술관... 
청양 맛집 추천 베스트 7 (ft. 충남 여행)
"4월 5월 충남 당진,서산 봄 나들이 가볼만한곳 정리. 겹벚꽃 시기"
충남 예산 가볼만한곳 내포보부상촌 맛집 식당 음식 할인 정보
예산 수덕사 예산여행지 가볼만한곳
"가을 온천여행, 온천도시 추천"
당진여행 충남여행 태안여행 아이들과 주말에 가기 좋은 곳... 
"아무도 예상하지 못했던, 예산 당일 치기 여행"
"[여행] 여름휴가, 예산여행 덕숭산 수덕사"
대전 근교 당일 여행 예산 예당호 출렁다리 예당저수지... 
충남 예산 가볼만한곳 내포보부상촌 가족여행 딱이에요
덕산 리솜스파캐슬 [충남여행/예산여행]
겨울이 되기 전에 피톤치드 받아보자! 국가숲길 6종
대한민국 관광사진 공모전 2019 안내 (및 2018 수상작)
국내 조용한 여행지 추천 임존성 예산 여행 가볼만한곳
여행은 살아 보는 거야 | 두 번째 이야기 &lt;충남에서 여자혼자... 
공주 숙소 추천 베스트 5 (ft. 충남 여행 숙박)
[포이의 여행] 충남 주말에 가볼만한곳 여기 어때요? (웅도... 
10월 가을 여행지 추천 예산 의좋은형제 공원
예산 가볼만한곳 치유의 숲길과 예산향교 힐링 여행 코스
예산여행 의좋은형제축제 개최되는 의좋은형제공원 방문기
【충남명소/예산】 &quot;예당호... 예당호레이져빔영상쇼 / 충남야... 
충남 예산 여행 &lt;메타세콰이어길&gt; 족욕 체험하고 걷기
충남 예산 가볼만한곳 예당호가 보이는 예산 예당호조각공원
"예산 가볼만한곳, 예당호 출렁다리"
스플라스 리솜 플랙스타워 S30 B타입 뷰 및 후기... 
음악분수 레이저 빔영상쇼 운영시간 안내 겨울 여행지 추천
충남 가볼만한곳 삽교호관광지 &amp; 아산 당진 당일치기!
충남예산여행/수덕사에서 즐거운 하루를~/ 산채로정식으로... 
충남 가볼만한곳 예산 여행 추사 김정희선생 고택
충남 예산 느린꼬부랑길 제1코스 옛이야기길 정보
아이들과 충남 예산 예당호  출렁다리 즉흥여행:  봄밤에 본... 
충남 여행 스플라스 리솜 내돈내산 객실 리뷰 (feat. 워터파크... 
충남안심여행지 쉼과 힐링 체험형 테마파크 예산 내포 보부상촌
예당저수지를 지키는 황금나무의 지나간 겨울풍경
국내온천여행 꼭 가고 싶던 온연 프라이빗 빌라에서 즐기는... 
[예산] 맥주페스티벌 예산시장 장터광장 가을먹거리 축제 실시간
"리솜 워터파크,숙박"
예산 추사고택과 추사기념관 초등학생 아이와 함께 떠나는... 
[우리나라 그림 같은 여행지] 충남 예산 예당저수지
충남 예산 덕산온천 가족탕있는 스파뷰호텔 ( 독채펜션 사랑채... 
공주 맛집 베스트 10 추천 리스트! (ft. 충남 여행)
예당호 모노레일 &amp; 출렁다리 :  서울근교 나들이 장소 추천! 예쁜... 
충청남도 사계절 충남 놀거리 먹거리 축제 가득
충청도 가을축제 아이랑 가볼만한곳 베스트3
짙어가는 가을향기를 느낄수 있는 추사 김정희 고택 예산여행지... 
충남 예산 예당호 출렁다리 음악 분수 조각 공원 파노라마 풍경... 
[충남/예산] 덕산 스플라스 리솜 리조트 스테이타워 골드 S30... 
예산 여행 봉수산 자연휴양림 봉수산수목원 하늘데크
충청남도 여행지 지역번호 공주 가볼만한곳
예산군 예당호 야간음악분수·느린호수길 ‘여름 시즌 숨은... 
[충남 예산] 가볼만한 곳. 느린 호수길을 따라 천천히 걸어본... 
다양한 정보와 함께하는 예산 기차 여행 '신례원역'
충청도 여행지 가볼만한곳 예산 예당호출렁다리 음악분수 시간
예당저수지(충남)
예산 여행 추사 김정희 선생 고택 기념관
10월 가볼만한곳 대한민국 축제 문화의달 &amp; 충남여행을 함께... 
11월 가볼만한곳 충남 예산 예당호 출렁다리 모노레일 충남... 
충청도 여행 가볼만한곳 : 예산 예당호 출렁다리 저수지 관광지
예산군목조주택 만나보셔서 꿈구는 귀농생활 만나보세요
지금 당장 갈 수 있는 온천여행지 추천 Top5
가을여행추천지 충남예산가볼만한곳 바다같이 넓은 호수... 
아산 펜션 추천 베스트 5 (ft. 충남 여행 숙소)
예산 추천 여행지
"[서울근교여행지 추천] 2021년 5월에는 수레국화, 당진에 이런... "
서울근교 아이와 나들이 체험 가볼만한곳 모음
충남여행 예산 가볼만한 곳 &lt; 메타세콰이어길 &gt; 산책 &amp; 사진찍기... 
걷기여행 길 추천｜바스락바스락 걷기 좋은 길 BEST 4
먹거리먹거리 여행지 당진장고항 충남서해안의 실치축... 
[충남예산커플여행지추천]국가대표사찰 수덕사 탐방
위드 코로나 놀 거리 예산 장터 삼국 축제
[1박 2일 충청남도 여행 코스] 누구와 가도 좋은 충남 :: 홍성... 
"여행 :: 당진/예산 당일치기 국내여행지 추천, &quot;아그로랜드... "
[추석연휴 '숨겨진 여행지' ①충남편] 청양 꽃물결에 빠져 볼까요?
국내1박2일 예산 여행 가볼만한곳 추사김정희 매헌윤봉길... 
예산 가볼만한곳 예당호 출렁다리 모노레일 외 서울 근교... 
충남 예산 : 백종원 예산시장 [ 주차 꿀팁 / 주차장 주소첨부 ]... 
예산여행 역사인물 윤봉길의사 기념관 충의사
충남 예산 가볼만한곳 5월 사찰여행 수덕사의 봄
[여행가중계]여행 재활성화의 빛과 그림자
[당진아그로랜드 태신목장]양귀비 가득한 당진여행지 추천
[충남여행]1일차/반나절 여행코스/예산 수덕사와 덕숭산 등산... 
[충남 여행코스 추천] 예당호 출렁다리&amp;음악분수로 가족여행... 
충남 가볼만한 곳 수덕사 맛집 만희 가서 한정식먹었어요~
충남 예산 덕산 메타세쿼이아길 명상치유숲길 힐링여행... 
충남 예산 예당저수지 예당호 출렁다리 야경 음악 분수쇼... 
"예당호 출렁다리 전망뷰 좋은 카페, 예당호 바로 앞 카페... "
겨울 드라이브 국내 혼자여행 당진 가볼만한곳 신리성지
[충남/예산]봉수산 수목원과 예산황새공원: 생태체험 가족여행... 
예산 수덕사 맛집 산채더덕비빔밥은 무릉도원
6월 25일 여행 / 충남 가볼만한 곳 / 예산 / 예당호 출렁다리... 
올겨울 첫눈은 언제? 밤이 긴 겨울 아름다운 충남 야경 명소 5
예당호 모노레일 예약 없음 현장 대기 팁
[충남 예산] 예산 삼국축제 일정 위치 가족 당일치기 나들이... 
[예산관광지] - 아그로랜드 태신목장 :: 동물농장과 꽃들을 함께... 
꼭 가보고 싶은 한국관광공사 추천 국내여행지 1탄!
구공 신상카페 예산 카페둔리 주말데이트코스 예산 가볼만한곳
어버이날 여행 갈곳.....^^ 여기 어때?-(펌)
힐링하기 좋은 국내 여행지 추천
예당호 출렁다리 예당 저수지 충남 예산 여행 멋진 풍경
"[예산시장 먹거리] 고소하고 달달한 애플파이 맛집, 사과당"
[예산여행지] 오늘 한번  천천히 걸어보자...느린꼬부랑길
&lt;예산&gt; 충남 당일치기 여행 예산 전망 맛집 산행명소 - 가야산... 
"백종원 예산 시장 맛집 방문 국수, 닭강정, 만두 맛있어요."
충남 예산하면 여기는 꼭 가보세요 예당호 출렁다리 야경
예산 가볼만한곳 겨울 산사 수덕사와 그미술관
예산 수덕사 한정식 맛집 &lt; 산촌식당 &gt; 예산 토박이 추천 찐맛집!... 
우리 국민들이 직접 추천한 숨은 관광지를 소개합니다
예산 소식지 '예산'에서 만나는 일산이수정
충청도 여행 가볼만한곳 : 예산 수선화 추사 김정희 선생 고택
&lt;예산&gt; 충남 예산 가볼만한곳 베스트5 당일치기 여행코스
"끝이지 않는 바가지 논란, 소비자 외면 전에 대책을 강구해야."
백종원의 맛남의 광장 촬영지 예산시장에서 맛본 예산8미... 
초여름 ‘슬로시티’ 충남 예산을 찾는 5가지 이유 [투어노트]... 
[한국재무센터]어디 갈까? 뜨끈~한 국내 온천 여행지
예산 아이들과 가볼만한 곳 윤봉길의사기념관
예산상설시장 : 오만원으로 선봉국수 고덕불고기 낙원약과... 
예산 아이들과 가볼만한곳 내포보부상촌 전통문화테마파크
겨울여행지 '예당호 모노레일'
예산여행 100선 45 목가적인 풍경을 담은 아그로랜드태신목장
예산 가볼만한 곳 황새공원 맛집
&lt;예산&gt; 충남 당일치기 여행 예산 캠핑 야영장 천국 - 예당호... 
충남 예산 가는법 버스시간표와 주요관광지
충남가볼만한곳 예산여행... 홍북식당 / 충남 드라이브코스
예산 고양이카페 '낭랑카페' 깔끔하고 특별한 체험을 할 수 있는... 
충남여행  예산 가볼만한곳  예당호 출렁다리
충남 가볼만한곳 예산황새공원에서 황새를 만나다
"스플라스리솜 워터파크 할인, 덕산 리솜 스파캐슬"
"낮고 작은 마을들이 있는 충남 예산, 당진 여행 맛집[사과나무]"
"예산 가볼만한 곳(백종원 예산시장, 예당호 모노레일... "
"추운 겨울, 몸과 마음을 녹이는 국내 온천 명소"
직접 다녀온 충남 1박2일 여행코스
[여행지-추사고택] 어릴적 소풍을 자주가던 추사 김정희 선생... 
"서울에서 엎어지면 코 닿는 청정 자연 속으로, 충남 1박2일... "
&lt;예산&gt; 충남 가볼만한곳 드라이브 코스 예산 택시투어 여행
2. 석가탄신일 사찰여행지_충청.강원도
예산여행 가장 출렁다리 예당호  긴 국내에서 국내여행
충남 백종원 예산 삽교 곱창거리 매장안내 큰마루곱창 메뉴... 
"아그로랜드 태신목장, 당진 놀거리 여행코스 추천"
당진 가볼만한곳 솔뫼성지 삽교호 관광지 당일치기 여행
스플라스 온천 워터파크에서 즐긴 겨울 스파
천장호출렁다리 천장호둘레길칠갑산 예당호출렁다리... 
&lt;예산&gt; 충남 드라이브 코스 예산 야경 명소 - 예당호 음악분수
[충남 당진/예산] 입장료는 비싸지만 그만큼 볼게 많아 하루가... 
추사체 글쓰기로 유명한 김정희 숨결이 있는 추사김정희선생 고택
"&lt;충남여행, 충남가볼만한곳&gt; 충남 예산 _ 추사 김정희 선생 고택"
충남당진 아그로랜드태신목장 수레국화꽃밭 아이와가볼만한곳... 
꽃무릇 가득 피어나는 예당국민관광지
예산시장 근처 온천단지에 있는 숙소 '온연 프라이빗 빌라'
[충남 예산] 가족과 즐기기 좋은 워터파크&amp;실내스파 스플라스 리솜
주말에 다녀온 당진 &quot;아그로랜드 태신목장&quot; 아름다운... 
예산 가볼만한곳 예당호 모노레일 예약 운영시간 요금 웨이팅
겹벚꽃 보러 가세요
내포보부상촌에서 즐거운 여름을 보내세요
충남 예산 대흥 힐링 가을여행 다녀왔지요
[예산여행지] 우리나라에 딱 다섯그루만 현존해있는 하얀색... 
예당호 음악분수 출렁다리 낮과 야경 시간
[당진여행] 우렁이박사-아그로랜드-삽교호놀이동산... 
[국내 여행] 예산 여행지 :: 코스모스 천국 '아그로랜드 태신목장'
"장 본 김에 가을여행 (예산 시장, 서산 가을 개심사)"
철새가 찾아온 예당호느린호수길의 여유로움
★[충남/예산여행]→예산수덕사IC+생활의달인/6시내고향에... 
"&lt;여행&gt;지친 마음 잠시 쉬어가기, 충남 예산•당진 여행코스... "
"태안여행  2일차,   안면도 쥬라기박물관, 간월암과... "
충청도 예산 여행 / 예당호 중앙생태공원 (with.능소화 연꽃)
겨울에 가기 좋은 국내 온천 여행지 5곳!
의좋은형제 가을철 충남축제 가볼만한 곳으로 추천해요
스마트폰으로 즐기는 조선시대 보부상 과몰입 여행지를... 
대한민국온천대축제-덕산온천
"충남 당진 당일치기 여행 / 아그로랜드 태신목장, 신리성지... "
아이와 함께 예산 가볼 만한 곳 - 수덕사
고즈넉한 사찰 아름다운 한국의 미 예산 여행 수덕사
예산 가볼만한곳:: 수선화 '추사고택' 입장료 '백설농부' 카페
"백종원시장 :: 예산 상설 시장 // 예당호 빛축제, 출렁다리... "
[추석연휴 '숨겨진 여행지' ①충남편] 청양 꽃물결에 빠져 볼까요?
부처님 오신 날 기념 &lt;방구석 사찰 여행 5선&gt;
"[예산 카페] 다양한 빵과 커피 그리고 정이 있는, 읍내빵다방"
【예산맛집】 메기 매운탕 전문점인 예산에 있는 '양어장집... 
"덕산맛집, 단물곤물 백숙 맛있게 먹고 왔어여~"
충남 가볼만한곳 가을축제 예산 황토사과축제 종합운동장... 
[예산] 예산 관광지 여행 예당호 출렁다리
[내포보부상촌]아이와 함께하는 여행지로 떠나자!
당진연꽃 / 합덕제 수변공원연꽃 합덕성당  / 충남드라이브코스
부모님과 국내여행 예산 덕산 스플라스 리솜 리조트 워터파크... 
놓치면 아쉬워요! '특별여행주간'동안 특별한 보통날 보내기♬
충남 예산 여행  : 삼국축제 즐기고 주변 관광지 둘러보기... 
가을 당일치기 여행:: 충남 예산 [예당호 모노레일 출렁다리]
[국내여행] 당일치기 여행으로 좋은 충남 당진 가볼 만한 곳 추천 !
"충청도 가을 여행, 예산 가볼만한 곳, 예산시장과 함께 가볼만한... "
덕숭산 수덕사 맛집 | 중앙산채명가(구)중앙식당 더덕구이... 
"아이랑 가볼만한 곳, 국내 온천여행 추천!"
오늘 내포 보부상촌을 열었어요
펜펜의 나홀로 여정 :: 대규모 연꽃단지 품은 예산 예당호... 
전국 꽃놀이 명소
아산 맛집 베스트 10 추천! (ft. 충남 여행)
&lt;예산&gt; 충남 아이와 가볼만한곳 예산 힐링여행 - 황새공원
국내 가족 온천 추천 예산 스플라스 리솜 객실 안내 및... 
"예산, 추사고택"
충남 예산 가볼만한곳 힐링 체험여행 의좋은형제공원
"[예산 카페] 예산 예당호 예당저수지뷰 카페 추천 , 화이트하우스"
충남여행 한국관광100선 예당호 출렁다리 음악분수 느린호수길
여름 가족여행지 예산 스플라스리솜 스테이타워 S25 콘도형
여가거기유 예산막걸리 골목양조장
"당진 가볼만한 곳) 아그로랜드 태신목장, 수레국화, 개양귀비... "
백종원 예산시장 1편 _당일치기 여행! 신광정육점 금오 바베큐... 
&lt;예산&gt; 서울 근교 당일치기 여행 충남 예산 볼거리 - 내포보부상촌
겨울 국내 온천 여행지 추천 덕산 스플라스 리솜 스파
서산 맛집 추천 베스트 7 (ft. 충남 여행)
[2019년 10월]1박2일 예산여행/2일차/충남여행... 
충남예산60년전통장터소머리국밥향토음식tv방송예당저수지출... 
[추천1_사찰순례-사찰여행지] 조계종 25교구 본사
우리 문화유산 여행지 베스트 10
국내 노천온천 덕산 스플라스 리솜 리조트 겨울여행 즐겨보자!
예산 덕산 스파뷰호텔 사랑채 이용후기
충청도 예산 가볼만한곳 / 봉수산자연휴양림. 황새공원... 
&lt;예산&gt; 충남 아이와 가볼만한곳 예산 힐링여행-추사... 
당진 아그로랜드 태신목장 가족여행지로 굿~!
충남 예산여행 가족함께 농촌체험여행 예당호 출렁다리음악분수
추운 겨울 몸과 마음을 녹이는 충남 예산 여행  :: 덕산 스플라스... 
#충청남도 예산 여행 # 봉수산 자연휴양림 딱따구리 # 예당호... 
충남 힐링 여행 예산 느린호수길 예당호 출렁다리
&lt;예산&gt; 충남 가볼만한곳 예산여행 드라이브 코스-아그로랜드... 
충남 예산 가볼만한 곳 수덕사의 설경 겨울 여행
"충남예산가볼만한곳,예당호 출렁다리 한국에서 제일 긴... "
봉수산 자연 휴양림 예당저수지 뷰가 멋진 예산여행지 가볼만한곳
"충남 태안군 안면도 가족여행!... 출렁다리, 충남 가볼 만한 곳)"
내포보부상촌 목공체험_라스토아/현장체험/충남예산
6월 추천 가볼만한곳! 햇살과 즐기는 호숫가 산책 :: 예산... 
예산 아기랑 가볼만한 곳 가을여행지 추천 전통문화체험... 
여행지추천 - 청명한 날씨와 멋진 암릉이 함께한 홍성... 
&lt;예산&gt; 충남 아이와 가볼만한곳 예산여행 캠핑천국 - 봉수산수목원
겨울철 여행지의 매력 '덕산 리솜 스파캐슬' 온천
예산 가볼만한곳 예산시장 백종원거리 방문후기 주차장 맛집... 
예산 여행 내포보부상촌 아이와 가볼만한곳 가족여행지 w.... 
한국문인인장박물관 에서 인장 보고 가세요
오감만족 국내여행으로 좋은 찾아가는 양조장 30곳
예당호출렁다리 느린호수길 길 예산 걷기좋은길 추천합니다
"충남 덕산, &quot;역사 속에서 먹고, 걷고, 헤엄치다&quot; [콘텐츠 제작... "
&lt;예산&gt; 충남 아이와 가볼만한곳 예산 언택트여행 - 내포보부상촌
예산역 예산역 열차 시간표 예당호출렁다리 다녀오세요
산책하기 좋은 예산의 명소(feat. 충남 예산 예당호 출렁다리)
&lt;반려견동반&gt;예산 나들이 - 우리나라 제일 긴 예당호 출렁다리
코로나로 지친 마음을 달래줄 국내 힐링 여행지 3
[트래블리더 팸투어] 충남을 제대로 느낄 수 있는 알찬 힐링... 
아이들과 가볼만한곳 가을에 예산온천축제
"충남여행, 백종원 거리 예산 시장 푸짐한 먹거리 솔직후기"
